q 15387680:15387892, ack 8929, win 501, length 212
15:49:46.192570 IP ubuntu-s-1vcpu-1gb-tor1-01.ssh > cpea84e3f5bc443-cma84e3f5bc440.cpe.net.fido.ca.51942: Flags [P.], seq 15387892:15388104, ack 8929, win 501, length 212
15:49:46.192624 IP ubuntu-s-1vcpu-1gb-tor1-01.ssh > cpea84e3f5bc443-cma84e3f5bc440.cpe.net.fido.ca.51942: Flags [P.], seq 15388104:15388316, ack 8929, win 501, length 212
15:49:46.192675 IP ubuntu-s-1vcpu-1gb-tor1-01.ssh > cpea84e3f5bc443-cma84e3f5bc440.cpe.net.fido.ca.51942: Flags [P.], seq 15388316:15388528, ack 8929, win 501, length 212
15:49:46.192723 IP ubuntu-s-1vcpu-1gb-tor1-01.ssh > cpea84e3f5bc443-cma84e3f5bc440.cpe.net.fido.ca.51942: Flags [P.], seq 15388528:15388740, ack 8929, win 501, length 212
15:49:46.192787 IP ubuntu-s-1vcpu-1gb-tor1-01.ssh > cpea84e3f5bc443-cma84e3f5bc440.cpe.net.fido.ca.51942: Flags [P.], seq 15388740:15388952, ack 8929, win 501, length 212
15:49:46.192867 IP ubuntu-s-1vcpu-1gb-tor1-01.ssh > cpea84e3f5bc443-cma84e3f5bc440.cpe.net.fido.ca.51942: Flags [P.], seq 15388952:15389164, ack 8929, win 501, length 212
15:49:46.192924 IP ubuntu-s-1vcpu-1gb-tor1-01.ssh > cpea84e3f5bc443-cma84e3f5bc440.cpe.net.fido.ca.51942: Flags [P.], seq 15389164:15389376, ack 8929, win 501, length 212
15:49:46.192974 IP ubuntu-s-1vcpu-1gb-tor1-01.ssh > cpea84e3f5bc443-cma84e3f5bc440.cpe.net.fido.ca.51942: Flags [P.], seq 15389376:15389588, ack 8929, win 501, length 212
15:49:46.193023 IP ubuntu-s-1vcpu-1gb-tor1-01.ssh > cpea84e3f5bc443-cma84e3f5bc440.cpe.net.fido.ca.51942: Flags [P.], seq 15389588:15389800, ack 8929, win 501, length 212
15:49:46.193122 IP ubuntu-s-1vcpu-1gb-tor1-01.ssh > cpea84e3f5bc443-cma84e3f5bc440.cpe.net.fido.ca.51942: Flags [P.], seq 15389800:15390012, ack 8929, win 501, length 212
15:49:46.193189 IP ubuntu-s-1vcpu-1gb-tor1-01.ssh > cpea84e3f5bc443-cma84e3f5bc440.cpe.net.fido.ca.51942: Flags [P.], seq 15390012:15390224, ack 8929, win 501, length 212
15:49:46.193238 IP ubuntu-s-1vcpu-1gb-tor1-01.ssh > cpea84e3f5bc443-cma84e3f5bc440.cpe.net.fido.ca.51942: Flags [P.], seq 15390224:15390436, ack 8929, win 501, length 212
15:49:46.193286 IP ubuntu-s-1vcpu-1gb-tor1-01.ssh > cpea84e3f5bc443-cma84e3f5bc440.cpe.net.fido.ca.51942: Flags [P.], seq 15390436:15390648, ack 8929, win 501, length 212
15:49:46.193335 IP ubuntu-s-1vcpu-1gb-tor1-01.ssh > cpea84e3f5bc443-cma84e3f5bc440.cpe.net.fido.ca.51942: Flags [P.], seq 15390648:15390860, ack 8929, win 501, length 212
15:49:46.193386 IP ubuntu-s-1vcpu-1gb-tor1-01.ssh > cpea84e3f5bc443-cma84e3f5bc440.cpe.net.fido.ca.51942: Flags [P.], seq 15390860:15391072, ack 8929, win 501, length 212
15:49:46.193434 IP ubuntu-s-1vcpu-1gb-tor1-01.ssh > cpea84e3f5bc443-cma84e3f5bc440.cpe.net.fido.ca.51942: Flags [P.], seq 15391072:15391284, ack 8929, win 501, length 212
15:49:46.193482 IP ubuntu-s-1vcpu-1gb-tor1-01.ssh > cpea84e3f5bc443-cma84e3f5bc440.cpe.net.fido.ca.51942: Flags [P.], seq 15391284:15391496, ack 8929, win 501, length 212
15:49:46.193537 IP ubuntu-s-1vcpu-1gb-tor1-01.ssh > cpea84e3f5bc443-cma84e3f5bc440.cpe.net.fido.ca.51942: Flags [P.], seq 15391496:15391708, ack 8929, win 501, length 212
15:49:46.193586 IP ubuntu-s-1vcpu-1gb-tor1-01.ssh > cpea84e3f5bc443-cma84e3f5bc440.cpe.net.fido.ca.51942: Flags [P.], seq 15391708:15391920, ack 8929, win 501, length 212
15:49:46.193646 IP ubuntu-s-1vcpu-1gb-tor1-01.ssh > cpea84e3f5bc443-cma84e3f5bc440.cpe.net.fido.ca.51942: Flags [P.], seq 15391920:15392132, ack 8929, win 501, length 212
15:49:46.193697 IP ubuntu-s-1vcpu-1gb-tor1-01.ssh > cpea84e3f5bc443-cma84e3f5bc440.cpe.net.fido.ca.51942: Flags [P.], seq 15392132:15392344, ack 8929, win 501, length 212
15:49:46.193747 IP ubuntu-s-1vcpu-1gb-tor1-01.ssh > cpea84e3f5bc443-cma84e3f5bc440.cpe.net.fido.ca.51942: Flags [P.], seq 15392344:15392556, ack 8929, win 501, length 212
15:49:46.193801 IP ubuntu-s-1vcpu-1gb-tor1-01.ssh > cpea84e3f5bc443-cma84e3f5bc440.cpe.net.fido.ca.51942: Flags [P.], seq 15392556:15392768, ack 8929, win 501, length 212
15:49:46.193876 IP ubuntu-s-1vcpu-1gb-tor1-01.ssh > cpea84e3f5bc443-cma84e3f5bc440.cpe.net.fido.ca.51942: Flags [P.], seq 15392768:15392980, ack 8929, win 501, length 212
15:49:46.193932 IP ubuntu-s-1vcpu-1gb-tor1-01.ssh > cpea84e3f5bc443-cma84e3f5bc440.cpe.net.fido.ca.51942: Flags [P.], seq 15392980:15393192, ack 8929, win 501, length 212
15:49:46.193987 IP ubuntu-s-1vcpu-1gb-tor1-01.ssh > cpea84e3f5bc443-cma84e3f5bc440.cpe.net.fido.ca.51942: Flags [P.], seq 15393192:15393404, ack 8929, win 501, length 212
15:49:46.194071 IP ubuntu-s-1vcpu-1gb-tor1-01.ssh > cpea84e3f5bc443-cma84e3f5bc440.cpe.net.fido.ca.51942: Flags [P.], seq 15393404:15393616, ack 8929, win 501, length 212
15:49:46.194126 IP ubuntu-s-1vcpu-1gb-tor1-01.ssh > cpea84e3f5bc443-cma84e3f5bc440.cpe.net.fido.ca.51942: Flags [P.], seq 15393616:15393828, ack 8929, win 501, length 212
15:49:46.194223 IP ubuntu-s-1vcpu-1gb-tor1-01.ssh > cpea84e3f5bc443-cma84e3f5bc440.cpe.net.fido.ca.51942: Flags [P.], seq 15393828:15394040, ack 8929, win 501, length 212
15:49:46.194297 IP ubuntu-s-1vcpu-1gb-tor1-01.ssh > cpea84e3f5bc443-cma84e3f5bc440.cpe.net.fido.ca.51942: Flags [P.], seq 15394040:15394252, ack 8929, win 501, length 212
15:49:46.194369 IP ubuntu-s-1vcpu-1gb-tor1-01.ssh > cpea84e3f5bc443-cma84e3f5bc440.cpe.net.fido.ca.51942: Flags [P.], seq 15394252:15394464, ack 8929, win 501, length 212
15:49:46.194423 IP ubuntu-s-1vcpu-1gb-tor1-01.ssh > cpea84e3f5bc443-cma84e3f5bc440.cpe.net.fido.ca.51942: Flags [P.], seq 15394464:15394676, ack 8929, win 501, length 212
15:49:46.194508 IP ubuntu-s-1vcpu-1gb-tor1-01.ssh > cpea84e3f5bc443-cma84e3f5bc440.cpe.net.fido.ca.51942: Flags [P.], seq 15394676:15394888, ack 8929, win 501, length 212
15:49:46.194573 IP ubuntu-s-1vcpu-1gb-tor1-01.ssh > cpea84e3f5bc443-cma84e3f5bc440.cpe.net.fido.ca.51942: Flags [P.], seq 15394888:15395100, ack 8929, win 501, length 212
15:49:46.194630 IP ubuntu-s-1vcpu-1gb-tor1-01.ssh > cpea84e3f5bc443-cma84e3f5bc440.cpe.net.fido.ca.51942: Flags [P.], seq 15395100:15395312, ack 8929, win 501, length 212
15:49:46.194684 IP ubuntu-s-1vcpu-1gb-tor1-01.ssh > cpea84e3f5bc443-cma84e3f5bc440.cpe.net.fido.ca.51942: Flags [P.], seq 15395312:15395524, ack 8929, win 501, length 212
15:49:46.194738 IP ubuntu-s-1vcpu-1gb-tor1-01.ssh > cpea84e3f5bc443-cma84e3f5bc440.cpe.net.fido.ca.51942: Flags [P.], seq 15395524:15395736, ack 8929, win 501, length 212
15:49:46.194791 IP ubuntu-s-1vcpu-1gb-tor1-01.ssh > cpea84e3f5bc443-cma84e3f5bc440.cpe.net.fido.ca.51942: Flags [P.], seq 15395736:15395948, ack 8929, win 501, length 212
15:49:46.194838 IP ubuntu-s-1vcpu-1gb-tor1-01.ssh > cpea84e3f5bc443-cma84e3f5bc440.cpe.net.fido.ca.51942: Flags [P.], seq 15395948:15396160, ack 8929, win 501, length 212
15:49:46.195093 IP cpea84e3f5bc443-cma84e3f5bc440.cpe.net.fido.ca.51942 > ubuntu-s-1vcpu-1gb-tor1-01.ssh: Flags [.], ack 15362232, win 513, length 0
15:49:46.195130 IP ubuntu-s-1vcpu-1gb-tor1-01.ssh > cpea84e3f5bc443-cma84e3f5bc440.cpe.net.fido.ca.51942: Flags [P.], seq 15396160:15396372, ack 8929, win 501, length 212
15:49:46.195225 IP ubuntu-s-1vcpu-1gb-tor1-01.ssh > cpea84e3f5bc443-cma84e3f5bc440.cpe.net.fido.ca.51942: Flags [P.], seq 15396372:15396728, ack 8929, win 501, length 356
15:49:46.195307 IP ubuntu-s-1vcpu-1gb-tor1-01.ssh > cpea84e3f5bc443-cma84e3f5bc440.cpe.net.fido.ca.51942: Flags [P.], seq 15396728:15396940, ack 8929, win 501, length 212
15:49:46.195372 IP ubuntu-s-1vcpu-1gb-tor1-01.ssh > cpea84e3f5bc443-cma84e3f5bc440.cpe.net.fido.ca.51942: Flags [P.], seq 15396940:15397152, ack 8929, win 501, length 212
15:49:46.195436 IP ubuntu-s-1vcpu-1gb-tor1-01.ssh > cpea84e3f5bc443-cma84e3f5bc440.cpe.net.fido.ca.51942: Flags [P.], seq 15397152:15397364, ack 8929, win 501, length 212
15:49:46.195511 IP ubuntu-s-1vcpu-1gb-tor1-01.ssh > cpea84e3f5bc443-cma84e3f5bc440.cpe.net.fido.ca.51942: Flags [P.], seq 15397364:15397576, ack 8929, win 501, length 212
15:49:46.195568 IP ubuntu-s-1vcpu-1gb-tor1-01.ssh > cpea84e3f5bc443-cma84e3f5bc440.cpe.net.fido.ca.51942: Flags [P.], seq 15397576:15397788, ack 8929, win 501, length 212
15:49:46.195618 IP ubuntu-s-1vcpu-1gb-tor1-01.ssh > cpea84e3f5bc443-cma84e3f5bc440.cpe.net.fido.ca.51942: Flags [P.], seq 15397788:15398000, ack 8929, win 501, length 212
15:49:46.195670 IP ubuntu-s-1vcpu-1gb-tor1-01.ssh > cpea84e3f5bc443-cma84e3f5bc440.cpe.net.fido.ca.51942: Flags [P.], seq 15398000:15398212, ack 8929, win 501, length 212
15:49:46.195718 IP ubuntu-s-1vcpu-1gb-tor1-01.ssh > cpea84e3f5bc443-cma84e3f5bc440.cpe.net.fido.ca.51942: Flags [P.], seq 15398212:15398424, ack 8929, win 501, length 212
15:49:46.195770 IP ubuntu-s-1vcpu-1gb-tor1-01.ssh > cpea84e3f5bc443-cma84e3f5bc440.cpe.net.fido.ca.51942: Flags [P.], seq 15398424:15398636, ack 8929, win 501, length 212
15:49:46.195817 IP ubuntu-s-1vcpu-1gb-tor1-01.ssh > cpea84e3f5bc443-cma84e3f5bc440.cpe.net.fido.ca.51942: Flags [P.], seq 15398636:15398848, ack 8929, win 501, length 212
15:49:46.195867 IP ubuntu-s-1vcpu-1gb-tor1-01.ssh > cpea84e3f5bc443-cma84e3f5bc440.cpe.net.fido.ca.51942: Flags [P.], seq 15398848:15399060, ack 8929, win 501, length 212
15:49:46.195910 IP cpea84e3f5bc443-cma84e3f5bc440.cpe.net.fido.ca.51942 > ubuntu-s-1vcpu-1gb-tor1-01.ssh: Flags [.], ack 15366192, win 509, length 0
15:49:46.195966 IP ubuntu-s-1vcpu-1gb-tor1-01.ssh > cpea84e3f5bc443-cma84e3f5bc440.cpe.net.fido.ca.51942: Flags [P.], seq 15399060:15399416, ack 8929, win 501, length 356
15:49:46.196018 IP ubuntu-s-1vcpu-1gb-tor1-01.ssh > cpea84e3f5bc443-cma84e3f5bc440.cpe.net.fido.ca.51942: Flags [P.], seq 15399416:15399628, ack 8929, win 501, length 212
15:49:46.196128 IP ubuntu-s-1vcpu-1gb-tor1-01.ssh > cpea84e3f5bc443-cma84e3f5bc440.cpe.net.fido.ca.51942: Flags [P.], seq 15399628:15399840, ack 8929, win 501, length 212
15:49:46.196189 IP ubuntu-s-1vcpu-1gb-tor1-01.ssh > cpea84e3f5bc443-cma84e3f5bc440.cpe.net.fido.ca.51942: Flags [P.], seq 15399840:15400052, ack 8929, win 501, length 212
15:49:46.196238 IP ubuntu-s-1vcpu-1gb-tor1-01.ssh > cpea84e3f5bc443-cma84e3f5bc440.cpe.net.fido.ca.51942: Flags [P.], seq 15400052:15400264, ack 8929, win 501, length 212
15:49:46.196328 IP ubuntu-s-1vcpu-1gb-tor1-01.ssh > cpea84e3f5bc443-cma84e3f5bc440.cpe.net.fido.ca.51942: Flags [P.], seq 15400264:15400476, ack 8929, win 501, length 212
15:49:46.196400 IP ubuntu-s-1vcpu-1gb-tor1-01.ssh > cpea84e3f5bc443-cma84e3f5bc440.cpe.net.fido.ca.51942: Flags [P.], seq 15400476:15400688, ack 8929, win 501, length 212
15:49:46.196482 IP ubuntu-s-1vcpu-1gb-tor1-01.ssh > cpea84e3f5bc443-cma84e3f5bc440.cpe.net.fido.ca.51942: Flags [P.], seq 15400688:15400900, ack 8929, win 501, length 212
15:49:46.196568 IP ubuntu-s-1vcpu-1gb-tor1-01.ssh > cpea84e3f5bc443-cma84e3f5bc440.cpe.net.fido.ca.51942: Flags [P.], seq 15400900:15401112, ack 8929, win 501, length 212
15:49:46.196626 IP ubuntu-s-1vcpu-1gb-tor1-01.ssh > cpea84e3f5bc443-cma84e3f5bc440.cpe.net.fido.ca.51942: Flags [P.], seq 15401112:15401324, ack 8929, win 501, length 212
15:49:46.196692 IP ubuntu-s-1vcpu-1gb-tor1-01.ssh > cpea84e3f5bc443-cma84e3f5bc440.cpe.net.fido.ca.51942: Flags [P.], seq 15401324:15401536, ack 8929, win 501, length 212
15:49:46.196748 IP ubuntu-s-1vcpu-1gb-tor1-01.ssh > cpea84e3f5bc443-cma84e3f5bc440.cpe.net.fido.ca.51942: Flags [P.], seq 15401536:15401748, ack 8929, win 501, length 212
15:49:46.196795 IP ubuntu-s-1vcpu-1gb-tor1-01.ssh > cpea84e3f5bc443-cma84e3f5bc440.cpe.net.fido.ca.51942: Flags [P.], seq 15401748:15401960, ack 8929, win 501, length 212
15:49:46.196869 IP ubuntu-s-1vcpu-1gb-tor1-01.ssh > cpea84e3f5bc443-cma84e3f5bc440.cpe.net.fido.ca.51942: Flags [P.], seq 15401960:15402172, ack 8929, win 501, length 212
15:49:46.196937 IP ubuntu-s-1vcpu-1gb-tor1-01.ssh > cpea84e3f5bc443-cma84e3f5bc440.cpe.net.fido.ca.51942: Flags [P.], seq 15402172:15402384, ack 8929, win 501, length 212
15:49:46.197029 IP ubuntu-s-1vcpu-1gb-tor1-01.ssh > cpea84e3f5bc443-cma84e3f5bc440.cpe.net.fido.ca.51942: Flags [P.], seq 15402384:15402596, ack 8929, win 501, length 212
15:49:46.197127 IP ubuntu-s-1vcpu-1gb-tor1-01.ssh > cpea84e3f5bc443-cma84e3f5bc440.cpe.net.fido.ca.51942: Flags [P.], seq 15402596:15402808, ack 8929, win 501, length 212
15:49:46.197186 IP ubuntu-s-1vcpu-1gb-tor1-01.ssh > cpea84e3f5bc443-cma84e3f5bc440.cpe.net.fido.ca.51942: Flags [P.], seq 15402808:15403020, ack 8929, win 501, length 212
15:49:46.197239 IP ubuntu-s-1vcpu-1gb-tor1-01.ssh > cpea84e3f5bc443-cma84e3f5bc440.cpe.net.fido.ca.51942: Flags [P.], seq 15403020:15403232, ack 8929, win 501, length 212
15:49:46.197287 IP ubuntu-s-1vcpu-1gb-tor1-01.ssh > cpea84e3f5bc443-cma84e3f5bc440.cpe.net.fido.ca.51942: Flags [P.], seq 15403232:15403444, ack 8929, win 501, length 212
15:49:46.197338 IP ubuntu-s-1vcpu-1gb-tor1-01.ssh > cpea84e3f5bc443-cma84e3f5bc440.cpe.net.fido.ca.51942: Flags [P.], seq 15403444:15403656, ack 8929, win 501, length 212
15:49:46.197385 IP ubuntu-s-1vcpu-1gb-tor1-01.ssh > cpea84e3f5bc443-cma84e3f5bc440.cpe.net.fido.ca.51942: Flags [P.], seq 15403656:15403868, ack 8929, win 501, length 212
15:49:46.197437 IP ubuntu-s-1vcpu-1gb-tor1-01.ssh > cpea84e3f5bc443-cma84e3f5bc440.cpe.net.fido.ca.51942: Flags [P.], seq 15403868:15404080, ack 8929, win 501, length 212
15:49:46.197507 IP ubuntu-s-1vcpu-1gb-tor1-01.ssh > cpea84e3f5bc443-cma84e3f5bc440.cpe.net.fido.ca.51942: Flags [P.], seq 15404080:15404292, ack 8929, win 501, length 212
15:49:46.197602 IP ubuntu-s-1vcpu-1gb-tor1-01.ssh > cpea84e3f5bc443-cma84e3f5bc440.cpe.net.fido.ca.51942: Flags [P.], seq 15404292:15404504, ack 8929, win 501, length 212
15:49:46.197661 IP ubuntu-s-1vcpu-1gb-tor1-01.ssh > cpea84e3f5bc443-cma84e3f5bc440.cpe.net.fido.ca.51942: Flags [P.], seq 15404504:15404716, ack 8929, win 501, length 212
15:49:46.197713 IP ubuntu-s-1vcpu-1gb-tor1-01.ssh > cpea84e3f5bc443-cma84e3f5bc440.cpe.net.fido.ca.51942: Flags [P.], seq 15404716:15404928, ack 8929, win 501, length 212
15:49:46.197764 IP ubuntu-s-1vcpu-1gb-tor1-01.ssh > cpea84e3f5bc443-cma84e3f5bc440.cpe.net.fido.ca.51942: Flags [P.], seq 15404928:15405140, ack 8929, win 501, length 212
15:49:46.197811 IP ubuntu-s-1vcpu-1gb-tor1-01.ssh > cpea84e3f5bc443-cma84e3f5bc440.cpe.net.fido.ca.51942: Flags [P.], seq 15405140:15405352, ack 8929, win 501, length 212
15:49:46.197864 IP ubuntu-s-1vcpu-1gb-tor1-01.ssh > cpea84e3f5bc443-cma84e3f5bc440.cpe.net.fido.ca.51942: Flags [P.], seq 15405352:15405564, ack 8929, win 501, length 212
15:49:46.197911 IP ubuntu-s-1vcpu-1gb-tor1-01.ssh > cpea84e3f5bc443-cma84e3f5bc440.cpe.net.fido.ca.51942: Flags [P.], seq 15405564:15405776, ack 8929, win 501, length 212
15:49:46.197959 IP ubuntu-s-1vcpu-1gb-tor1-01.ssh > cpea84e3f5bc443-cma84e3f5bc440.cpe.net.fido.ca.51942: Flags [P.], seq 15405776:15405988, ack 8929, win 501, length 212
15:49:46.198006 IP ubuntu-s-1vcpu-1gb-tor1-01.ssh > cpea84e3f5bc443-cma84e3f5bc440.cpe.net.fido.ca.51942: Flags [P.], seq 15405988:15406200, ack 8929, win 501, length 212
15:49:46.198076 IP ubuntu-s-1vcpu-1gb-tor1-01.ssh > cpea84e3f5bc443-cma84e3f5bc440.cpe.net.fido.ca.51942: Flags [P.], seq 15406200:15406412, ack 8929, win 501, length 212
15:49:46.198143 IP ubuntu-s-1vcpu-1gb-tor1-01.ssh > cpea84e3f5bc443-cma84e3f5bc440.cpe.net.fido.ca.51942: Flags [P.], seq 15406412:15406624, ack 8929, win 501, length 212
15:49:46.198211 IP ubuntu-s-1vcpu-1gb-tor1-01.ssh > cpea84e3f5bc443-cma84e3f5bc440.cpe.net.fido.ca.51942: Flags [P.], seq 15406624:15406836, ack 8929, win 501, length 212
15:49:46.198280 IP ubuntu-s-1vcpu-1gb-tor1-01.ssh > cpea84e3f5bc443-cma84e3f5bc440.cpe.net.fido.ca.51942: Flags [P.], seq 15406836:15407048, ack 8929, win 501, length 212
15:49:46.198338 IP ubuntu-s-1vcpu-1gb-tor1-01.ssh > cpea84e3f5bc443-cma84e3f5bc440.cpe.net.fido.ca.51942: Flags [P.], seq 15407048:15407260, ack 8929, win 501, length 212
15:49:46.198387 IP ubuntu-s-1vcpu-1gb-tor1-01.ssh > cpea84e3f5bc443-cma84e3f5bc440.cpe.net.fido.ca.51942: Flags [P.], seq 15407260:15407472, ack 8929, win 501, length 212
15:49:46.198435 IP ubuntu-s-1vcpu-1gb-tor1-01.ssh > cpea84e3f5bc443-cma84e3f5bc440.cpe.net.fido.ca.51942: Flags [P.], seq 15407472:15407684, ack 8929, win 501, length 212
15:49:46.198482 IP ubuntu-s-1vcpu-1gb-tor1-01.ssh > cpea84e3f5bc443-cma84e3f5bc440.cpe.net.fido.ca.51942: Flags [P.], seq 15407684:15407896, ack 8929, win 501, length 212
15:49:46.198533 IP ubuntu-s-1vcpu-1gb-tor1-01.ssh > cpea84e3f5bc443-cma84e3f5bc440.cpe.net.fido.ca.51942: Flags [P.], seq 15407896:15408108, ack 8929, win 501, length 212
15:49:46.198581 IP ubuntu-s-1vcpu-1gb-tor1-01.ssh > cpea84e3f5bc443-cma84e3f5bc440.cpe.net.fido.ca.51942: Flags [P.], seq 15408108:15408320, ack 8929, win 501, length 212
15:49:46.198629 IP ubuntu-s-1vcpu-1gb-tor1-01.ssh > cpea84e3f5bc443-cma84e3f5bc440.cpe.net.fido.ca.51942: Flags [P.], seq 15408320:15408532, ack 8929, win 501, length 212
15:49:46.198676 IP ubuntu-s-1vcpu-1gb-tor1-01.ssh > cpea84e3f5bc443-cma84e3f5bc440.cpe.net.fido.ca.51942: Flags [P.], seq 15408532:15408744, ack 8929, win 501, length 212
15:49:46.198732 IP ubuntu-s-1vcpu-1gb-tor1-01.ssh > cpea84e3f5bc443-cma84e3f5bc440.cpe.net.fido.ca.51942: Flags [P.], seq 15408744:15408956, ack 8929, win 501, length 212
15:49:46.198784 IP ubuntu-s-1vcpu-1gb-tor1-01.ssh > cpea84e3f5bc443-cma84e3f5bc440.cpe.net.fido.ca.51942: Flags [P.], seq 15408956:15409168, ack 8929, win 501, length 212
15:49:46.198836 IP ubuntu-s-1vcpu-1gb-tor1-01.ssh > cpea84e3f5bc443-cma84e3f5bc440.cpe.net.fido.ca.51942: Flags [P.], seq 15409168:15409380, ack 8929, win 501, length 212
15:49:46.198887 IP ubuntu-s-1vcpu-1gb-tor1-01.ssh > cpea84e3f5bc443-cma84e3f5bc440.cpe.net.fido.ca.51942: Flags [P.], seq 15409380:15409592, ack 8929, win 501, length 212
15:49:46.198936 IP ubuntu-s-1vcpu-1gb-tor1-01.ssh > cpea84e3f5bc443-cma84e3f5bc440.cpe.net.fido.ca.51942: Flags [P.], seq 15409592:15409804, ack 8929, win 501, length 212
15:49:46.199022 IP ubuntu-s-1vcpu-1gb-tor1-01.ssh > cpea84e3f5bc443-cma84e3f5bc440.cpe.net.fido.ca.51942: Flags [P.], seq 15409804:15410016, ack 8929, win 501, length 212
15:49:46.199075 IP ubuntu-s-1vcpu-1gb-tor1-01.ssh > cpea84e3f5bc443-cma84e3f5bc440.cpe.net.fido.ca.51942: Flags [P.], seq 15410016:15410228, ack 8929, win 501, length 212
15:49:46.199148 IP ubuntu-s-1vcpu-1gb-tor1-01.ssh > cpea84e3f5bc443-cma84e3f5bc440.cpe.net.fido.ca.51942: Flags [P.], seq 15410228:15410440, ack 8929, win 501, length 212
15:49:46.199215 IP ubuntu-s-1vcpu-1gb-tor1-01.ssh > cpea84e3f5bc443-cma84e3f5bc440.cpe.net.fido.ca.51942: Flags [P.], seq 15410440:15410652, ack 8929, win 501, length 212
15:49:46.199267 IP ubuntu-s-1vcpu-1gb-tor1-01.ssh > cpea84e3f5bc443-cma84e3f5bc440.cpe.net.fido.ca.51942: Flags [P.], seq 15410652:15410864, ack 8929, win 501, length 212
15:49:46.199316 IP ubuntu-s-1vcpu-1gb-tor1-01.ssh > cpea84e3f5bc443-cma84e3f5bc440.cpe.net.fido.ca.51942: Flags [P.], seq 15410864:15411076, ack 8929, win 501, length 212
15:49:46.199392 IP ubuntu-s-1vcpu-1gb-tor1-01.ssh > cpea84e3f5bc443-cma84e3f5bc440.cpe.net.fido.ca.51942: Flags [P.], seq 15411076:15411288, ack 8929, win 501, length 212
15:49:46.199475 IP ubuntu-s-1vcpu-1gb-tor1-01.ssh > cpea84e3f5bc443-cma84e3f5bc440.cpe.net.fido.ca.51942: Flags [P.], seq 15411288:15411500, ack 8929, win 501, length 212
15:49:46.199547 IP ubuntu-s-1vcpu-1gb-tor1-01.ssh > cpea84e3f5bc443-cma84e3f5bc440.cpe.net.fido.ca.51942: Flags [P.], seq 15411500:15411712, ack 8929, win 501, length 212
15:49:46.199603 IP ubuntu-s-1vcpu-1gb-tor1-01.ssh > cpea84e3f5bc443-cma84e3f5bc440.cpe.net.fido.ca.51942: Flags [P.], seq 15411712:15411924, ack 8929, win 501, length 212
15:49:46.199652 IP ubuntu-s-1vcpu-1gb-tor1-01.ssh > cpea84e3f5bc443-cma84e3f5bc440.cpe.net.fido.ca.51942: Flags [P.], seq 15411924:15412136, ack 8929, win 501, length 212
15:49:46.199705 IP ubuntu-s-1vcpu-1gb-tor1-01.ssh > cpea84e3f5bc443-cma84e3f5bc440.cpe.net.fido.ca.51942: Flags [P.], seq 15412136:15412348, ack 8929, win 501, length 212
15:49:46.199757 IP ubuntu-s-1vcpu-1gb-tor1-01.ssh > cpea84e3f5bc443-cma84e3f5bc440.cpe.net.fido.ca.51942: Flags [P.], seq 15412348:15412560, ack 8929, win 501, length 212
15:49:46.199806 IP ubuntu-s-1vcpu-1gb-tor1-01.ssh > cpea84e3f5bc443-cma84e3f5bc440.cpe.net.fido.ca.51942: Flags [P.], seq 15412560:15412772, ack 8929, win 501, length 212
15:49:46.199856 IP ubuntu-s-1vcpu-1gb-tor1-01.ssh > cpea84e3f5bc443-cma84e3f5bc440.cpe.net.fido.ca.51942: Flags [P.], seq 15412772:15412984, ack 8929, win 501, length 212
15:49:46.199904 IP ubuntu-s-1vcpu-1gb-tor1-01.ssh > cpea84e3f5bc443-cma84e3f5bc440.cpe.net.fido.ca.51942: Flags [P.], seq 15412984:15413196, ack 8929, win 501, length 212
15:49:46.199953 IP ubuntu-s-1vcpu-1gb-tor1-01.ssh > cpea84e3f5bc443-cma84e3f5bc440.cpe.net.fido.ca.51942: Flags [P.], seq 15413196:15413408, ack 8929, win 501, length 212
15:49:46.200000 IP ubuntu-s-1vcpu-1gb-tor1-01.ssh > cpea84e3f5bc443-cma84e3f5bc440.cpe.net.fido.ca.51942: Flags [P.], seq 15413408:15413620, ack 8929, win 501, length 212
15:49:46.200051 IP ubuntu-s-1vcpu-1gb-tor1-01.ssh > cpea84e3f5bc443-cma84e3f5bc440.cpe.net.fido.ca.51942: Flags [P.], seq 15413620:15413832, ack 8929, win 501, length 212
15:49:46.200155 IP ubuntu-s-1vcpu-1gb-tor1-01.ssh > cpea84e3f5bc443-cma84e3f5bc440.cpe.net.fido.ca.51942: Flags [P.], seq 15413832:15414044, ack 8929, win 501, length 212
15:49:46.200220 IP ubuntu-s-1vcpu-1gb-tor1-01.ssh > cpea84e3f5bc443-cma84e3f5bc440.cpe.net.fido.ca.51942: Flags [P.], seq 15414044:15414256, ack 8929, win 501, length 212
15:49:46.200270 IP ubuntu-s-1vcpu-1gb-tor1-01.ssh > cpea84e3f5bc443-cma84e3f5bc440.cpe.net.fido.ca.51942: Flags [P.], seq 15414256:15414468, ack 8929, win 501, length 212
15:49:46.200347 IP ubuntu-s-1vcpu-1gb-tor1-01.ssh > cpea84e3f5bc443-cma84e3f5bc440.cpe.net.fido.ca.51942: Flags [P.], seq 15414468:15414680, ack 8929, win 501, length 212
15:49:46.200434 IP ubuntu-s-1vcpu-1gb-tor1-01.ssh > cpea84e3f5bc443-cma84e3f5bc440.cpe.net.fido.ca.51942: Flags [P.], seq 15414680:15414892, ack 8929, win 501, length 212
15:49:46.200515 IP ubuntu-s-1vcpu-1gb-tor1-01.ssh > cpea84e3f5bc443-cma84e3f5bc440.cpe.net.fido.ca.51942: Flags [P.], seq 15414892:15415104, ack 8929, win 501, length 212
15:49:46.200599 IP cpea84e3f5bc443-cma84e3f5bc440.cpe.net.fido.ca.51942 > ubuntu-s-1vcpu-1gb-tor1-01.ssh: Flags [P.], seq 8929:8965, ack 15366192, win 509, length 36
15:49:46.200599 IP cpea84e3f5bc443-cma84e3f5bc440.cpe.net.fido.ca.51942 > ubuntu-s-1vcpu-1gb-tor1-01.ssh: Flags [.], ack 15378208, win 513, length 0
15:49:46.200599 IP cpea84e3f5bc443-cma84e3f5bc440.cpe.net.fido.ca.51942 > ubuntu-s-1vcpu-1gb-tor1-01.ssh: Flags [.], ack 15392556, win 509, length 0
15:49:46.200613 IP ubuntu-s-1vcpu-1gb-tor1-01.ssh > cpea84e3f5bc443-cma84e3f5bc440.cpe.net.fido.ca.51942: Flags [P.], seq 15415104:15415316, ack 8929, win 501, length 212
15:49:46.200779 IP ubuntu-s-1vcpu-1gb-tor1-01.ssh > cpea84e3f5bc443-cma84e3f5bc440.cpe.net.fido.ca.51942: Flags [P.], seq 15415316:15415992, ack 8965, win 501, length 676
15:49:46.200865 IP ubuntu-s-1vcpu-1gb-tor1-01.ssh > cpea84e3f5bc443-cma84e3f5bc440.cpe.net.fido.ca.51942: Flags [P.], seq 15415992:15416204, ack 8965, win 501, length 212
15:49:46.200944 IP ubuntu-s-1vcpu-1gb-tor1-01.ssh > cpea84e3f5bc443-cma84e3f5bc440.cpe.net.fido.ca.51942: Flags [P.], seq 15416204:15416416, ack 8965, win 501, length 212
15:49:46.201039 IP ubuntu-s-1vcpu-1gb-tor1-01.ssh > cpea84e3f5bc443-cma84e3f5bc440.cpe.net.fido.ca.51942: Flags [P.], seq 15416416:15416628, ack 8965, win 501, length 212
15:49:46.201135 IP ubuntu-s-1vcpu-1gb-tor1-01.ssh > cpea84e3f5bc443-cma84e3f5bc440.cpe.net.fido.ca.51942: Flags [P.], seq 15416628:15416840, ack 8965, win 501, length 212
15:49:46.202008 IP ubuntu-s-1vcpu-1gb-tor1-01.ssh > cpea84e3f5bc443-cma84e3f5bc440.cpe.net.fido.ca.51942: Flags [P.], seq 15416840:15417052, ack 8965, win 501, length 212
15:49:46.202141 IP ubuntu-s-1vcpu-1gb-tor1-01.ssh > cpea84e3f5bc443-cma84e3f5bc440.cpe.net.fido.ca.51942: Flags [P.], seq 15417052:15417264, ack 8965, win 501, length 212
15:49:46.202259 IP ubuntu-s-1vcpu-1gb-tor1-01.ssh > cpea84e3f5bc443-cma84e3f5bc440.cpe.net.fido.ca.51942: Flags [P.], seq 15417264:15417476, ack 8965, win 501, length 212
15:49:46.202361 IP ubuntu-s-1vcpu-1gb-tor1-01.ssh > cpea84e3f5bc443-cma84e3f5bc440.cpe.net.fido.ca.51942: Flags [P.], seq 15417476:15417688, ack 8965, win 501, length 212
15:49:46.202455 IP ubuntu-s-1vcpu-1gb-tor1-01.ssh > cpea84e3f5bc443-cma84e3f5bc440.cpe.net.fido.ca.51942: Flags [P.], seq 15417688:15417900, ack 8965, win 501, length 212
15:49:46.202540 IP ubuntu-s-1vcpu-1gb-tor1-01.ssh > cpea84e3f5bc443-cma84e3f5bc440.cpe.net.fido.ca.51942: Flags [P.], seq 15417900:15418112, ack 8965, win 501, length 212
15:49:46.202617 IP ubuntu-s-1vcpu-1gb-tor1-01.ssh > cpea84e3f5bc443-cma84e3f5bc440.cpe.net.fido.ca.51942: Flags [P.], seq 15418112:15418324, ack 8965, win 501, length 212
15:49:46.202698 IP ubuntu-s-1vcpu-1gb-tor1-01.ssh > cpea84e3f5bc443-cma84e3f5bc440.cpe.net.fido.ca.51942: Flags [P.], seq 15418324:15418536, ack 8965, win 501, length 212
15:49:46.202782 IP ubuntu-s-1vcpu-1gb-tor1-01.ssh > cpea84e3f5bc443-cma84e3f5bc440.cpe.net.fido.ca.51942: Flags [P.], seq 15418536:15418748, ack 8965, win 501, length 212
15:49:46.202913 IP ubuntu-s-1vcpu-1gb-tor1-01.ssh > cpea84e3f5bc443-cma84e3f5bc440.cpe.net.fido.ca.51942: Flags [P.], seq 15418748:15418960, ack 8965, win 501, length 212
15:49:46.203021 IP ubuntu-s-1vcpu-1gb-tor1-01.ssh > cpea84e3f5bc443-cma84e3f5bc440.cpe.net.fido.ca.51942: Flags [P.], seq 15418960:15419172, ack 8965, win 501, length 212
15:49:46.203104 IP ubuntu-s-1vcpu-1gb-tor1-01.ssh > cpea84e3f5bc443-cma84e3f5bc440.cpe.net.fido.ca.51942: Flags [P.], seq 15419172:15419384, ack 8965, win 501, length 212
15:49:46.203181 IP ubuntu-s-1vcpu-1gb-tor1-01.ssh > cpea84e3f5bc443-cma84e3f5bc440.cpe.net.fido.ca.51942: Flags [P.], seq 15419384:15419596, ack 8965, win 501, length 212
15:49:46.203264 IP ubuntu-s-1vcpu-1gb-tor1-01.ssh > cpea84e3f5bc443-cma84e3f5bc440.cpe.net.fido.ca.51942: Flags [P.], seq 15419596:15419808, ack 8965, win 501, length 212
15:49:46.203401 IP ubuntu-s-1vcpu-1gb-tor1-01.ssh > cpea84e3f5bc443-cma84e3f5bc440.cpe.net.fido.ca.51942: Flags [P.], seq 15419808:15420020, ack 8965, win 501, length 212
15:49:46.203490 IP ubuntu-s-1vcpu-1gb-tor1-01.ssh > cpea84e3f5bc443-cma84e3f5bc440.cpe.net.fido.ca.51942: Flags [P.], seq 15420020:15420232, ack 8965, win 501, length 212
15:49:46.203579 IP ubuntu-s-1vcpu-1gb-tor1-01.ssh > cpea84e3f5bc443-cma84e3f5bc440.cpe.net.fido.ca.51942: Flags [P.], seq 15420232:15420444, ack 8965, win 501, length 212
15:49:46.203659 IP ubuntu-s-1vcpu-1gb-tor1-01.ssh > cpea84e3f5bc443-cma84e3f5bc440.cpe.net.fido.ca.51942: Flags [P.], seq 15420444:15420656, ack 8965, win 501, length 212
15:49:46.203739 IP ubuntu-s-1vcpu-1gb-tor1-01.ssh > cpea84e3f5bc443-cma84e3f5bc440.cpe.net.fido.ca.51942: Flags [P.], seq 15420656:15420868, ack 8965, win 501, length 212
15:49:46.203816 IP ubuntu-s-1vcpu-1gb-tor1-01.ssh > cpea84e3f5bc443-cma84e3f5bc440.cpe.net.fido.ca.51942: Flags [P.], seq 15420868:15421080, ack 8965, win 501, length 212
15:49:46.203891 IP ubuntu-s-1vcpu-1gb-tor1-01.ssh > cpea84e3f5bc443-cma84e3f5bc440.cpe.net.fido.ca.51942: Flags [P.], seq 15421080:15421292, ack 8965, win 501, length 212
15:49:46.203971 IP ubuntu-s-1vcpu-1gb-tor1-01.ssh > cpea84e3f5bc443-cma84e3f5bc440.cpe.net.fido.ca.51942: Flags [P.], seq 15421292:15421504, ack 8965, win 501, length 212
15:49:46.204064 IP ubuntu-s-1vcpu-1gb-tor1-01.ssh > cpea84e3f5bc443-cma84e3f5bc440.cpe.net.fido.ca.51942: Flags [P.], seq 15421504:15421716, ack 8965, win 501, length 212
15:49:46.204175 IP ubuntu-s-1vcpu-1gb-tor1-01.ssh > cpea84e3f5bc443-cma84e3f5bc440.cpe.net.fido.ca.51942: Flags [P.], seq 15421716:15421928, ack 8965, win 501, length 212
15:49:46.204257 IP ubuntu-s-1vcpu-1gb-tor1-01.ssh > cpea84e3f5bc443-cma84e3f5bc440.cpe.net.fido.ca.51942: Flags [P.], seq 15421928:15422140, ack 8965, win 501, length 212
15:49:46.204346 IP ubuntu-s-1vcpu-1gb-tor1-01.ssh > cpea84e3f5bc443-cma84e3f5bc440.cpe.net.fido.ca.51942: Flags [P.], seq 15422140:15422352, ack 8965, win 501, length 212
15:49:46.204432 IP ubuntu-s-1vcpu-1gb-tor1-01.ssh > cpea84e3f5bc443-cma84e3f5bc440.cpe.net.fido.ca.51942: Flags [P.], seq 15422352:15422564, ack 8965, win 501, length 212
15:49:46.204511 IP ubuntu-s-1vcpu-1gb-tor1-01.ssh > cpea84e3f5bc443-cma84e3f5bc440.cpe.net.fido.ca.51942: Flags [P.], seq 15422564:15422776, ack 8965, win 501, length 212
15:49:46.204589 IP ubuntu-s-1vcpu-1gb-tor1-01.ssh > cpea84e3f5bc443-cma84e3f5bc440.cpe.net.fido.ca.51942: Flags [P.], seq 15422776:15422988, ack 8965, win 501, length 212
15:49:46.204692 IP ubuntu-s-1vcpu-1gb-tor1-01.ssh > cpea84e3f5bc443-cma84e3f5bc440.cpe.net.fido.ca.51942: Flags [P.], seq 15422988:15423200, ack 8965, win 501, length 212
15:49:46.204772 IP ubuntu-s-1vcpu-1gb-tor1-01.ssh > cpea84e3f5bc443-cma84e3f5bc440.cpe.net.fido.ca.51942: Flags [P.], seq 15423200:15423412, ack 8965, win 501, length 212
15:49:46.204852 IP ubuntu-s-1vcpu-1gb-tor1-01.ssh > cpea84e3f5bc443-cma84e3f5bc440.cpe.net.fido.ca.51942: Flags [P.], seq 15423412:15423624, ack 8965, win 501, length 212
15:49:46.204952 IP ubuntu-s-1vcpu-1gb-tor1-01.ssh > cpea84e3f5bc443-cma84e3f5bc440.cpe.net.fido.ca.51942: Flags [P.], seq 15423624:15423836, ack 8965, win 501, length 212
15:49:46.205043 IP ubuntu-s-1vcpu-1gb-tor1-01.ssh > cpea84e3f5bc443-cma84e3f5bc440.cpe.net.fido.ca.51942: Flags [P.], seq 15423836:15424048, ack 8965, win 501, length 212
15:49:46.205138 IP ubuntu-s-1vcpu-1gb-tor1-01.ssh > cpea84e3f5bc443-cma84e3f5bc440.cpe.net.fido.ca.51942: Flags [P.], seq 15424048:15424260, ack 8965, win 501, length 212
15:49:46.205226 IP ubuntu-s-1vcpu-1gb-tor1-01.ssh > cpea84e3f5bc443-cma84e3f5bc440.cpe.net.fido.ca.51942: Flags [P.], seq 15424260:15424472, ack 8965, win 501, length 212
15:49:46.205306 IP ubuntu-s-1vcpu-1gb-tor1-01.ssh > cpea84e3f5bc443-cma84e3f5bc440.cpe.net.fido.ca.51942: Flags [P.], seq 15424472:15424684, ack 8965, win 501, length 212
15:49:46.205388 IP ubuntu-s-1vcpu-1gb-tor1-01.ssh > cpea84e3f5bc443-cma84e3f5bc440.cpe.net.fido.ca.51942: Flags [P.], seq 15424684:15424896, ack 8965, win 501, length 212
15:49:46.205477 IP ubuntu-s-1vcpu-1gb-tor1-01.ssh > cpea84e3f5bc443-cma84e3f5bc440.cpe.net.fido.ca.51942: Flags [P.], seq 15424896:15425108, ack 8965, win 501, length 212
15:49:46.205559 IP ubuntu-s-1vcpu-1gb-tor1-01.ssh > cpea84e3f5bc443-cma84e3f5bc440.cpe.net.fido.ca.51942: Flags [P.], seq 15425108:15425320, ack 8965, win 501, length 212
15:49:46.205645 IP ubuntu-s-1vcpu-1gb-tor1-01.ssh > cpea84e3f5bc443-cma84e3f5bc440.cpe.net.fido.ca.51942: Flags [P.], seq 15425320:15425532, ack 8965, win 501, length 212
15:49:46.205729 IP ubuntu-s-1vcpu-1gb-tor1-01.ssh > cpea84e3f5bc443-cma84e3f5bc440.cpe.net.fido.ca.51942: Flags [P.], seq 15425532:15425744, ack 8965, win 501, length 212
15:49:46.205809 IP ubuntu-s-1vcpu-1gb-tor1-01.ssh > cpea84e3f5bc443-cma84e3f5bc440.cpe.net.fido.ca.51942: Flags [P.], seq 15425744:15425956, ack 8965, win 501, length 212
15:49:46.205887 IP ubuntu-s-1vcpu-1gb-tor1-01.ssh > cpea84e3f5bc443-cma84e3f5bc440.cpe.net.fido.ca.51942: Flags [P.], seq 15425956:15426168, ack 8965, win 501, length 212
15:49:46.205956 IP ubuntu-s-1vcpu-1gb-tor1-01.ssh > cpea84e3f5bc443-cma84e3f5bc440.cpe.net.fido.ca.51942: Flags [P.], seq 15426168:15426380, ack 8965, win 501, length 212
15:49:46.206022 IP ubuntu-s-1vcpu-1gb-tor1-01.ssh > cpea84e3f5bc443-cma84e3f5bc440.cpe.net.fido.ca.51942: Flags [P.], seq 15426380:15426592, ack 8965, win 501, length 212
15:49:46.206094 IP ubuntu-s-1vcpu-1gb-tor1-01.ssh > cpea84e3f5bc443-cma84e3f5bc440.cpe.net.fido.ca.51942: Flags [P.], seq 15426592:15426804, ack 8965, win 501, length 212
15:49:46.206157 IP ubuntu-s-1vcpu-1gb-tor1-01.ssh > cpea84e3f5bc443-cma84e3f5bc440.cpe.net.fido.ca.51942: Flags [P.], seq 15426804:15427016, ack 8965, win 501, length 212
15:49:46.206221 IP ubuntu-s-1vcpu-1gb-tor1-01.ssh > cpea84e3f5bc443-cma84e3f5bc440.cpe.net.fido.ca.51942: Flags [P.], seq 15427016:15427228, ack 8965, win 501, length 212
15:49:46.206292 IP ubuntu-s-1vcpu-1gb-tor1-01.ssh > cpea84e3f5bc443-cma84e3f5bc440.cpe.net.fido.ca.51942: Flags [P.], seq 15427228:15427440, ack 8965, win 501, length 212
15:49:46.206371 IP ubuntu-s-1vcpu-1gb-tor1-01.ssh > cpea84e3f5bc443-cma84e3f5bc440.cpe.net.fido.ca.51942: Flags [P.], seq 15427440:15427652, ack 8965, win 501, length 212
15:49:46.206448 IP ubuntu-s-1vcpu-1gb-tor1-01.ssh > cpea84e3f5bc443-cma84e3f5bc440.cpe.net.fido.ca.51942: Flags [P.], seq 15427652:15427864, ack 8965, win 501, length 212
15:49:46.206521 IP ubuntu-s-1vcpu-1gb-tor1-01.ssh > cpea84e3f5bc443-cma84e3f5bc440.cpe.net.fido.ca.51942: Flags [P.], seq 15427864:15428076, ack 8965, win 501, length 212
15:49:46.206577 IP cpea84e3f5bc443-cma84e3f5bc440.cpe.net.fido.ca.51942 > ubuntu-s-1vcpu-1gb-tor1-01.ssh: Flags [.], ack 15414680, win 513, length 0
15:49:46.206741 IP ubuntu-s-1vcpu-1gb-tor1-01.ssh > cpea84e3f5bc443-cma84e3f5bc440.cpe.net.fido.ca.51942: Flags [P.], seq 15428076:15428432, ack 8965, win 501, length 356
15:49:46.206840 IP ubuntu-s-1vcpu-1gb-tor1-01.ssh > cpea84e3f5bc443-cma84e3f5bc440.cpe.net.fido.ca.51942: Flags [P.], seq 15428432:15428644, ack 8965, win 501, length 212
15:49:46.206926 IP ubuntu-s-1vcpu-1gb-tor1-01.ssh > cpea84e3f5bc443-cma84e3f5bc440.cpe.net.fido.ca.51942: Flags [P.], seq 15428644:15428856, ack 8965, win 501, length 212
15:49:46.207033 IP ubuntu-s-1vcpu-1gb-tor1-01.ssh > cpea84e3f5bc443-cma84e3f5bc440.cpe.net.fido.ca.51942: Flags [P.], seq 15428856:15429068, ack 8965, win 501, length 212
15:49:46.207134 IP ubuntu-s-1vcpu-1gb-tor1-01.ssh > cpea84e3f5bc443-cma84e3f5bc440.cpe.net.fido.ca.51942: Flags [P.], seq 15429068:15429280, ack 8965, win 501, length 212
15:49:46.207210 IP ubuntu-s-1vcpu-1gb-tor1-01.ssh > cpea84e3f5bc443-cma84e3f5bc440.cpe.net.fido.ca.51942: Flags [P.], seq 15429280:15429492, ack 8965, win 501, length 212
15:49:46.207281 IP ubuntu-s-1vcpu-1gb-tor1-01.ssh > cpea84e3f5bc443-cma84e3f5bc440.cpe.net.fido.ca.51942: Flags [P.], seq 15429492:15429704, ack 8965, win 501, length 212
15:49:46.207352 IP ubuntu-s-1vcpu-1gb-tor1-01.ssh > cpea84e3f5bc443-cma84e3f5bc440.cpe.net.fido.ca.51942: Flags [P.], seq 15429704:15429916, ack 8965, win 501, length 212
15:49:46.207422 IP ubuntu-s-1vcpu-1gb-tor1-01.ssh > cpea84e3f5bc443-cma84e3f5bc440.cpe.net.fido.ca.51942: Flags [P.], seq 15429916:15430128, ack 8965, win 501, length 212
15:49:46.207509 IP ubuntu-s-1vcpu-1gb-tor1-01.ssh > cpea84e3f5bc443-cma84e3f5bc440.cpe.net.fido.ca.51942: Flags [P.], seq 15430128:15430340, ack 8965, win 501, length 212
15:49:46.207587 IP ubuntu-s-1vcpu-1gb-tor1-01.ssh > cpea84e3f5bc443-cma84e3f5bc440.cpe.net.fido.ca.51942: Flags [P.], seq 15430340:15430552, ack 8965, win 501, length 212
15:49:46.207661 IP ubuntu-s-1vcpu-1gb-tor1-01.ssh > cpea84e3f5bc443-cma84e3f5bc440.cpe.net.fido.ca.51942: Flags [P.], seq 15430552:15430764, ack 8965, win 501, length 212
15:49:46.207729 IP ubuntu-s-1vcpu-1gb-tor1-01.ssh > cpea84e3f5bc443-cma84e3f5bc440.cpe.net.fido.ca.51942: Flags [P.], seq 15430764:15430976, ack 8965, win 501, length 212
15:49:46.207796 IP ubuntu-s-1vcpu-1gb-tor1-01.ssh > cpea84e3f5bc443-cma84e3f5bc440.cpe.net.fido.ca.51942: Flags [P.], seq 15430976:15431188, ack 8965, win 501, length 212
15:49:46.207862 IP ubuntu-s-1vcpu-1gb-tor1-01.ssh > cpea84e3f5bc443-cma84e3f5bc440.cpe.net.fido.ca.51942: Flags [P.], seq 15431188:15431400, ack 8965, win 501, length 212
15:49:46.207934 IP ubuntu-s-1vcpu-1gb-tor1-01.ssh > cpea84e3f5bc443-cma84e3f5bc440.cpe.net.fido.ca.51942: Flags [P.], seq 15431400:15431612, ack 8965, win 501, length 212
15:49:46.208005 IP ubuntu-s-1vcpu-1gb-tor1-01.ssh > cpea84e3f5bc443-cma84e3f5bc440.cpe.net.fido.ca.51942: Flags [P.], seq 15431612:15431824, ack 8965, win 501, length 212
15:49:46.208084 IP ubuntu-s-1vcpu-1gb-tor1-01.ssh > cpea84e3f5bc443-cma84e3f5bc440.cpe.net.fido.ca.51942: Flags [P.], seq 15431824:15432036, ack 8965, win 501, length 212
15:49:46.208188 IP ubuntu-s-1vcpu-1gb-tor1-01.ssh > cpea84e3f5bc443-cma84e3f5bc440.cpe.net.fido.ca.51942: Flags [P.], seq 15432036:15432248, ack 8965, win 501, length 212
15:49:46.208264 IP ubuntu-s-1vcpu-1gb-tor1-01.ssh > cpea84e3f5bc443-cma84e3f5bc440.cpe.net.fido.ca.51942: Flags [P.], seq 15432248:15432460, ack 8965, win 501, length 212
15:49:46.208342 IP ubuntu-s-1vcpu-1gb-tor1-01.ssh > cpea84e3f5bc443-cma84e3f5bc440.cpe.net.fido.ca.51942: Flags [P.], seq 15432460:15432672, ack 8965, win 501, length 212
15:49:46.208417 IP ubuntu-s-1vcpu-1gb-tor1-01.ssh > cpea84e3f5bc443-cma84e3f5bc440.cpe.net.fido.ca.51942: Flags [P.], seq 15432672:15432884, ack 8965, win 501, length 212
15:49:46.208489 IP ubuntu-s-1vcpu-1gb-tor1-01.ssh > cpea84e3f5bc443-cma84e3f5bc440.cpe.net.fido.ca.51942: Flags [P.], seq 15432884:15433096, ack 8965, win 501, length 212
15:49:46.208561 IP ubuntu-s-1vcpu-1gb-tor1-01.ssh > cpea84e3f5bc443-cma84e3f5bc440.cpe.net.fido.ca.51942: Flags [P.], seq 15433096:15433308, ack 8965, win 501, length 212
15:49:46.208691 IP ubuntu-s-1vcpu-1gb-tor1-01.ssh > cpea84e3f5bc443-cma84e3f5bc440.cpe.net.fido.ca.51942: Flags [P.], seq 15433308:15433520, ack 8965, win 501, length 212
15:49:46.208794 IP ubuntu-s-1vcpu-1gb-tor1-01.ssh > cpea84e3f5bc443-cma84e3f5bc440.cpe.net.fido.ca.51942: Flags [P.], seq 15433520:15433732, ack 8965, win 501, length 212
15:49:46.208866 IP ubuntu-s-1vcpu-1gb-tor1-01.ssh > cpea84e3f5bc443-cma84e3f5bc440.cpe.net.fido.ca.51942: Flags [P.], seq 15433732:15433944, ack 8965, win 501, length 212
15:49:46.208937 IP ubuntu-s-1vcpu-1gb-tor1-01.ssh > cpea84e3f5bc443-cma84e3f5bc440.cpe.net.fido.ca.51942: Flags [P.], seq 15433944:15434156, ack 8965, win 501, length 212
15:49:46.209009 IP ubuntu-s-1vcpu-1gb-tor1-01.ssh > cpea84e3f5bc443-cma84e3f5bc440.cpe.net.fido.ca.51942: Flags [P.], seq 15434156:15434368, ack 8965, win 501, length 212
15:49:46.209095 IP ubuntu-s-1vcpu-1gb-tor1-01.ssh > cpea84e3f5bc443-cma84e3f5bc440.cpe.net.fido.ca.51942: Flags [P.], seq 15434368:15434580, ack 8965, win 501, length 212
15:49:46.209169 IP ubuntu-s-1vcpu-1gb-tor1-01.ssh > cpea84e3f5bc443-cma84e3f5bc440.cpe.net.fido.ca.51942: Flags [P.], seq 15434580:15434792, ack 8965, win 501, length 212
15:49:46.209236 IP ubuntu-s-1vcpu-1gb-tor1-01.ssh > cpea84e3f5bc443-cma84e3f5bc440.cpe.net.fido.ca.51942: Flags [P.], seq 15434792:15435004, ack 8965, win 501, length 212
15:49:46.209308 IP ubuntu-s-1vcpu-1gb-tor1-01.ssh > cpea84e3f5bc443-cma84e3f5bc440.cpe.net.fido.ca.51942: Flags [P.], seq 15435004:15435216, ack 8965, win 501, length 212
15:49:46.209373 IP ubuntu-s-1vcpu-1gb-tor1-01.ssh > cpea84e3f5bc443-cma84e3f5bc440.cpe.net.fido.ca.51942: Flags [P.], seq 15435216:15435428, ack 8965, win 501, length 212
15:49:46.209452 IP ubuntu-s-1vcpu-1gb-tor1-01.ssh > cpea84e3f5bc443-cma84e3f5bc440.cpe.net.fido.ca.51942: Flags [P.], seq 15435428:15435640, ack 8965, win 501, length 212
15:49:46.209530 IP ubuntu-s-1vcpu-1gb-tor1-01.ssh > cpea84e3f5bc443-cma84e3f5bc440.cpe.net.fido.ca.51942: Flags [P.], seq 15435640:15435852, ack 8965, win 501, length 212
15:49:46.209610 IP ubuntu-s-1vcpu-1gb-tor1-01.ssh > cpea84e3f5bc443-cma84e3f5bc440.cpe.net.fido.ca.51942: Flags [P.], seq 15435852:15436064, ack 8965, win 501, length 212
15:49:46.209688 IP ubuntu-s-1vcpu-1gb-tor1-01.ssh > cpea84e3f5bc443-cma84e3f5bc440.cpe.net.fido.ca.51942: Flags [P.], seq 15436064:15436276, ack 8965, win 501, length 212
15:49:46.209766 IP ubuntu-s-1vcpu-1gb-tor1-01.ssh > cpea84e3f5bc443-cma84e3f5bc440.cpe.net.fido.ca.51942: Flags [P.], seq 15436276:15436488, ack 8965, win 501, length 212
15:49:46.209846 IP ubuntu-s-1vcpu-1gb-tor1-01.ssh > cpea84e3f5bc443-cma84e3f5bc440.cpe.net.fido.ca.51942: Flags [P.], seq 15436488:15436700, ack 8965, win 501, length 212
15:49:46.209930 IP ubuntu-s-1vcpu-1gb-tor1-01.ssh > cpea84e3f5bc443-cma84e3f5bc440.cpe.net.fido.ca.51942: Flags [P.], seq 15436700:15436912, ack 8965, win 501, length 212
15:49:46.210017 IP ubuntu-s-1vcpu-1gb-tor1-01.ssh > cpea84e3f5bc443-cma84e3f5bc440.cpe.net.fido.ca.51942: Flags [P.], seq 15436912:15437124, ack 8965, win 501, length 212
