ck 207748, win 12381, length 36
17:13:11.140250 IP cpea84e3f5bc443-cma84e3f5bc440.cpe.net.fido.ca.49919 > 167.99.182.113.ssh: Flags [.], ack 260488, win 12381, length 0
17:13:11.140250 IP cpea84e3f5bc443-cma84e3f5bc440.cpe.net.fido.ca.49919 > 167.99.182.113.ssh: Flags [P.], seq 145:181, ack 260488, win 12381, length 36
17:13:11.140250 IP cpea84e3f5bc443-cma84e3f5bc440.cpe.net.fido.ca.49919 > 167.99.182.113.ssh: Flags [.], ack 286948, win 12379, length 0
17:13:11.140250 IP cpea84e3f5bc443-cma84e3f5bc440.cpe.net.fido.ca.49919 > 167.99.182.113.ssh: Flags [.], ack 288124, win 12381, length 0
17:13:11.140582 IP 167.99.182.113.ssh > cpea84e3f5bc443-cma84e3f5bc440.cpe.net.fido.ca.49919: Flags [P.], seq 347392:348308, ack 181, win 615, length 916
17:13:11.140645 IP 167.99.182.113.ssh > cpea84e3f5bc443-cma84e3f5bc440.cpe.net.fido.ca.49919: Flags [P.], seq 348308:348504, ack 181, win 615, length 196
17:13:11.140708 IP 167.99.182.113.ssh > cpea84e3f5bc443-cma84e3f5bc440.cpe.net.fido.ca.49919: Flags [P.], seq 348504:348700, ack 181, win 615, length 196
17:13:11.140764 IP 167.99.182.113.ssh > cpea84e3f5bc443-cma84e3f5bc440.cpe.net.fido.ca.49919: Flags [P.], seq 348700:348896, ack 181, win 615, length 196
17:13:11.140820 IP 167.99.182.113.ssh > cpea84e3f5bc443-cma84e3f5bc440.cpe.net.fido.ca.49919: Flags [P.], seq 348896:349092, ack 181, win 615, length 196
17:13:11.140879 IP 167.99.182.113.ssh > cpea84e3f5bc443-cma84e3f5bc440.cpe.net.fido.ca.49919: Flags [P.], seq 349092:349288, ack 181, win 615, length 196
17:13:11.140934 IP 167.99.182.113.ssh > cpea84e3f5bc443-cma84e3f5bc440.cpe.net.fido.ca.49919: Flags [P.], seq 349288:349484, ack 181, win 615, length 196
17:13:11.141005 IP 167.99.182.113.ssh > cpea84e3f5bc443-cma84e3f5bc440.cpe.net.fido.ca.49919: Flags [P.], seq 349484:349680, ack 181, win 615, length 196
17:13:11.141091 IP 167.99.182.113.ssh > cpea84e3f5bc443-cma84e3f5bc440.cpe.net.fido.ca.49919: Flags [P.], seq 349680:349876, ack 181, win 615, length 196
17:13:11.141196 IP 167.99.182.113.ssh > cpea84e3f5bc443-cma84e3f5bc440.cpe.net.fido.ca.49919: Flags [P.], seq 349876:350072, ack 181, win 615, length 196
17:13:11.141282 IP 167.99.182.113.ssh > cpea84e3f5bc443-cma84e3f5bc440.cpe.net.fido.ca.49919: Flags [P.], seq 350072:350268, ack 181, win 615, length 196
17:13:11.141397 IP 167.99.182.113.ssh > cpea84e3f5bc443-cma84e3f5bc440.cpe.net.fido.ca.49919: Flags [P.], seq 350268:350464, ack 181, win 615, length 196
17:13:11.141486 IP 167.99.182.113.ssh > cpea84e3f5bc443-cma84e3f5bc440.cpe.net.fido.ca.49919: Flags [P.], seq 350464:350660, ack 181, win 615, length 196
17:13:11.141543 IP 167.99.182.113.ssh > cpea84e3f5bc443-cma84e3f5bc440.cpe.net.fido.ca.49919: Flags [P.], seq 350660:350856, ack 181, win 615, length 196
17:13:11.141599 IP 167.99.182.113.ssh > cpea84e3f5bc443-cma84e3f5bc440.cpe.net.fido.ca.49919: Flags [P.], seq 350856:351052, ack 181, win 615, length 196
17:13:11.141654 IP 167.99.182.113.ssh > cpea84e3f5bc443-cma84e3f5bc440.cpe.net.fido.ca.49919: Flags [P.], seq 351052:351248, ack 181, win 615, length 196
17:13:11.141708 IP 167.99.182.113.ssh > cpea84e3f5bc443-cma84e3f5bc440.cpe.net.fido.ca.49919: Flags [P.], seq 351248:351444, ack 181, win 615, length 196
17:13:11.141764 IP 167.99.182.113.ssh > cpea84e3f5bc443-cma84e3f5bc440.cpe.net.fido.ca.49919: Flags [P.], seq 351444:351640, ack 181, win 615, length 196
17:13:11.141819 IP 167.99.182.113.ssh > cpea84e3f5bc443-cma84e3f5bc440.cpe.net.fido.ca.49919: Flags [P.], seq 351640:351836, ack 181, win 615, length 196
17:13:11.141873 IP 167.99.182.113.ssh > cpea84e3f5bc443-cma84e3f5bc440.cpe.net.fido.ca.49919: Flags [P.], seq 351836:352032, ack 181, win 615, length 196
17:13:11.141927 IP 167.99.182.113.ssh > cpea84e3f5bc443-cma84e3f5bc440.cpe.net.fido.ca.49919: Flags [P.], seq 352032:352228, ack 181, win 615, length 196
17:13:11.141982 IP 167.99.182.113.ssh > cpea84e3f5bc443-cma84e3f5bc440.cpe.net.fido.ca.49919: Flags [P.], seq 352228:352424, ack 181, win 615, length 196
17:13:11.142036 IP 167.99.182.113.ssh > cpea84e3f5bc443-cma84e3f5bc440.cpe.net.fido.ca.49919: Flags [P.], seq 352424:352620, ack 181, win 615, length 196
17:13:11.142092 IP 167.99.182.113.ssh > cpea84e3f5bc443-cma84e3f5bc440.cpe.net.fido.ca.49919: Flags [P.], seq 352620:352816, ack 181, win 615, length 196
17:13:11.142146 IP 167.99.182.113.ssh > cpea84e3f5bc443-cma84e3f5bc440.cpe.net.fido.ca.49919: Flags [P.], seq 352816:353012, ack 181, win 615, length 196
17:13:11.142200 IP 167.99.182.113.ssh > cpea84e3f5bc443-cma84e3f5bc440.cpe.net.fido.ca.49919: Flags [P.], seq 353012:353208, ack 181, win 615, length 196
17:13:11.142254 IP 167.99.182.113.ssh > cpea84e3f5bc443-cma84e3f5bc440.cpe.net.fido.ca.49919: Flags [P.], seq 353208:353404, ack 181, win 615, length 196
17:13:11.142312 IP 167.99.182.113.ssh > cpea84e3f5bc443-cma84e3f5bc440.cpe.net.fido.ca.49919: Flags [P.], seq 353404:353600, ack 181, win 615, length 196
17:13:11.142366 IP 167.99.182.113.ssh > cpea84e3f5bc443-cma84e3f5bc440.cpe.net.fido.ca.49919: Flags [P.], seq 353600:353796, ack 181, win 615, length 196
17:13:11.142423 IP 167.99.182.113.ssh > cpea84e3f5bc443-cma84e3f5bc440.cpe.net.fido.ca.49919: Flags [P.], seq 353796:353992, ack 181, win 615, length 196
17:13:11.142482 IP 167.99.182.113.ssh > cpea84e3f5bc443-cma84e3f5bc440.cpe.net.fido.ca.49919: Flags [P.], seq 353992:354188, ack 181, win 615, length 196
17:13:11.142575 IP 167.99.182.113.ssh > cpea84e3f5bc443-cma84e3f5bc440.cpe.net.fido.ca.49919: Flags [P.], seq 354188:354384, ack 181, win 615, length 196
17:13:11.142647 IP 167.99.182.113.ssh > cpea84e3f5bc443-cma84e3f5bc440.cpe.net.fido.ca.49919: Flags [P.], seq 354384:354580, ack 181, win 615, length 196
17:13:11.142708 IP 167.99.182.113.ssh > cpea84e3f5bc443-cma84e3f5bc440.cpe.net.fido.ca.49919: Flags [P.], seq 354580:354776, ack 181, win 615, length 196
17:13:11.142764 IP 167.99.182.113.ssh > cpea84e3f5bc443-cma84e3f5bc440.cpe.net.fido.ca.49919: Flags [P.], seq 354776:354972, ack 181, win 615, length 196
17:13:11.142823 IP 167.99.182.113.ssh > cpea84e3f5bc443-cma84e3f5bc440.cpe.net.fido.ca.49919: Flags [P.], seq 354972:355168, ack 181, win 615, length 196
17:13:11.142879 IP 167.99.182.113.ssh > cpea84e3f5bc443-cma84e3f5bc440.cpe.net.fido.ca.49919: Flags [P.], seq 355168:355364, ack 181, win 615, length 196
17:13:11.142933 IP 167.99.182.113.ssh > cpea84e3f5bc443-cma84e3f5bc440.cpe.net.fido.ca.49919: Flags [P.], seq 355364:355560, ack 181, win 615, length 196
17:13:11.142988 IP 167.99.182.113.ssh > cpea84e3f5bc443-cma84e3f5bc440.cpe.net.fido.ca.49919: Flags [P.], seq 355560:355756, ack 181, win 615, length 196
17:13:11.143043 IP 167.99.182.113.ssh > cpea84e3f5bc443-cma84e3f5bc440.cpe.net.fido.ca.49919: Flags [P.], seq 355756:355952, ack 181, win 615, length 196
17:13:11.143098 IP 167.99.182.113.ssh > cpea84e3f5bc443-cma84e3f5bc440.cpe.net.fido.ca.49919: Flags [P.], seq 355952:356148, ack 181, win 615, length 196
17:13:11.143160 IP 167.99.182.113.ssh > cpea84e3f5bc443-cma84e3f5bc440.cpe.net.fido.ca.49919: Flags [P.], seq 356148:356344, ack 181, win 615, length 196
17:13:11.143241 IP 167.99.182.113.ssh > cpea84e3f5bc443-cma84e3f5bc440.cpe.net.fido.ca.49919: Flags [P.], seq 356344:356540, ack 181, win 615, length 196
17:13:11.143300 IP 167.99.182.113.ssh > cpea84e3f5bc443-cma84e3f5bc440.cpe.net.fido.ca.49919: Flags [P.], seq 356540:356736, ack 181, win 615, length 196
17:13:11.143355 IP 167.99.182.113.ssh > cpea84e3f5bc443-cma84e3f5bc440.cpe.net.fido.ca.49919: Flags [P.], seq 356736:356932, ack 181, win 615, length 196
17:13:11.143451 IP 167.99.182.113.ssh > cpea84e3f5bc443-cma84e3f5bc440.cpe.net.fido.ca.49919: Flags [P.], seq 356932:357128, ack 181, win 615, length 196
17:13:11.143527 IP 167.99.182.113.ssh > cpea84e3f5bc443-cma84e3f5bc440.cpe.net.fido.ca.49919: Flags [P.], seq 357128:357324, ack 181, win 615, length 196
17:13:11.143584 IP 167.99.182.113.ssh > cpea84e3f5bc443-cma84e3f5bc440.cpe.net.fido.ca.49919: Flags [P.], seq 357324:357520, ack 181, win 615, length 196
17:13:11.143639 IP 167.99.182.113.ssh > cpea84e3f5bc443-cma84e3f5bc440.cpe.net.fido.ca.49919: Flags [P.], seq 357520:357716, ack 181, win 615, length 196
17:13:11.143698 IP 167.99.182.113.ssh > cpea84e3f5bc443-cma84e3f5bc440.cpe.net.fido.ca.49919: Flags [P.], seq 357716:357912, ack 181, win 615, length 196
17:13:11.143791 IP 167.99.182.113.ssh > cpea84e3f5bc443-cma84e3f5bc440.cpe.net.fido.ca.49919: Flags [P.], seq 357912:358108, ack 181, win 615, length 196
17:13:11.143864 IP 167.99.182.113.ssh > cpea84e3f5bc443-cma84e3f5bc440.cpe.net.fido.ca.49919: Flags [P.], seq 358108:358304, ack 181, win 615, length 196
17:13:11.143926 IP 167.99.182.113.ssh > cpea84e3f5bc443-cma84e3f5bc440.cpe.net.fido.ca.49919: Flags [P.], seq 358304:358500, ack 181, win 615, length 196
17:13:11.143983 IP 167.99.182.113.ssh > cpea84e3f5bc443-cma84e3f5bc440.cpe.net.fido.ca.49919: Flags [P.], seq 358500:358696, ack 181, win 615, length 196
17:13:11.144038 IP 167.99.182.113.ssh > cpea84e3f5bc443-cma84e3f5bc440.cpe.net.fido.ca.49919: Flags [P.], seq 358696:358892, ack 181, win 615, length 196
17:13:11.144096 IP 167.99.182.113.ssh > cpea84e3f5bc443-cma84e3f5bc440.cpe.net.fido.ca.49919: Flags [P.], seq 358892:359088, ack 181, win 615, length 196
17:13:11.144151 IP 167.99.182.113.ssh > cpea84e3f5bc443-cma84e3f5bc440.cpe.net.fido.ca.49919: Flags [P.], seq 359088:359284, ack 181, win 615, length 196
17:13:11.144209 IP 167.99.182.113.ssh > cpea84e3f5bc443-cma84e3f5bc440.cpe.net.fido.ca.49919: Flags [P.], seq 359284:359480, ack 181, win 615, length 196
17:13:11.144264 IP 167.99.182.113.ssh > cpea84e3f5bc443-cma84e3f5bc440.cpe.net.fido.ca.49919: Flags [P.], seq 359480:359676, ack 181, win 615, length 196
17:13:11.144325 IP 167.99.182.113.ssh > cpea84e3f5bc443-cma84e3f5bc440.cpe.net.fido.ca.49919: Flags [P.], seq 359676:359872, ack 181, win 615, length 196
17:13:11.144381 IP 167.99.182.113.ssh > cpea84e3f5bc443-cma84e3f5bc440.cpe.net.fido.ca.49919: Flags [P.], seq 359872:360068, ack 181, win 615, length 196
17:13:11.144471 IP 167.99.182.113.ssh > cpea84e3f5bc443-cma84e3f5bc440.cpe.net.fido.ca.49919: Flags [P.], seq 360068:360264, ack 181, win 615, length 196
17:13:11.144543 IP 167.99.182.113.ssh > cpea84e3f5bc443-cma84e3f5bc440.cpe.net.fido.ca.49919: Flags [P.], seq 360264:360460, ack 181, win 615, length 196
17:13:11.144610 IP 167.99.182.113.ssh > cpea84e3f5bc443-cma84e3f5bc440.cpe.net.fido.ca.49919: Flags [P.], seq 360460:360656, ack 181, win 615, length 196
17:13:11.144679 IP 167.99.182.113.ssh > cpea84e3f5bc443-cma84e3f5bc440.cpe.net.fido.ca.49919: Flags [P.], seq 360656:360852, ack 181, win 615, length 196
17:13:11.144736 IP 167.99.182.113.ssh > cpea84e3f5bc443-cma84e3f5bc440.cpe.net.fido.ca.49919: Flags [P.], seq 360852:361048, ack 181, win 615, length 196
17:13:11.144791 IP 167.99.182.113.ssh > cpea84e3f5bc443-cma84e3f5bc440.cpe.net.fido.ca.49919: Flags [P.], seq 361048:361244, ack 181, win 615, length 196
17:13:11.144849 IP 167.99.182.113.ssh > cpea84e3f5bc443-cma84e3f5bc440.cpe.net.fido.ca.49919: Flags [P.], seq 361244:361440, ack 181, win 615, length 196
17:13:11.144904 IP 167.99.182.113.ssh > cpea84e3f5bc443-cma84e3f5bc440.cpe.net.fido.ca.49919: Flags [P.], seq 361440:361636, ack 181, win 615, length 196
17:13:11.144961 IP 167.99.182.113.ssh > cpea84e3f5bc443-cma84e3f5bc440.cpe.net.fido.ca.49919: Flags [P.], seq 361636:361832, ack 181, win 615, length 196
17:13:11.145018 IP 167.99.182.113.ssh > cpea84e3f5bc443-cma84e3f5bc440.cpe.net.fido.ca.49919: Flags [P.], seq 361832:362028, ack 181, win 615, length 196
17:13:11.145071 IP 167.99.182.113.ssh > cpea84e3f5bc443-cma84e3f5bc440.cpe.net.fido.ca.49919: Flags [P.], seq 362028:362224, ack 181, win 615, length 196
17:13:11.145126 IP 167.99.182.113.ssh > cpea84e3f5bc443-cma84e3f5bc440.cpe.net.fido.ca.49919: Flags [P.], seq 362224:362420, ack 181, win 615, length 196
17:13:11.145183 IP 167.99.182.113.ssh > cpea84e3f5bc443-cma84e3f5bc440.cpe.net.fido.ca.49919: Flags [P.], seq 362420:362616, ack 181, win 615, length 196
17:13:11.145241 IP 167.99.182.113.ssh > cpea84e3f5bc443-cma84e3f5bc440.cpe.net.fido.ca.49919: Flags [P.], seq 362616:362812, ack 181, win 615, length 196
17:13:11.145310 IP 167.99.182.113.ssh > cpea84e3f5bc443-cma84e3f5bc440.cpe.net.fido.ca.49919: Flags [P.], seq 362812:363008, ack 181, win 615, length 196
17:13:11.145365 IP 167.99.182.113.ssh > cpea84e3f5bc443-cma84e3f5bc440.cpe.net.fido.ca.49919: Flags [P.], seq 363008:363204, ack 181, win 615, length 196
17:13:11.145422 IP 167.99.182.113.ssh > cpea84e3f5bc443-cma84e3f5bc440.cpe.net.fido.ca.49919: Flags [P.], seq 363204:363400, ack 181, win 615, length 196
17:13:11.145481 IP 167.99.182.113.ssh > cpea84e3f5bc443-cma84e3f5bc440.cpe.net.fido.ca.49919: Flags [P.], seq 363400:363596, ack 181, win 615, length 196
17:13:11.145543 IP 167.99.182.113.ssh > cpea84e3f5bc443-cma84e3f5bc440.cpe.net.fido.ca.49919: Flags [P.], seq 363596:363792, ack 181, win 615, length 196
17:13:11.145672 IP 167.99.182.113.ssh > cpea84e3f5bc443-cma84e3f5bc440.cpe.net.fido.ca.49919: Flags [P.], seq 363792:363988, ack 181, win 615, length 196
17:13:11.145738 IP 167.99.182.113.ssh > cpea84e3f5bc443-cma84e3f5bc440.cpe.net.fido.ca.49919: Flags [P.], seq 363988:364184, ack 181, win 615, length 196
17:13:11.145801 IP 167.99.182.113.ssh > cpea84e3f5bc443-cma84e3f5bc440.cpe.net.fido.ca.49919: Flags [P.], seq 364184:364380, ack 181, win 615, length 196
17:13:11.145857 IP 167.99.182.113.ssh > cpea84e3f5bc443-cma84e3f5bc440.cpe.net.fido.ca.49919: Flags [P.], seq 364380:364576, ack 181, win 615, length 196
17:13:11.145912 IP 167.99.182.113.ssh > cpea84e3f5bc443-cma84e3f5bc440.cpe.net.fido.ca.49919: Flags [P.], seq 364576:364772, ack 181, win 615, length 196
17:13:11.145972 IP 167.99.182.113.ssh > cpea84e3f5bc443-cma84e3f5bc440.cpe.net.fido.ca.49919: Flags [P.], seq 364772:364968, ack 181, win 615, length 196
17:13:11.146027 IP 167.99.182.113.ssh > cpea84e3f5bc443-cma84e3f5bc440.cpe.net.fido.ca.49919: Flags [P.], seq 364968:365164, ack 181, win 615, length 196
17:13:11.146086 IP 167.99.182.113.ssh > cpea84e3f5bc443-cma84e3f5bc440.cpe.net.fido.ca.49919: Flags [P.], seq 365164:365360, ack 181, win 615, length 196
17:13:11.146140 IP 167.99.182.113.ssh > cpea84e3f5bc443-cma84e3f5bc440.cpe.net.fido.ca.49919: Flags [P.], seq 365360:365556, ack 181, win 615, length 196
17:13:11.146195 IP 167.99.182.113.ssh > cpea84e3f5bc443-cma84e3f5bc440.cpe.net.fido.ca.49919: Flags [P.], seq 365556:365752, ack 181, win 615, length 196
17:13:11.146260 IP 167.99.182.113.ssh > cpea84e3f5bc443-cma84e3f5bc440.cpe.net.fido.ca.49919: Flags [P.], seq 365752:365948, ack 181, win 615, length 196
17:13:11.146352 IP 167.99.182.113.ssh > cpea84e3f5bc443-cma84e3f5bc440.cpe.net.fido.ca.49919: Flags [P.], seq 365948:366144, ack 181, win 615, length 196
17:13:11.146439 IP 167.99.182.113.ssh > cpea84e3f5bc443-cma84e3f5bc440.cpe.net.fido.ca.49919: Flags [P.], seq 366144:366340, ack 181, win 615, length 196
17:13:11.146499 IP 167.99.182.113.ssh > cpea84e3f5bc443-cma84e3f5bc440.cpe.net.fido.ca.49919: Flags [P.], seq 366340:366536, ack 181, win 615, length 196
17:13:11.146555 IP 167.99.182.113.ssh > cpea84e3f5bc443-cma84e3f5bc440.cpe.net.fido.ca.49919: Flags [P.], seq 366536:366732, ack 181, win 615, length 196
17:13:11.146612 IP 167.99.182.113.ssh > cpea84e3f5bc443-cma84e3f5bc440.cpe.net.fido.ca.49919: Flags [P.], seq 366732:366928, ack 181, win 615, length 196
17:13:11.146689 IP 167.99.182.113.ssh > cpea84e3f5bc443-cma84e3f5bc440.cpe.net.fido.ca.49919: Flags [P.], seq 366928:367124, ack 181, win 615, length 196
17:13:11.146783 IP 167.99.182.113.ssh > cpea84e3f5bc443-cma84e3f5bc440.cpe.net.fido.ca.49919: Flags [P.], seq 367124:367320, ack 181, win 615, length 196
17:13:11.146853 IP 167.99.182.113.ssh > cpea84e3f5bc443-cma84e3f5bc440.cpe.net.fido.ca.49919: Flags [P.], seq 367320:367516, ack 181, win 615, length 196
17:13:11.146911 IP 167.99.182.113.ssh > cpea84e3f5bc443-cma84e3f5bc440.cpe.net.fido.ca.49919: Flags [P.], seq 367516:367712, ack 181, win 615, length 196
17:13:11.146968 IP 167.99.182.113.ssh > cpea84e3f5bc443-cma84e3f5bc440.cpe.net.fido.ca.49919: Flags [P.], seq 367712:367908, ack 181, win 615, length 196
17:13:11.147028 IP 167.99.182.113.ssh > cpea84e3f5bc443-cma84e3f5bc440.cpe.net.fido.ca.49919: Flags [P.], seq 367908:368104, ack 181, win 615, length 196
17:13:11.147083 IP 167.99.182.113.ssh > cpea84e3f5bc443-cma84e3f5bc440.cpe.net.fido.ca.49919: Flags [P.], seq 368104:368300, ack 181, win 615, length 196
17:13:11.147141 IP 167.99.182.113.ssh > cpea84e3f5bc443-cma84e3f5bc440.cpe.net.fido.ca.49919: Flags [P.], seq 368300:368496, ack 181, win 615, length 196
17:13:11.147210 IP 167.99.182.113.ssh > cpea84e3f5bc443-cma84e3f5bc440.cpe.net.fido.ca.49919: Flags [P.], seq 368496:368692, ack 181, win 615, length 196
17:13:11.147269 IP 167.99.182.113.ssh > cpea84e3f5bc443-cma84e3f5bc440.cpe.net.fido.ca.49919: Flags [P.], seq 368692:368888, ack 181, win 615, length 196
17:13:11.147329 IP 167.99.182.113.ssh > cpea84e3f5bc443-cma84e3f5bc440.cpe.net.fido.ca.49919: Flags [P.], seq 368888:369084, ack 181, win 615, length 196
17:13:11.147401 IP 167.99.182.113.ssh > cpea84e3f5bc443-cma84e3f5bc440.cpe.net.fido.ca.49919: Flags [P.], seq 369084:369280, ack 181, win 615, length 196
17:13:11.147497 IP 167.99.182.113.ssh > cpea84e3f5bc443-cma84e3f5bc440.cpe.net.fido.ca.49919: Flags [P.], seq 369280:369476, ack 181, win 615, length 196
17:13:11.147589 IP 167.99.182.113.ssh > cpea84e3f5bc443-cma84e3f5bc440.cpe.net.fido.ca.49919: Flags [P.], seq 369476:369672, ack 181, win 615, length 196
17:13:11.147650 IP 167.99.182.113.ssh > cpea84e3f5bc443-cma84e3f5bc440.cpe.net.fido.ca.49919: Flags [P.], seq 369672:369868, ack 181, win 615, length 196
17:13:11.147710 IP 167.99.182.113.ssh > cpea84e3f5bc443-cma84e3f5bc440.cpe.net.fido.ca.49919: Flags [P.], seq 369868:370064, ack 181, win 615, length 196
17:13:11.147769 IP 167.99.182.113.ssh > cpea84e3f5bc443-cma84e3f5bc440.cpe.net.fido.ca.49919: Flags [P.], seq 370064:370260, ack 181, win 615, length 196
17:13:11.147824 IP 167.99.182.113.ssh > cpea84e3f5bc443-cma84e3f5bc440.cpe.net.fido.ca.49919: Flags [P.], seq 370260:370456, ack 181, win 615, length 196
17:13:11.147884 IP 167.99.182.113.ssh > cpea84e3f5bc443-cma84e3f5bc440.cpe.net.fido.ca.49919: Flags [P.], seq 370456:370652, ack 181, win 615, length 196
17:13:11.147941 IP 167.99.182.113.ssh > cpea84e3f5bc443-cma84e3f5bc440.cpe.net.fido.ca.49919: Flags [P.], seq 370652:370848, ack 181, win 615, length 196
17:13:11.148037 IP 167.99.182.113.ssh > cpea84e3f5bc443-cma84e3f5bc440.cpe.net.fido.ca.49919: Flags [P.], seq 370848:371044, ack 181, win 615, length 196
17:13:11.148101 IP 167.99.182.113.ssh > cpea84e3f5bc443-cma84e3f5bc440.cpe.net.fido.ca.49919: Flags [P.], seq 371044:371240, ack 181, win 615, length 196
17:13:11.148163 IP 167.99.182.113.ssh > cpea84e3f5bc443-cma84e3f5bc440.cpe.net.fido.ca.49919: Flags [P.], seq 371240:371436, ack 181, win 615, length 196
17:13:11.148221 IP 167.99.182.113.ssh > cpea84e3f5bc443-cma84e3f5bc440.cpe.net.fido.ca.49919: Flags [P.], seq 371436:371632, ack 181, win 615, length 196
17:13:11.148277 IP 167.99.182.113.ssh > cpea84e3f5bc443-cma84e3f5bc440.cpe.net.fido.ca.49919: Flags [P.], seq 371632:371828, ack 181, win 615, length 196
17:13:11.148332 IP 167.99.182.113.ssh > cpea84e3f5bc443-cma84e3f5bc440.cpe.net.fido.ca.49919: Flags [P.], seq 371828:372024, ack 181, win 615, length 196
17:13:11.148389 IP 167.99.182.113.ssh > cpea84e3f5bc443-cma84e3f5bc440.cpe.net.fido.ca.49919: Flags [P.], seq 372024:372220, ack 181, win 615, length 196
17:13:11.148447 IP 167.99.182.113.ssh > cpea84e3f5bc443-cma84e3f5bc440.cpe.net.fido.ca.49919: Flags [P.], seq 372220:372416, ack 181, win 615, length 196
17:13:11.148505 IP 167.99.182.113.ssh > cpea84e3f5bc443-cma84e3f5bc440.cpe.net.fido.ca.49919: Flags [P.], seq 372416:372612, ack 181, win 615, length 196
17:13:11.148560 IP 167.99.182.113.ssh > cpea84e3f5bc443-cma84e3f5bc440.cpe.net.fido.ca.49919: Flags [P.], seq 372612:372808, ack 181, win 615, length 196
17:13:11.148614 IP 167.99.182.113.ssh > cpea84e3f5bc443-cma84e3f5bc440.cpe.net.fido.ca.49919: Flags [P.], seq 372808:373004, ack 181, win 615, length 196
17:13:11.148669 IP 167.99.182.113.ssh > cpea84e3f5bc443-cma84e3f5bc440.cpe.net.fido.ca.49919: Flags [P.], seq 373004:373200, ack 181, win 615, length 196
17:13:11.148728 IP 167.99.182.113.ssh > cpea84e3f5bc443-cma84e3f5bc440.cpe.net.fido.ca.49919: Flags [P.], seq 373200:373396, ack 181, win 615, length 196
17:13:11.148783 IP 167.99.182.113.ssh > cpea84e3f5bc443-cma84e3f5bc440.cpe.net.fido.ca.49919: Flags [P.], seq 373396:373592, ack 181, win 615, length 196
17:13:11.148845 IP 167.99.182.113.ssh > cpea84e3f5bc443-cma84e3f5bc440.cpe.net.fido.ca.49919: Flags [P.], seq 373592:373788, ack 181, win 615, length 196
17:13:11.148901 IP 167.99.182.113.ssh > cpea84e3f5bc443-cma84e3f5bc440.cpe.net.fido.ca.49919: Flags [P.], seq 373788:373984, ack 181, win 615, length 196
17:13:11.148956 IP 167.99.182.113.ssh > cpea84e3f5bc443-cma84e3f5bc440.cpe.net.fido.ca.49919: Flags [P.], seq 373984:374180, ack 181, win 615, length 196
17:13:11.149013 IP 167.99.182.113.ssh > cpea84e3f5bc443-cma84e3f5bc440.cpe.net.fido.ca.49919: Flags [P.], seq 374180:374376, ack 181, win 615, length 196
17:13:11.149067 IP 167.99.182.113.ssh > cpea84e3f5bc443-cma84e3f5bc440.cpe.net.fido.ca.49919: Flags [P.], seq 374376:374572, ack 181, win 615, length 196
17:13:11.149123 IP 167.99.182.113.ssh > cpea84e3f5bc443-cma84e3f5bc440.cpe.net.fido.ca.49919: Flags [P.], seq 374572:374768, ack 181, win 615, length 196
17:13:11.149180 IP 167.99.182.113.ssh > cpea84e3f5bc443-cma84e3f5bc440.cpe.net.fido.ca.49919: Flags [P.], seq 374768:374964, ack 181, win 615, length 196
17:13:11.149237 IP 167.99.182.113.ssh > cpea84e3f5bc443-cma84e3f5bc440.cpe.net.fido.ca.49919: Flags [P.], seq 374964:375160, ack 181, win 615, length 196
17:13:11.149306 IP 167.99.182.113.ssh > cpea84e3f5bc443-cma84e3f5bc440.cpe.net.fido.ca.49919: Flags [P.], seq 375160:375356, ack 181, win 615, length 196
17:13:11.149367 IP 167.99.182.113.ssh > cpea84e3f5bc443-cma84e3f5bc440.cpe.net.fido.ca.49919: Flags [P.], seq 375356:375552, ack 181, win 615, length 196
17:13:11.149423 IP 167.99.182.113.ssh > cpea84e3f5bc443-cma84e3f5bc440.cpe.net.fido.ca.49919: Flags [P.], seq 375552:375748, ack 181, win 615, length 196
17:13:11.149480 IP 167.99.182.113.ssh > cpea84e3f5bc443-cma84e3f5bc440.cpe.net.fido.ca.49919: Flags [P.], seq 375748:375944, ack 181, win 615, length 196
17:13:11.149543 IP 167.99.182.113.ssh > cpea84e3f5bc443-cma84e3f5bc440.cpe.net.fido.ca.49919: Flags [P.], seq 375944:376140, ack 181, win 615, length 196
17:13:11.149597 IP 167.99.182.113.ssh > cpea84e3f5bc443-cma84e3f5bc440.cpe.net.fido.ca.49919: Flags [P.], seq 376140:376336, ack 181, win 615, length 196
17:13:11.149653 IP 167.99.182.113.ssh > cpea84e3f5bc443-cma84e3f5bc440.cpe.net.fido.ca.49919: Flags [P.], seq 376336:376532, ack 181, win 615, length 196
17:13:11.149709 IP 167.99.182.113.ssh > cpea84e3f5bc443-cma84e3f5bc440.cpe.net.fido.ca.49919: Flags [P.], seq 376532:376728, ack 181, win 615, length 196
17:13:11.149765 IP 167.99.182.113.ssh > cpea84e3f5bc443-cma84e3f5bc440.cpe.net.fido.ca.49919: Flags [P.], seq 376728:376924, ack 181, win 615, length 196
17:13:11.149822 IP 167.99.182.113.ssh > cpea84e3f5bc443-cma84e3f5bc440.cpe.net.fido.ca.49919: Flags [P.], seq 376924:377120, ack 181, win 615, length 196
17:13:11.149878 IP 167.99.182.113.ssh > cpea84e3f5bc443-cma84e3f5bc440.cpe.net.fido.ca.49919: Flags [P.], seq 377120:377316, ack 181, win 615, length 196
17:13:11.149934 IP 167.99.182.113.ssh > cpea84e3f5bc443-cma84e3f5bc440.cpe.net.fido.ca.49919: Flags [P.], seq 377316:377512, ack 181, win 615, length 196
17:13:11.149992 IP 167.99.182.113.ssh > cpea84e3f5bc443-cma84e3f5bc440.cpe.net.fido.ca.49919: Flags [P.], seq 377512:377708, ack 181, win 615, length 196
17:13:11.150061 IP 167.99.182.113.ssh > cpea84e3f5bc443-cma84e3f5bc440.cpe.net.fido.ca.49919: Flags [P.], seq 377708:377904, ack 181, win 615, length 196
17:13:11.150122 IP 167.99.182.113.ssh > cpea84e3f5bc443-cma84e3f5bc440.cpe.net.fido.ca.49919: Flags [P.], seq 377904:378100, ack 181, win 615, length 196
17:13:11.150179 IP 167.99.182.113.ssh > cpea84e3f5bc443-cma84e3f5bc440.cpe.net.fido.ca.49919: Flags [P.], seq 378100:378296, ack 181, win 615, length 196
17:13:11.150235 IP 167.99.182.113.ssh > cpea84e3f5bc443-cma84e3f5bc440.cpe.net.fido.ca.49919: Flags [P.], seq 378296:378492, ack 181, win 615, length 196
17:13:11.150295 IP 167.99.182.113.ssh > cpea84e3f5bc443-cma84e3f5bc440.cpe.net.fido.ca.49919: Flags [P.], seq 378492:378688, ack 181, win 615, length 196
17:13:11.150349 IP 167.99.182.113.ssh > cpea84e3f5bc443-cma84e3f5bc440.cpe.net.fido.ca.49919: Flags [P.], seq 378688:378884, ack 181, win 615, length 196
17:13:11.150419 IP 167.99.182.113.ssh > cpea84e3f5bc443-cma84e3f5bc440.cpe.net.fido.ca.49919: Flags [P.], seq 378884:379080, ack 181, win 615, length 196
17:13:11.150496 IP 167.99.182.113.ssh > cpea84e3f5bc443-cma84e3f5bc440.cpe.net.fido.ca.49919: Flags [P.], seq 379080:379276, ack 181, win 615, length 196
17:13:11.150573 IP 167.99.182.113.ssh > cpea84e3f5bc443-cma84e3f5bc440.cpe.net.fido.ca.49919: Flags [P.], seq 379276:379472, ack 181, win 615, length 196
17:13:11.150631 IP 167.99.182.113.ssh > cpea84e3f5bc443-cma84e3f5bc440.cpe.net.fido.ca.49919: Flags [P.], seq 379472:379668, ack 181, win 615, length 196
17:13:11.150688 IP 167.99.182.113.ssh > cpea84e3f5bc443-cma84e3f5bc440.cpe.net.fido.ca.49919: Flags [P.], seq 379668:379864, ack 181, win 615, length 196
17:13:11.150724 IP cpea84e3f5bc443-cma84e3f5bc440.cpe.net.fido.ca.49919 > 167.99.182.113.ssh: Flags [.], ack 291652, win 12379, length 0
17:13:11.150724 IP cpea84e3f5bc443-cma84e3f5bc440.cpe.net.fido.ca.49919 > 167.99.182.113.ssh: Flags [.], ack 292828, win 12381, length 0
17:13:11.150814 IP 167.99.182.113.ssh > cpea84e3f5bc443-cma84e3f5bc440.cpe.net.fido.ca.49919: Flags [P.], seq 379864:380332, ack 181, win 615, length 468
17:13:11.150877 IP 167.99.182.113.ssh > cpea84e3f5bc443-cma84e3f5bc440.cpe.net.fido.ca.49919: Flags [P.], seq 380332:380528, ack 181, win 615, length 196
17:13:11.150936 IP 167.99.182.113.ssh > cpea84e3f5bc443-cma84e3f5bc440.cpe.net.fido.ca.49919: Flags [P.], seq 380528:380724, ack 181, win 615, length 196
17:13:11.150993 IP 167.99.182.113.ssh > cpea84e3f5bc443-cma84e3f5bc440.cpe.net.fido.ca.49919: Flags [P.], seq 380724:380920, ack 181, win 615, length 196
17:13:11.151049 IP 167.99.182.113.ssh > cpea84e3f5bc443-cma84e3f5bc440.cpe.net.fido.ca.49919: Flags [P.], seq 380920:381116, ack 181, win 615, length 196
17:13:11.151107 IP 167.99.182.113.ssh > cpea84e3f5bc443-cma84e3f5bc440.cpe.net.fido.ca.49919: Flags [P.], seq 381116:381312, ack 181, win 615, length 196
17:13:11.151163 IP 167.99.182.113.ssh > cpea84e3f5bc443-cma84e3f5bc440.cpe.net.fido.ca.49919: Flags [P.], seq 381312:381508, ack 181, win 615, length 196
17:13:11.151233 IP 167.99.182.113.ssh > cpea84e3f5bc443-cma84e3f5bc440.cpe.net.fido.ca.49919: Flags [P.], seq 381508:381704, ack 181, win 615, length 196
17:13:11.151289 IP 167.99.182.113.ssh > cpea84e3f5bc443-cma84e3f5bc440.cpe.net.fido.ca.49919: Flags [P.], seq 381704:381900, ack 181, win 615, length 196
17:13:11.151362 IP 167.99.182.113.ssh > cpea84e3f5bc443-cma84e3f5bc440.cpe.net.fido.ca.49919: Flags [P.], seq 381900:382096, ack 181, win 615, length 196
17:13:11.151447 IP 167.99.182.113.ssh > cpea84e3f5bc443-cma84e3f5bc440.cpe.net.fido.ca.49919: Flags [P.], seq 382096:382292, ack 181, win 615, length 196
17:13:11.151508 IP 167.99.182.113.ssh > cpea84e3f5bc443-cma84e3f5bc440.cpe.net.fido.ca.49919: Flags [P.], seq 382292:382488, ack 181, win 615, length 196
17:13:11.151565 IP 167.99.182.113.ssh > cpea84e3f5bc443-cma84e3f5bc440.cpe.net.fido.ca.49919: Flags [P.], seq 382488:382684, ack 181, win 615, length 196
17:13:11.151622 IP 167.99.182.113.ssh > cpea84e3f5bc443-cma84e3f5bc440.cpe.net.fido.ca.49919: Flags [P.], seq 382684:382880, ack 181, win 615, length 196
17:13:11.151677 IP 167.99.182.113.ssh > cpea84e3f5bc443-cma84e3f5bc440.cpe.net.fido.ca.49919: Flags [P.], seq 382880:383076, ack 181, win 615, length 196
17:13:11.151731 IP 167.99.182.113.ssh > cpea84e3f5bc443-cma84e3f5bc440.cpe.net.fido.ca.49919: Flags [P.], seq 383076:383272, ack 181, win 615, length 196
17:13:11.151790 IP 167.99.182.113.ssh > cpea84e3f5bc443-cma84e3f5bc440.cpe.net.fido.ca.49919: Flags [P.], seq 383272:383468, ack 181, win 615, length 196
17:13:11.151844 IP 167.99.182.113.ssh > cpea84e3f5bc443-cma84e3f5bc440.cpe.net.fido.ca.49919: Flags [P.], seq 383468:383664, ack 181, win 615, length 196
17:13:11.152055 IP 167.99.182.113.ssh > cpea84e3f5bc443-cma84e3f5bc440.cpe.net.fido.ca.49919: Flags [P.], seq 383664:383860, ack 181, win 615, length 196
17:13:11.152125 IP 167.99.182.113.ssh > cpea84e3f5bc443-cma84e3f5bc440.cpe.net.fido.ca.49919: Flags [P.], seq 383860:384056, ack 181, win 615, length 196
17:13:11.152188 IP 167.99.182.113.ssh > cpea84e3f5bc443-cma84e3f5bc440.cpe.net.fido.ca.49919: Flags [P.], seq 384056:384252, ack 181, win 615, length 196
17:13:11.152244 IP 167.99.182.113.ssh > cpea84e3f5bc443-cma84e3f5bc440.cpe.net.fido.ca.49919: Flags [P.], seq 384252:384448, ack 181, win 615, length 196
17:13:11.152302 IP 167.99.182.113.ssh > cpea84e3f5bc443-cma84e3f5bc440.cpe.net.fido.ca.49919: Flags [P.], seq 384448:384644, ack 181, win 615, length 196
17:13:11.152358 IP 167.99.182.113.ssh > cpea84e3f5bc443-cma84e3f5bc440.cpe.net.fido.ca.49919: Flags [P.], seq 384644:384840, ack 181, win 615, length 196
17:13:11.152445 IP 167.99.182.113.ssh > cpea84e3f5bc443-cma84e3f5bc440.cpe.net.fido.ca.49919: Flags [P.], seq 384840:385036, ack 181, win 615, length 196
17:13:11.152550 IP 167.99.182.113.ssh > cpea84e3f5bc443-cma84e3f5bc440.cpe.net.fido.ca.49919: Flags [P.], seq 385036:385232, ack 181, win 615, length 196
17:13:11.152623 IP 167.99.182.113.ssh > cpea84e3f5bc443-cma84e3f5bc440.cpe.net.fido.ca.49919: Flags [P.], seq 385232:385428, ack 181, win 615, length 196
17:13:11.152689 IP 167.99.182.113.ssh > cpea84e3f5bc443-cma84e3f5bc440.cpe.net.fido.ca.49919: Flags [P.], seq 385428:385624, ack 181, win 615, length 196
17:13:11.152747 IP 167.99.182.113.ssh > cpea84e3f5bc443-cma84e3f5bc440.cpe.net.fido.ca.49919: Flags [P.], seq 385624:385820, ack 181, win 615, length 196
17:13:11.152804 IP 167.99.182.113.ssh > cpea84e3f5bc443-cma84e3f5bc440.cpe.net.fido.ca.49919: Flags [P.], seq 385820:386016, ack 181, win 615, length 196
17:13:11.152858 IP 167.99.182.113.ssh > cpea84e3f5bc443-cma84e3f5bc440.cpe.net.fido.ca.49919: Flags [P.], seq 386016:386212, ack 181, win 615, length 196
17:13:11.152912 IP 167.99.182.113.ssh > cpea84e3f5bc443-cma84e3f5bc440.cpe.net.fido.ca.49919: Flags [P.], seq 386212:386408, ack 181, win 615, length 196
17:13:11.152966 IP 167.99.182.113.ssh > cpea84e3f5bc443-cma84e3f5bc440.cpe.net.fido.ca.49919: Flags [P.], seq 386408:386604, ack 181, win 615, length 196
17:13:11.153028 IP 167.99.182.113.ssh > cpea84e3f5bc443-cma84e3f5bc440.cpe.net.fido.ca.49919: Flags [P.], seq 386604:386800, ack 181, win 615, length 196
17:13:11.153083 IP 167.99.182.113.ssh > cpea84e3f5bc443-cma84e3f5bc440.cpe.net.fido.ca.49919: Flags [P.], seq 386800:386996, ack 181, win 615, length 196
17:13:11.153140 IP 167.99.182.113.ssh > cpea84e3f5bc443-cma84e3f5bc440.cpe.net.fido.ca.49919: Flags [P.], seq 386996:387192, ack 181, win 615, length 196
17:13:11.153197 IP 167.99.182.113.ssh > cpea84e3f5bc443-cma84e3f5bc440.cpe.net.fido.ca.49919: Flags [P.], seq 387192:387388, ack 181, win 615, length 196
17:13:11.153254 IP 167.99.182.113.ssh > cpea84e3f5bc443-cma84e3f5bc440.cpe.net.fido.ca.49919: Flags [P.], seq 387388:387584, ack 181, win 615, length 196
17:13:11.153368 IP 167.99.182.113.ssh > cpea84e3f5bc443-cma84e3f5bc440.cpe.net.fido.ca.49919: Flags [P.], seq 387584:387780, ack 181, win 615, length 196
17:13:11.153431 IP 167.99.182.113.ssh > cpea84e3f5bc443-cma84e3f5bc440.cpe.net.fido.ca.49919: Flags [P.], seq 387780:387976, ack 181, win 615, length 196
17:13:11.153489 IP 167.99.182.113.ssh > cpea84e3f5bc443-cma84e3f5bc440.cpe.net.fido.ca.49919: Flags [P.], seq 387976:388172, ack 181, win 615, length 196
17:13:11.153554 IP 167.99.182.113.ssh > cpea84e3f5bc443-cma84e3f5bc440.cpe.net.fido.ca.49919: Flags [P.], seq 388172:388368, ack 181, win 615, length 196
17:13:11.153609 IP 167.99.182.113.ssh > cpea84e3f5bc443-cma84e3f5bc440.cpe.net.fido.ca.49919: Flags [P.], seq 388368:388564, ack 181, win 615, length 196
17:13:11.153667 IP 167.99.182.113.ssh > cpea84e3f5bc443-cma84e3f5bc440.cpe.net.fido.ca.49919: Flags [P.], seq 388564:388760, ack 181, win 615, length 196
17:13:11.153722 IP 167.99.182.113.ssh > cpea84e3f5bc443-cma84e3f5bc440.cpe.net.fido.ca.49919: Flags [P.], seq 388760:388956, ack 181, win 615, length 196
17:13:11.153779 IP 167.99.182.113.ssh > cpea84e3f5bc443-cma84e3f5bc440.cpe.net.fido.ca.49919: Flags [P.], seq 388956:389152, ack 181, win 615, length 196
17:13:11.153837 IP 167.99.182.113.ssh > cpea84e3f5bc443-cma84e3f5bc440.cpe.net.fido.ca.49919: Flags [P.], seq 389152:389348, ack 181, win 615, length 196
17:13:11.153923 IP 167.99.182.113.ssh > cpea84e3f5bc443-cma84e3f5bc440.cpe.net.fido.ca.49919: Flags [P.], seq 389348:389544, ack 181, win 615, length 196
17:13:11.154025 IP 167.99.182.113.ssh > cpea84e3f5bc443-cma84e3f5bc440.cpe.net.fido.ca.49919: Flags [P.], seq 389544:389740, ack 181, win 615, length 196
17:13:11.154101 IP 167.99.182.113.ssh > cpea84e3f5bc443-cma84e3f5bc440.cpe.net.fido.ca.49919: Flags [P.], seq 389740:389936, ack 181, win 615, length 196
17:13:11.154161 IP 167.99.182.113.ssh > cpea84e3f5bc443-cma84e3f5bc440.cpe.net.fido.ca.49919: Flags [P.], seq 389936:390132, ack 181, win 615, length 196
17:13:11.154217 IP 167.99.182.113.ssh > cpea84e3f5bc443-cma84e3f5bc440.cpe.net.fido.ca.49919: Flags [P.], seq 390132:390328, ack 181, win 615, length 196
17:13:11.154273 IP 167.99.182.113.ssh > cpea84e3f5bc443-cma84e3f5bc440.cpe.net.fido.ca.49919: Flags [P.], seq 390328:390524, ack 181, win 615, length 196
17:13:11.154331 IP 167.99.182.113.ssh > cpea84e3f5bc443-cma84e3f5bc440.cpe.net.fido.ca.49919: Flags [P.], seq 390524:390720, ack 181, win 615, length 196
17:13:11.154388 IP 167.99.182.113.ssh > cpea84e3f5bc443-cma84e3f5bc440.cpe.net.fido.ca.49919: Flags [P.], seq 390720:390916, ack 181, win 615, length 196
17:13:11.154470 IP 167.99.182.113.ssh > cpea84e3f5bc443-cma84e3f5bc440.cpe.net.fido.ca.49919: Flags [P.], seq 390916:391112, ack 181, win 615, length 196
17:13:11.154564 IP 167.99.182.113.ssh > cpea84e3f5bc443-cma84e3f5bc440.cpe.net.fido.ca.49919: Flags [P.], seq 391112:391308, ack 181, win 615, length 196
17:13:11.154642 IP 167.99.182.113.ssh > cpea84e3f5bc443-cma84e3f5bc440.cpe.net.fido.ca.49919: Flags [P.], seq 391308:391504, ack 181, win 615, length 196
17:13:11.154701 IP 167.99.182.113.ssh > cpea84e3f5bc443-cma84e3f5bc440.cpe.net.fido.ca.49919: Flags [P.], seq 391504:391700, ack 181, win 615, length 196
17:13:11.154756 IP 167.99.182.113.ssh > cpea84e3f5bc443-cma84e3f5bc440.cpe.net.fido.ca.49919: Flags [P.], seq 391700:391896, ack 181, win 615, length 196
17:13:11.154816 IP 167.99.182.113.ssh > cpea84e3f5bc443-cma84e3f5bc440.cpe.net.fido.ca.49919: Flags [P.], seq 391896:392092, ack 181, win 615, length 196
17:13:11.154873 IP 167.99.182.113.ssh > cpea84e3f5bc443-cma84e3f5bc440.cpe.net.fido.ca.49919: Flags [P.], seq 392092:392288, ack 181, win 615, length 196
17:13:11.154928 IP 167.99.182.113.ssh > cpea84e3f5bc443-cma84e3f5bc440.cpe.net.fido.ca.49919: Flags [P.], seq 392288:392484, ack 181, win 615, length 196
17:13:11.154986 IP 167.99.182.113.ssh > cpea84e3f5bc443-cma84e3f5bc440.cpe.net.fido.ca.49919: Flags [P.], seq 392484:392680, ack 181, win 615, length 196
17:13:11.155045 IP 167.99.182.113.ssh > cpea84e3f5bc443-cma84e3f5bc440.cpe.net.fido.ca.49919: Flags [P.], seq 392680:392876, ack 181, win 615, length 196
17:13:11.155104 IP 167.99.182.113.ssh > cpea84e3f5bc443-cma84e3f5bc440.cpe.net.fido.ca.49919: Flags [P.], seq 392876:393072, ack 181, win 615, length 196
17:13:11.155159 IP 167.99.182.113.ssh > cpea84e3f5bc443-cma84e3f5bc440.cpe.net.fido.ca.49919: Flags [P.], seq 393072:393268, ack 181, win 615, length 196
17:13:11.155227 IP 167.99.182.113.ssh > cpea84e3f5bc443-cma84e3f5bc440.cpe.net.fido.ca.49919: Flags [P.], seq 393268:393464, ack 181, win 615, length 196
17:13:11.155297 IP 167.99.182.113.ssh > cpea84e3f5bc443-cma84e3f5bc440.cpe.net.fido.ca.49919: Flags [P.], seq 393464:393660, ack 181, win 615, length 196
17:13:11.155354 IP 167.99.182.113.ssh > cpea84e3f5bc443-cma84e3f5bc440.cpe.net.fido.ca.49919: Flags [P.], seq 393660:393856, ack 181, win 615, length 196
17:13:11.155413 IP 167.99.182.113.ssh > cpea84e3f5bc443-cma84e3f5bc440.cpe.net.fido.ca.49919: Flags [P.], seq 393856:394052, ack 181, win 615, length 196
17:13:11.155467 IP 167.99.182.113.ssh > cpea84e3f5bc443-cma84e3f5bc440.cpe.net.fido.ca.49919: Flags [P.], seq 394052:394248, ack 181, win 615, length 196
17:13:11.155525 IP 167.99.182.113.ssh > cpea84e3f5bc443-cma84e3f5bc440.cpe.net.fido.ca.49919: Flags [P.], seq 394248:394444, ack 181, win 615, length 196
17:13:11.155586 IP 167.99.182.113.ssh > cpea84e3f5bc443-cma84e3f5bc440.cpe.net.fido.ca.49919: Flags [P.], seq 394444:394640, ack 181, win 615, length 196
17:13:11.155641 IP 167.99.182.113.ssh > cpea84e3f5bc443-cma84e3f5bc440.cpe.net.fido.ca.49919: Flags [P.], seq 394640:394836, ack 181, win 615, length 196
17:13:11.155696 IP 167.99.182.113.ssh > cpea84e3f5bc443-cma84e3f5bc440.cpe.net.fido.ca.49919: Flags [P.], seq 394836:395032, ack 181, win 615, length 196
17:13:11.155762 IP 167.99.182.113.ssh > cpea84e3f5bc443-cma84e3f5bc440.cpe.net.fido.ca.49919: Flags [P.], seq 395032:395228, ack 181, win 615, length 196
17:13:11.155818 IP 167.99.182.113.ssh > cpea84e3f5bc443-cma84e3f5bc440.cpe.net.fido.ca.49919: Flags [P.], seq 395228:395424, ack 181, win 615, length 196
17:13:11.155873 IP 167.99.182.113.ssh > cpea84e3f5bc443-cma84e3f5bc440.cpe.net.fido.ca.49919: Flags [P.], seq 395424:395620, ack 181, win 615, length 196
17:13:11.155927 IP 167.99.182.113.ssh > cpea84e3f5bc443-cma84e3f5bc440.cpe.net.fido.ca.49919: Flags [P.], seq 395620:395816, ack 181, win 615, length 196
17:13:11.155986 IP 167.99.182.113.ssh > cpea84e3f5bc443-cma84e3f5bc440.cpe.net.fido.ca.49919: Flags [P.], seq 395816:396012, ack 181, win 615, length 196
17:13:11.156043 IP 167.99.182.113.ssh > cpea84e3f5bc443-cma84e3f5bc440.cpe.net.fido.ca.49919: Flags [P.], seq 396012:396208, ack 181, win 615, length 196
17:13:11.156103 IP 167.99.182.113.ssh > cpea84e3f5bc443-cma84e3f5bc440.cpe.net.fido.ca.49919: Flags [P.], seq 396208:396404, ack 181, win 615, length 196
17:13:11.156157 IP 167.99.182.113.ssh > cpea84e3f5bc443-cma84e3f5bc440.cpe.net.fido.ca.49919: Flags [P.], seq 396404:396600, ack 181, win 615, length 196
17:13:11.156214 IP 167.99.182.113.ssh > cpea84e3f5bc443-cma84e3f5bc440.cpe.net.fido.ca.49919: Flags [P.], seq 396600:396796, ack 181, win 615, length 196
17:13:11.156270 IP 167.99.182.113.ssh > cpea84e3f5bc443-cma84e3f5bc440.cpe.net.fido.ca.49919: Flags [P.], seq 396796:396992, ack 181, win 615, length 196
17:13:11.156329 IP 167.99.182.113.ssh > cpea84e3f5bc443-cma84e3f5bc440.cpe.net.fido.ca.49919: Flags [P.], seq 396992:397188, ack 181, win 615, length 196
17:13:11.156425 IP 167.99.182.113.ssh > cpea84e3f5bc443-cma84e3f5bc440.cpe.net.fido.ca.49919: Flags [P.], seq 397188:397384, ack 181, win 615, length 196
17:13:11.156498 IP 167.99.182.113.ssh > cpea84e3f5bc443-cma84e3f5bc440.cpe.net.fido.ca.49919: Flags [P.], seq 397384:397580, ack 181, win 615, length 196
17:13:11.156559 IP 167.99.182.113.ssh > cpea84e3f5bc443-cma84e3f5bc440.cpe.net.fido.ca.49919: Flags [P.], seq 397580:397776, ack 181, win 615, length 196
17:13:11.156616 IP 167.99.182.113.ssh > cpea84e3f5bc443-cma84e3f5bc440.cpe.net.fido.ca.49919: Flags [P.], seq 397776:397972, ack 181, win 615, length 196
17:13:11.156676 IP 167.99.182.113.ssh > cpea84e3f5bc443-cma84e3f5bc440.cpe.net.fido.ca.49919: Flags [P.], seq 397972:398168, ack 181, win 615, length 196
