90384, ack 577, win 615, length 196
17:13:33.547105 IP 167.99.182.113.ssh > cpea84e3f5bc443-cma84e3f5bc440.cpe.net.fido.ca.49919: Flags [P.], seq 1090384:1090580, ack 577, win 615, length 196
17:13:33.547192 IP 167.99.182.113.ssh > cpea84e3f5bc443-cma84e3f5bc440.cpe.net.fido.ca.49919: Flags [P.], seq 1090580:1090776, ack 577, win 615, length 196
17:13:33.547248 IP 167.99.182.113.ssh > cpea84e3f5bc443-cma84e3f5bc440.cpe.net.fido.ca.49919: Flags [P.], seq 1090776:1090972, ack 577, win 615, length 196
17:13:33.547304 IP 167.99.182.113.ssh > cpea84e3f5bc443-cma84e3f5bc440.cpe.net.fido.ca.49919: Flags [P.], seq 1090972:1091168, ack 577, win 615, length 196
17:13:33.547361 IP 167.99.182.113.ssh > cpea84e3f5bc443-cma84e3f5bc440.cpe.net.fido.ca.49919: Flags [P.], seq 1091168:1091364, ack 577, win 615, length 196
17:13:33.547418 IP 167.99.182.113.ssh > cpea84e3f5bc443-cma84e3f5bc440.cpe.net.fido.ca.49919: Flags [P.], seq 1091364:1091560, ack 577, win 615, length 196
17:13:33.547474 IP 167.99.182.113.ssh > cpea84e3f5bc443-cma84e3f5bc440.cpe.net.fido.ca.49919: Flags [P.], seq 1091560:1091756, ack 577, win 615, length 196
17:13:33.547528 IP 167.99.182.113.ssh > cpea84e3f5bc443-cma84e3f5bc440.cpe.net.fido.ca.49919: Flags [P.], seq 1091756:1091952, ack 577, win 615, length 196
17:13:33.547583 IP 167.99.182.113.ssh > cpea84e3f5bc443-cma84e3f5bc440.cpe.net.fido.ca.49919: Flags [P.], seq 1091952:1092148, ack 577, win 615, length 196
17:13:33.547639 IP 167.99.182.113.ssh > cpea84e3f5bc443-cma84e3f5bc440.cpe.net.fido.ca.49919: Flags [P.], seq 1092148:1092344, ack 577, win 615, length 196
17:13:33.547699 IP 167.99.182.113.ssh > cpea84e3f5bc443-cma84e3f5bc440.cpe.net.fido.ca.49919: Flags [P.], seq 1092344:1092540, ack 577, win 615, length 196
17:13:33.547750 IP cpea84e3f5bc443-cma84e3f5bc440.cpe.net.fido.ca.49919 > 167.99.182.113.ssh: Flags [.], ack 1036580, win 12381, length 0
17:13:33.547824 IP 167.99.182.113.ssh > cpea84e3f5bc443-cma84e3f5bc440.cpe.net.fido.ca.49919: Flags [P.], seq 1092540:1092736, ack 577, win 615, length 196
17:13:33.547897 IP 167.99.182.113.ssh > cpea84e3f5bc443-cma84e3f5bc440.cpe.net.fido.ca.49919: Flags [P.], seq 1092736:1093068, ack 577, win 615, length 332
17:13:33.547956 IP 167.99.182.113.ssh > cpea84e3f5bc443-cma84e3f5bc440.cpe.net.fido.ca.49919: Flags [P.], seq 1093068:1093264, ack 577, win 615, length 196
17:13:33.548010 IP 167.99.182.113.ssh > cpea84e3f5bc443-cma84e3f5bc440.cpe.net.fido.ca.49919: Flags [P.], seq 1093264:1093460, ack 577, win 615, length 196
17:13:33.548068 IP 167.99.182.113.ssh > cpea84e3f5bc443-cma84e3f5bc440.cpe.net.fido.ca.49919: Flags [P.], seq 1093460:1093656, ack 577, win 615, length 196
17:13:33.548123 IP 167.99.182.113.ssh > cpea84e3f5bc443-cma84e3f5bc440.cpe.net.fido.ca.49919: Flags [P.], seq 1093656:1093852, ack 577, win 615, length 196
17:13:33.548177 IP 167.99.182.113.ssh > cpea84e3f5bc443-cma84e3f5bc440.cpe.net.fido.ca.49919: Flags [P.], seq 1093852:1094048, ack 577, win 615, length 196
17:13:33.548231 IP 167.99.182.113.ssh > cpea84e3f5bc443-cma84e3f5bc440.cpe.net.fido.ca.49919: Flags [P.], seq 1094048:1094244, ack 577, win 615, length 196
17:13:33.548285 IP 167.99.182.113.ssh > cpea84e3f5bc443-cma84e3f5bc440.cpe.net.fido.ca.49919: Flags [P.], seq 1094244:1094440, ack 577, win 615, length 196
17:13:33.548368 IP 167.99.182.113.ssh > cpea84e3f5bc443-cma84e3f5bc440.cpe.net.fido.ca.49919: Flags [P.], seq 1094440:1094636, ack 577, win 615, length 196
17:13:33.548456 IP 167.99.182.113.ssh > cpea84e3f5bc443-cma84e3f5bc440.cpe.net.fido.ca.49919: Flags [P.], seq 1094636:1094832, ack 577, win 615, length 196
17:13:33.548520 IP 167.99.182.113.ssh > cpea84e3f5bc443-cma84e3f5bc440.cpe.net.fido.ca.49919: Flags [P.], seq 1094832:1095028, ack 577, win 615, length 196
17:13:33.548576 IP 167.99.182.113.ssh > cpea84e3f5bc443-cma84e3f5bc440.cpe.net.fido.ca.49919: Flags [P.], seq 1095028:1095224, ack 577, win 615, length 196
17:13:33.548634 IP 167.99.182.113.ssh > cpea84e3f5bc443-cma84e3f5bc440.cpe.net.fido.ca.49919: Flags [P.], seq 1095224:1095420, ack 577, win 615, length 196
17:13:33.548691 IP 167.99.182.113.ssh > cpea84e3f5bc443-cma84e3f5bc440.cpe.net.fido.ca.49919: Flags [P.], seq 1095420:1095616, ack 577, win 615, length 196
17:13:33.548746 IP 167.99.182.113.ssh > cpea84e3f5bc443-cma84e3f5bc440.cpe.net.fido.ca.49919: Flags [P.], seq 1095616:1095812, ack 577, win 615, length 196
17:13:33.548804 IP 167.99.182.113.ssh > cpea84e3f5bc443-cma84e3f5bc440.cpe.net.fido.ca.49919: Flags [P.], seq 1095812:1096008, ack 577, win 615, length 196
17:13:33.548990 IP 167.99.182.113.ssh > cpea84e3f5bc443-cma84e3f5bc440.cpe.net.fido.ca.49919: Flags [P.], seq 1096008:1096204, ack 577, win 615, length 196
17:13:33.549058 IP 167.99.182.113.ssh > cpea84e3f5bc443-cma84e3f5bc440.cpe.net.fido.ca.49919: Flags [P.], seq 1096204:1096400, ack 577, win 615, length 196
17:13:33.549113 IP 167.99.182.113.ssh > cpea84e3f5bc443-cma84e3f5bc440.cpe.net.fido.ca.49919: Flags [P.], seq 1096400:1096596, ack 577, win 615, length 196
17:13:33.549168 IP 167.99.182.113.ssh > cpea84e3f5bc443-cma84e3f5bc440.cpe.net.fido.ca.49919: Flags [P.], seq 1096596:1096792, ack 577, win 615, length 196
17:13:33.549222 IP 167.99.182.113.ssh > cpea84e3f5bc443-cma84e3f5bc440.cpe.net.fido.ca.49919: Flags [P.], seq 1096792:1096988, ack 577, win 615, length 196
17:13:33.549345 IP 167.99.182.113.ssh > cpea84e3f5bc443-cma84e3f5bc440.cpe.net.fido.ca.49919: Flags [P.], seq 1096988:1097184, ack 577, win 615, length 196
17:13:33.549409 IP 167.99.182.113.ssh > cpea84e3f5bc443-cma84e3f5bc440.cpe.net.fido.ca.49919: Flags [P.], seq 1097184:1097380, ack 577, win 615, length 196
17:13:33.549465 IP 167.99.182.113.ssh > cpea84e3f5bc443-cma84e3f5bc440.cpe.net.fido.ca.49919: Flags [P.], seq 1097380:1097576, ack 577, win 615, length 196
17:13:33.549519 IP 167.99.182.113.ssh > cpea84e3f5bc443-cma84e3f5bc440.cpe.net.fido.ca.49919: Flags [P.], seq 1097576:1097772, ack 577, win 615, length 196
17:13:33.549600 IP 167.99.182.113.ssh > cpea84e3f5bc443-cma84e3f5bc440.cpe.net.fido.ca.49919: Flags [P.], seq 1097772:1097968, ack 577, win 615, length 196
17:13:33.549663 IP 167.99.182.113.ssh > cpea84e3f5bc443-cma84e3f5bc440.cpe.net.fido.ca.49919: Flags [P.], seq 1097968:1098164, ack 577, win 615, length 196
17:13:33.549718 IP 167.99.182.113.ssh > cpea84e3f5bc443-cma84e3f5bc440.cpe.net.fido.ca.49919: Flags [P.], seq 1098164:1098360, ack 577, win 615, length 196
17:13:33.549781 IP cpea84e3f5bc443-cma84e3f5bc440.cpe.net.fido.ca.49919 > 167.99.182.113.ssh: Flags [P.], seq 577:613, ack 1036580, win 12381, length 36
17:13:33.549781 IP cpea84e3f5bc443-cma84e3f5bc440.cpe.net.fido.ca.49919 > 167.99.182.113.ssh: Flags [.], ack 1041872, win 12379, length 0
17:13:33.549781 IP cpea84e3f5bc443-cma84e3f5bc440.cpe.net.fido.ca.49919 > 167.99.182.113.ssh: Flags [.], ack 1054492, win 12381, length 0
17:13:33.549781 IP cpea84e3f5bc443-cma84e3f5bc440.cpe.net.fido.ca.49919 > 167.99.182.113.ssh: Flags [.], ack 1056844, win 12381, length 0
17:13:33.549799 IP 167.99.182.113.ssh > cpea84e3f5bc443-cma84e3f5bc440.cpe.net.fido.ca.49919: Flags [P.], seq 1098360:1098556, ack 577, win 615, length 196
17:13:33.549952 IP 167.99.182.113.ssh > cpea84e3f5bc443-cma84e3f5bc440.cpe.net.fido.ca.49919: Flags [P.], seq 1098556:1099320, ack 613, win 615, length 764
17:13:33.550013 IP 167.99.182.113.ssh > cpea84e3f5bc443-cma84e3f5bc440.cpe.net.fido.ca.49919: Flags [P.], seq 1099320:1099516, ack 613, win 615, length 196
17:13:33.550077 IP 167.99.182.113.ssh > cpea84e3f5bc443-cma84e3f5bc440.cpe.net.fido.ca.49919: Flags [P.], seq 1099516:1099712, ack 613, win 615, length 196
17:13:33.550134 IP 167.99.182.113.ssh > cpea84e3f5bc443-cma84e3f5bc440.cpe.net.fido.ca.49919: Flags [P.], seq 1099712:1099908, ack 613, win 615, length 196
17:13:33.550188 IP 167.99.182.113.ssh > cpea84e3f5bc443-cma84e3f5bc440.cpe.net.fido.ca.49919: Flags [P.], seq 1099908:1100104, ack 613, win 615, length 196
17:13:33.550244 IP 167.99.182.113.ssh > cpea84e3f5bc443-cma84e3f5bc440.cpe.net.fido.ca.49919: Flags [P.], seq 1100104:1100300, ack 613, win 615, length 196
17:13:33.550302 IP 167.99.182.113.ssh > cpea84e3f5bc443-cma84e3f5bc440.cpe.net.fido.ca.49919: Flags [P.], seq 1100300:1100496, ack 613, win 615, length 196
17:13:33.550369 IP 167.99.182.113.ssh > cpea84e3f5bc443-cma84e3f5bc440.cpe.net.fido.ca.49919: Flags [P.], seq 1100496:1100692, ack 613, win 615, length 196
17:13:33.550428 IP 167.99.182.113.ssh > cpea84e3f5bc443-cma84e3f5bc440.cpe.net.fido.ca.49919: Flags [P.], seq 1100692:1100888, ack 613, win 615, length 196
17:13:33.550483 IP 167.99.182.113.ssh > cpea84e3f5bc443-cma84e3f5bc440.cpe.net.fido.ca.49919: Flags [P.], seq 1100888:1101084, ack 613, win 615, length 196
17:13:33.550541 IP 167.99.182.113.ssh > cpea84e3f5bc443-cma84e3f5bc440.cpe.net.fido.ca.49919: Flags [P.], seq 1101084:1101280, ack 613, win 615, length 196
17:13:33.550597 IP 167.99.182.113.ssh > cpea84e3f5bc443-cma84e3f5bc440.cpe.net.fido.ca.49919: Flags [P.], seq 1101280:1101476, ack 613, win 615, length 196
17:13:33.550652 IP 167.99.182.113.ssh > cpea84e3f5bc443-cma84e3f5bc440.cpe.net.fido.ca.49919: Flags [P.], seq 1101476:1101672, ack 613, win 615, length 196
17:13:33.550719 IP 167.99.182.113.ssh > cpea84e3f5bc443-cma84e3f5bc440.cpe.net.fido.ca.49919: Flags [P.], seq 1101672:1101868, ack 613, win 615, length 196
17:13:33.550781 IP 167.99.182.113.ssh > cpea84e3f5bc443-cma84e3f5bc440.cpe.net.fido.ca.49919: Flags [P.], seq 1101868:1102064, ack 613, win 615, length 196
17:13:33.550856 IP 167.99.182.113.ssh > cpea84e3f5bc443-cma84e3f5bc440.cpe.net.fido.ca.49919: Flags [P.], seq 1102064:1102260, ack 613, win 615, length 196
17:13:33.550935 IP 167.99.182.113.ssh > cpea84e3f5bc443-cma84e3f5bc440.cpe.net.fido.ca.49919: Flags [P.], seq 1102260:1102456, ack 613, win 615, length 196
17:13:33.551006 IP 167.99.182.113.ssh > cpea84e3f5bc443-cma84e3f5bc440.cpe.net.fido.ca.49919: Flags [P.], seq 1102456:1102652, ack 613, win 615, length 196
17:13:33.551063 IP 167.99.182.113.ssh > cpea84e3f5bc443-cma84e3f5bc440.cpe.net.fido.ca.49919: Flags [P.], seq 1102652:1102848, ack 613, win 615, length 196
17:13:33.551119 IP 167.99.182.113.ssh > cpea84e3f5bc443-cma84e3f5bc440.cpe.net.fido.ca.49919: Flags [P.], seq 1102848:1103044, ack 613, win 615, length 196
17:13:33.551173 IP 167.99.182.113.ssh > cpea84e3f5bc443-cma84e3f5bc440.cpe.net.fido.ca.49919: Flags [P.], seq 1103044:1103240, ack 613, win 615, length 196
17:13:33.551258 IP 167.99.182.113.ssh > cpea84e3f5bc443-cma84e3f5bc440.cpe.net.fido.ca.49919: Flags [P.], seq 1103240:1103436, ack 613, win 615, length 196
17:13:33.551335 IP 167.99.182.113.ssh > cpea84e3f5bc443-cma84e3f5bc440.cpe.net.fido.ca.49919: Flags [P.], seq 1103436:1103632, ack 613, win 615, length 196
17:13:33.551405 IP 167.99.182.113.ssh > cpea84e3f5bc443-cma84e3f5bc440.cpe.net.fido.ca.49919: Flags [P.], seq 1103632:1103828, ack 613, win 615, length 196
17:13:33.551461 IP 167.99.182.113.ssh > cpea84e3f5bc443-cma84e3f5bc440.cpe.net.fido.ca.49919: Flags [P.], seq 1103828:1104024, ack 613, win 615, length 196
17:13:33.551518 IP 167.99.182.113.ssh > cpea84e3f5bc443-cma84e3f5bc440.cpe.net.fido.ca.49919: Flags [P.], seq 1104024:1104220, ack 613, win 615, length 196
17:13:33.551587 IP 167.99.182.113.ssh > cpea84e3f5bc443-cma84e3f5bc440.cpe.net.fido.ca.49919: Flags [P.], seq 1104220:1104416, ack 613, win 615, length 196
17:13:33.551642 IP 167.99.182.113.ssh > cpea84e3f5bc443-cma84e3f5bc440.cpe.net.fido.ca.49919: Flags [P.], seq 1104416:1104612, ack 613, win 615, length 196
17:13:33.551700 IP 167.99.182.113.ssh > cpea84e3f5bc443-cma84e3f5bc440.cpe.net.fido.ca.49919: Flags [P.], seq 1104612:1104808, ack 613, win 615, length 196
17:13:33.551756 IP 167.99.182.113.ssh > cpea84e3f5bc443-cma84e3f5bc440.cpe.net.fido.ca.49919: Flags [P.], seq 1104808:1105004, ack 613, win 615, length 196
17:13:33.551812 IP 167.99.182.113.ssh > cpea84e3f5bc443-cma84e3f5bc440.cpe.net.fido.ca.49919: Flags [P.], seq 1105004:1105200, ack 613, win 615, length 196
17:13:33.551867 IP 167.99.182.113.ssh > cpea84e3f5bc443-cma84e3f5bc440.cpe.net.fido.ca.49919: Flags [P.], seq 1105200:1105396, ack 613, win 615, length 196
17:13:33.551924 IP 167.99.182.113.ssh > cpea84e3f5bc443-cma84e3f5bc440.cpe.net.fido.ca.49919: Flags [P.], seq 1105396:1105592, ack 613, win 615, length 196
17:13:33.551980 IP 167.99.182.113.ssh > cpea84e3f5bc443-cma84e3f5bc440.cpe.net.fido.ca.49919: Flags [P.], seq 1105592:1105788, ack 613, win 615, length 196
17:13:33.552035 IP 167.99.182.113.ssh > cpea84e3f5bc443-cma84e3f5bc440.cpe.net.fido.ca.49919: Flags [P.], seq 1105788:1105984, ack 613, win 615, length 196
17:13:33.552090 IP 167.99.182.113.ssh > cpea84e3f5bc443-cma84e3f5bc440.cpe.net.fido.ca.49919: Flags [P.], seq 1105984:1106180, ack 613, win 615, length 196
17:13:33.552176 IP 167.99.182.113.ssh > cpea84e3f5bc443-cma84e3f5bc440.cpe.net.fido.ca.49919: Flags [P.], seq 1106180:1106376, ack 613, win 615, length 196
17:13:33.552245 IP 167.99.182.113.ssh > cpea84e3f5bc443-cma84e3f5bc440.cpe.net.fido.ca.49919: Flags [P.], seq 1106376:1106572, ack 613, win 615, length 196
17:13:33.552314 IP 167.99.182.113.ssh > cpea84e3f5bc443-cma84e3f5bc440.cpe.net.fido.ca.49919: Flags [P.], seq 1106572:1106768, ack 613, win 615, length 196
17:13:33.552370 IP 167.99.182.113.ssh > cpea84e3f5bc443-cma84e3f5bc440.cpe.net.fido.ca.49919: Flags [P.], seq 1106768:1106964, ack 613, win 615, length 196
17:13:33.552429 IP 167.99.182.113.ssh > cpea84e3f5bc443-cma84e3f5bc440.cpe.net.fido.ca.49919: Flags [P.], seq 1106964:1107160, ack 613, win 615, length 196
17:13:33.552487 IP 167.99.182.113.ssh > cpea84e3f5bc443-cma84e3f5bc440.cpe.net.fido.ca.49919: Flags [P.], seq 1107160:1107356, ack 613, win 615, length 196
17:13:33.552542 IP 167.99.182.113.ssh > cpea84e3f5bc443-cma84e3f5bc440.cpe.net.fido.ca.49919: Flags [P.], seq 1107356:1107552, ack 613, win 615, length 196
17:13:33.552601 IP 167.99.182.113.ssh > cpea84e3f5bc443-cma84e3f5bc440.cpe.net.fido.ca.49919: Flags [P.], seq 1107552:1107748, ack 613, win 615, length 196
17:13:33.552664 IP 167.99.182.113.ssh > cpea84e3f5bc443-cma84e3f5bc440.cpe.net.fido.ca.49919: Flags [P.], seq 1107748:1107944, ack 613, win 615, length 196
17:13:33.552737 IP 167.99.182.113.ssh > cpea84e3f5bc443-cma84e3f5bc440.cpe.net.fido.ca.49919: Flags [P.], seq 1107944:1108140, ack 613, win 615, length 196
17:13:33.552810 IP 167.99.182.113.ssh > cpea84e3f5bc443-cma84e3f5bc440.cpe.net.fido.ca.49919: Flags [P.], seq 1108140:1108336, ack 613, win 615, length 196
17:13:33.552869 IP 167.99.182.113.ssh > cpea84e3f5bc443-cma84e3f5bc440.cpe.net.fido.ca.49919: Flags [P.], seq 1108336:1108532, ack 613, win 615, length 196
17:13:33.552924 IP 167.99.182.113.ssh > cpea84e3f5bc443-cma84e3f5bc440.cpe.net.fido.ca.49919: Flags [P.], seq 1108532:1108728, ack 613, win 615, length 196
17:13:33.552980 IP 167.99.182.113.ssh > cpea84e3f5bc443-cma84e3f5bc440.cpe.net.fido.ca.49919: Flags [P.], seq 1108728:1108924, ack 613, win 615, length 196
17:13:33.553036 IP 167.99.182.113.ssh > cpea84e3f5bc443-cma84e3f5bc440.cpe.net.fido.ca.49919: Flags [P.], seq 1108924:1109120, ack 613, win 615, length 196
17:13:33.553095 IP 167.99.182.113.ssh > cpea84e3f5bc443-cma84e3f5bc440.cpe.net.fido.ca.49919: Flags [P.], seq 1109120:1109316, ack 613, win 615, length 196
17:13:33.553149 IP 167.99.182.113.ssh > cpea84e3f5bc443-cma84e3f5bc440.cpe.net.fido.ca.49919: Flags [P.], seq 1109316:1109512, ack 613, win 615, length 196
17:13:33.553207 IP 167.99.182.113.ssh > cpea84e3f5bc443-cma84e3f5bc440.cpe.net.fido.ca.49919: Flags [P.], seq 1109512:1109708, ack 613, win 615, length 196
17:13:33.553261 IP 167.99.182.113.ssh > cpea84e3f5bc443-cma84e3f5bc440.cpe.net.fido.ca.49919: Flags [P.], seq 1109708:1109904, ack 613, win 615, length 196
17:13:33.553350 IP 167.99.182.113.ssh > cpea84e3f5bc443-cma84e3f5bc440.cpe.net.fido.ca.49919: Flags [P.], seq 1109904:1110100, ack 613, win 615, length 196
17:13:33.553407 IP 167.99.182.113.ssh > cpea84e3f5bc443-cma84e3f5bc440.cpe.net.fido.ca.49919: Flags [P.], seq 1110100:1110296, ack 613, win 615, length 196
17:13:33.553465 IP 167.99.182.113.ssh > cpea84e3f5bc443-cma84e3f5bc440.cpe.net.fido.ca.49919: Flags [P.], seq 1110296:1110492, ack 613, win 615, length 196
17:13:33.553520 IP 167.99.182.113.ssh > cpea84e3f5bc443-cma84e3f5bc440.cpe.net.fido.ca.49919: Flags [P.], seq 1110492:1110688, ack 613, win 615, length 196
17:13:33.553580 IP 167.99.182.113.ssh > cpea84e3f5bc443-cma84e3f5bc440.cpe.net.fido.ca.49919: Flags [P.], seq 1110688:1110884, ack 613, win 615, length 196
17:13:33.553636 IP 167.99.182.113.ssh > cpea84e3f5bc443-cma84e3f5bc440.cpe.net.fido.ca.49919: Flags [P.], seq 1110884:1111080, ack 613, win 615, length 196
17:13:33.553693 IP 167.99.182.113.ssh > cpea84e3f5bc443-cma84e3f5bc440.cpe.net.fido.ca.49919: Flags [P.], seq 1111080:1111276, ack 613, win 615, length 196
17:13:33.553751 IP 167.99.182.113.ssh > cpea84e3f5bc443-cma84e3f5bc440.cpe.net.fido.ca.49919: Flags [P.], seq 1111276:1111472, ack 613, win 615, length 196
17:13:33.553806 IP 167.99.182.113.ssh > cpea84e3f5bc443-cma84e3f5bc440.cpe.net.fido.ca.49919: Flags [P.], seq 1111472:1111668, ack 613, win 615, length 196
17:13:33.553871 IP 167.99.182.113.ssh > cpea84e3f5bc443-cma84e3f5bc440.cpe.net.fido.ca.49919: Flags [P.], seq 1111668:1111864, ack 613, win 615, length 196
17:13:33.553927 IP 167.99.182.113.ssh > cpea84e3f5bc443-cma84e3f5bc440.cpe.net.fido.ca.49919: Flags [P.], seq 1111864:1112060, ack 613, win 615, length 196
17:13:33.553982 IP 167.99.182.113.ssh > cpea84e3f5bc443-cma84e3f5bc440.cpe.net.fido.ca.49919: Flags [P.], seq 1112060:1112256, ack 613, win 615, length 196
17:13:33.554042 IP 167.99.182.113.ssh > cpea84e3f5bc443-cma84e3f5bc440.cpe.net.fido.ca.49919: Flags [P.], seq 1112256:1112452, ack 613, win 615, length 196
17:13:33.554097 IP 167.99.182.113.ssh > cpea84e3f5bc443-cma84e3f5bc440.cpe.net.fido.ca.49919: Flags [P.], seq 1112452:1112648, ack 613, win 615, length 196
17:13:33.554151 IP 167.99.182.113.ssh > cpea84e3f5bc443-cma84e3f5bc440.cpe.net.fido.ca.49919: Flags [P.], seq 1112648:1112844, ack 613, win 615, length 196
17:13:33.554208 IP 167.99.182.113.ssh > cpea84e3f5bc443-cma84e3f5bc440.cpe.net.fido.ca.49919: Flags [P.], seq 1112844:1113040, ack 613, win 615, length 196
17:13:33.554263 IP 167.99.182.113.ssh > cpea84e3f5bc443-cma84e3f5bc440.cpe.net.fido.ca.49919: Flags [P.], seq 1113040:1113236, ack 613, win 615, length 196
17:13:33.554319 IP 167.99.182.113.ssh > cpea84e3f5bc443-cma84e3f5bc440.cpe.net.fido.ca.49919: Flags [P.], seq 1113236:1113432, ack 613, win 615, length 196
17:13:33.554393 IP 167.99.182.113.ssh > cpea84e3f5bc443-cma84e3f5bc440.cpe.net.fido.ca.49919: Flags [P.], seq 1113432:1113628, ack 613, win 615, length 196
17:13:33.554461 IP 167.99.182.113.ssh > cpea84e3f5bc443-cma84e3f5bc440.cpe.net.fido.ca.49919: Flags [P.], seq 1113628:1113824, ack 613, win 615, length 196
17:13:33.554532 IP 167.99.182.113.ssh > cpea84e3f5bc443-cma84e3f5bc440.cpe.net.fido.ca.49919: Flags [P.], seq 1113824:1114020, ack 613, win 615, length 196
17:13:33.554602 IP 167.99.182.113.ssh > cpea84e3f5bc443-cma84e3f5bc440.cpe.net.fido.ca.49919: Flags [P.], seq 1114020:1114216, ack 613, win 615, length 196
17:13:33.554679 IP 167.99.182.113.ssh > cpea84e3f5bc443-cma84e3f5bc440.cpe.net.fido.ca.49919: Flags [P.], seq 1114216:1114412, ack 613, win 615, length 196
17:13:33.554749 IP 167.99.182.113.ssh > cpea84e3f5bc443-cma84e3f5bc440.cpe.net.fido.ca.49919: Flags [P.], seq 1114412:1114608, ack 613, win 615, length 196
17:13:33.554819 IP 167.99.182.113.ssh > cpea84e3f5bc443-cma84e3f5bc440.cpe.net.fido.ca.49919: Flags [P.], seq 1114608:1114804, ack 613, win 615, length 196
17:13:33.554888 IP 167.99.182.113.ssh > cpea84e3f5bc443-cma84e3f5bc440.cpe.net.fido.ca.49919: Flags [P.], seq 1114804:1115000, ack 613, win 615, length 196
17:13:33.554962 IP 167.99.182.113.ssh > cpea84e3f5bc443-cma84e3f5bc440.cpe.net.fido.ca.49919: Flags [P.], seq 1115000:1115196, ack 613, win 615, length 196
17:13:33.555039 IP 167.99.182.113.ssh > cpea84e3f5bc443-cma84e3f5bc440.cpe.net.fido.ca.49919: Flags [P.], seq 1115196:1115392, ack 613, win 615, length 196
17:13:33.555109 IP 167.99.182.113.ssh > cpea84e3f5bc443-cma84e3f5bc440.cpe.net.fido.ca.49919: Flags [P.], seq 1115392:1115588, ack 613, win 615, length 196
17:13:33.555198 IP 167.99.182.113.ssh > cpea84e3f5bc443-cma84e3f5bc440.cpe.net.fido.ca.49919: Flags [P.], seq 1115588:1115784, ack 613, win 615, length 196
17:13:33.555268 IP 167.99.182.113.ssh > cpea84e3f5bc443-cma84e3f5bc440.cpe.net.fido.ca.49919: Flags [P.], seq 1115784:1115980, ack 613, win 615, length 196
17:13:33.555339 IP 167.99.182.113.ssh > cpea84e3f5bc443-cma84e3f5bc440.cpe.net.fido.ca.49919: Flags [P.], seq 1115980:1116176, ack 613, win 615, length 196
17:13:33.555407 IP 167.99.182.113.ssh > cpea84e3f5bc443-cma84e3f5bc440.cpe.net.fido.ca.49919: Flags [P.], seq 1116176:1116372, ack 613, win 615, length 196
17:13:33.555477 IP 167.99.182.113.ssh > cpea84e3f5bc443-cma84e3f5bc440.cpe.net.fido.ca.49919: Flags [P.], seq 1116372:1116568, ack 613, win 615, length 196
17:13:33.555543 IP 167.99.182.113.ssh > cpea84e3f5bc443-cma84e3f5bc440.cpe.net.fido.ca.49919: Flags [P.], seq 1116568:1116764, ack 613, win 615, length 196
17:13:33.555615 IP 167.99.182.113.ssh > cpea84e3f5bc443-cma84e3f5bc440.cpe.net.fido.ca.49919: Flags [P.], seq 1116764:1116960, ack 613, win 615, length 196
17:13:33.555685 IP 167.99.182.113.ssh > cpea84e3f5bc443-cma84e3f5bc440.cpe.net.fido.ca.49919: Flags [P.], seq 1116960:1117156, ack 613, win 615, length 196
17:13:33.555755 IP 167.99.182.113.ssh > cpea84e3f5bc443-cma84e3f5bc440.cpe.net.fido.ca.49919: Flags [P.], seq 1117156:1117352, ack 613, win 615, length 196
17:13:33.555822 IP 167.99.182.113.ssh > cpea84e3f5bc443-cma84e3f5bc440.cpe.net.fido.ca.49919: Flags [P.], seq 1117352:1117548, ack 613, win 615, length 196
17:13:33.555895 IP 167.99.182.113.ssh > cpea84e3f5bc443-cma84e3f5bc440.cpe.net.fido.ca.49919: Flags [P.], seq 1117548:1117744, ack 613, win 615, length 196
17:13:33.555962 IP 167.99.182.113.ssh > cpea84e3f5bc443-cma84e3f5bc440.cpe.net.fido.ca.49919: Flags [P.], seq 1117744:1117940, ack 613, win 615, length 196
17:13:33.556035 IP 167.99.182.113.ssh > cpea84e3f5bc443-cma84e3f5bc440.cpe.net.fido.ca.49919: Flags [P.], seq 1117940:1118136, ack 613, win 615, length 196
17:13:33.556106 IP 167.99.182.113.ssh > cpea84e3f5bc443-cma84e3f5bc440.cpe.net.fido.ca.49919: Flags [P.], seq 1118136:1118332, ack 613, win 615, length 196
17:13:33.556183 IP 167.99.182.113.ssh > cpea84e3f5bc443-cma84e3f5bc440.cpe.net.fido.ca.49919: Flags [P.], seq 1118332:1118528, ack 613, win 615, length 196
17:13:33.556250 IP 167.99.182.113.ssh > cpea84e3f5bc443-cma84e3f5bc440.cpe.net.fido.ca.49919: Flags [P.], seq 1118528:1118724, ack 613, win 615, length 196
17:13:33.556320 IP 167.99.182.113.ssh > cpea84e3f5bc443-cma84e3f5bc440.cpe.net.fido.ca.49919: Flags [P.], seq 1118724:1118920, ack 613, win 615, length 196
17:13:33.556389 IP 167.99.182.113.ssh > cpea84e3f5bc443-cma84e3f5bc440.cpe.net.fido.ca.49919: Flags [P.], seq 1118920:1119116, ack 613, win 615, length 196
17:13:33.556461 IP 167.99.182.113.ssh > cpea84e3f5bc443-cma84e3f5bc440.cpe.net.fido.ca.49919: Flags [P.], seq 1119116:1119312, ack 613, win 615, length 196
17:13:33.556529 IP 167.99.182.113.ssh > cpea84e3f5bc443-cma84e3f5bc440.cpe.net.fido.ca.49919: Flags [P.], seq 1119312:1119508, ack 613, win 615, length 196
17:13:33.556599 IP 167.99.182.113.ssh > cpea84e3f5bc443-cma84e3f5bc440.cpe.net.fido.ca.49919: Flags [P.], seq 1119508:1119704, ack 613, win 615, length 196
17:13:33.556666 IP 167.99.182.113.ssh > cpea84e3f5bc443-cma84e3f5bc440.cpe.net.fido.ca.49919: Flags [P.], seq 1119704:1119900, ack 613, win 615, length 196
17:13:33.556735 IP 167.99.182.113.ssh > cpea84e3f5bc443-cma84e3f5bc440.cpe.net.fido.ca.49919: Flags [P.], seq 1119900:1120096, ack 613, win 615, length 196
17:13:33.556801 IP 167.99.182.113.ssh > cpea84e3f5bc443-cma84e3f5bc440.cpe.net.fido.ca.49919: Flags [P.], seq 1120096:1120292, ack 613, win 615, length 196
17:13:33.556870 IP 167.99.182.113.ssh > cpea84e3f5bc443-cma84e3f5bc440.cpe.net.fido.ca.49919: Flags [P.], seq 1120292:1120488, ack 613, win 615, length 196
17:13:33.556936 IP 167.99.182.113.ssh > cpea84e3f5bc443-cma84e3f5bc440.cpe.net.fido.ca.49919: Flags [P.], seq 1120488:1120684, ack 613, win 615, length 196
17:13:33.557009 IP 167.99.182.113.ssh > cpea84e3f5bc443-cma84e3f5bc440.cpe.net.fido.ca.49919: Flags [P.], seq 1120684:1120880, ack 613, win 615, length 196
17:13:33.557077 IP 167.99.182.113.ssh > cpea84e3f5bc443-cma84e3f5bc440.cpe.net.fido.ca.49919: Flags [P.], seq 1120880:1121076, ack 613, win 615, length 196
17:13:33.557154 IP 167.99.182.113.ssh > cpea84e3f5bc443-cma84e3f5bc440.cpe.net.fido.ca.49919: Flags [P.], seq 1121076:1121272, ack 613, win 615, length 196
17:13:33.557223 IP 167.99.182.113.ssh > cpea84e3f5bc443-cma84e3f5bc440.cpe.net.fido.ca.49919: Flags [P.], seq 1121272:1121468, ack 613, win 615, length 196
17:13:33.557318 IP 167.99.182.113.ssh > cpea84e3f5bc443-cma84e3f5bc440.cpe.net.fido.ca.49919: Flags [P.], seq 1121468:1121664, ack 613, win 615, length 196
17:13:33.557386 IP 167.99.182.113.ssh > cpea84e3f5bc443-cma84e3f5bc440.cpe.net.fido.ca.49919: Flags [P.], seq 1121664:1121860, ack 613, win 615, length 196
17:13:33.557459 IP 167.99.182.113.ssh > cpea84e3f5bc443-cma84e3f5bc440.cpe.net.fido.ca.49919: Flags [P.], seq 1121860:1122056, ack 613, win 615, length 196
17:13:33.557527 IP 167.99.182.113.ssh > cpea84e3f5bc443-cma84e3f5bc440.cpe.net.fido.ca.49919: Flags [P.], seq 1122056:1122252, ack 613, win 615, length 196
17:13:33.557598 IP 167.99.182.113.ssh > cpea84e3f5bc443-cma84e3f5bc440.cpe.net.fido.ca.49919: Flags [P.], seq 1122252:1122448, ack 613, win 615, length 196
17:13:33.557666 IP 167.99.182.113.ssh > cpea84e3f5bc443-cma84e3f5bc440.cpe.net.fido.ca.49919: Flags [P.], seq 1122448:1122644, ack 613, win 615, length 196
17:13:33.557736 IP 167.99.182.113.ssh > cpea84e3f5bc443-cma84e3f5bc440.cpe.net.fido.ca.49919: Flags [P.], seq 1122644:1122840, ack 613, win 615, length 196
17:13:33.557806 IP 167.99.182.113.ssh > cpea84e3f5bc443-cma84e3f5bc440.cpe.net.fido.ca.49919: Flags [P.], seq 1122840:1123036, ack 613, win 615, length 196
17:13:33.557877 IP 167.99.182.113.ssh > cpea84e3f5bc443-cma84e3f5bc440.cpe.net.fido.ca.49919: Flags [P.], seq 1123036:1123232, ack 613, win 615, length 196
17:13:33.557945 IP 167.99.182.113.ssh > cpea84e3f5bc443-cma84e3f5bc440.cpe.net.fido.ca.49919: Flags [P.], seq 1123232:1123428, ack 613, win 615, length 196
17:13:33.558016 IP 167.99.182.113.ssh > cpea84e3f5bc443-cma84e3f5bc440.cpe.net.fido.ca.49919: Flags [P.], seq 1123428:1123624, ack 613, win 615, length 196
17:13:33.558086 IP 167.99.182.113.ssh > cpea84e3f5bc443-cma84e3f5bc440.cpe.net.fido.ca.49919: Flags [P.], seq 1123624:1123820, ack 613, win 615, length 196
17:13:33.558157 IP 167.99.182.113.ssh > cpea84e3f5bc443-cma84e3f5bc440.cpe.net.fido.ca.49919: Flags [P.], seq 1123820:1124016, ack 613, win 615, length 196
17:13:33.558225 IP 167.99.182.113.ssh > cpea84e3f5bc443-cma84e3f5bc440.cpe.net.fido.ca.49919: Flags [P.], seq 1124016:1124212, ack 613, win 615, length 196
17:13:33.558297 IP 167.99.182.113.ssh > cpea84e3f5bc443-cma84e3f5bc440.cpe.net.fido.ca.49919: Flags [P.], seq 1124212:1124408, ack 613, win 615, length 196
17:13:33.558369 IP 167.99.182.113.ssh > cpea84e3f5bc443-cma84e3f5bc440.cpe.net.fido.ca.49919: Flags [P.], seq 1124408:1124604, ack 613, win 615, length 196
17:13:33.558437 IP 167.99.182.113.ssh > cpea84e3f5bc443-cma84e3f5bc440.cpe.net.fido.ca.49919: Flags [P.], seq 1124604:1124800, ack 613, win 615, length 196
17:13:33.558507 IP 167.99.182.113.ssh > cpea84e3f5bc443-cma84e3f5bc440.cpe.net.fido.ca.49919: Flags [P.], seq 1124800:1124996, ack 613, win 615, length 196
17:13:33.558573 IP 167.99.182.113.ssh > cpea84e3f5bc443-cma84e3f5bc440.cpe.net.fido.ca.49919: Flags [P.], seq 1124996:1125192, ack 613, win 615, length 196
17:13:33.558641 IP 167.99.182.113.ssh > cpea84e3f5bc443-cma84e3f5bc440.cpe.net.fido.ca.49919: Flags [P.], seq 1125192:1125388, ack 613, win 615, length 196
17:13:33.558711 IP 167.99.182.113.ssh > cpea84e3f5bc443-cma84e3f5bc440.cpe.net.fido.ca.49919: Flags [P.], seq 1125388:1125584, ack 613, win 615, length 196
17:13:33.558781 IP 167.99.182.113.ssh > cpea84e3f5bc443-cma84e3f5bc440.cpe.net.fido.ca.49919: Flags [P.], seq 1125584:1125780, ack 613, win 615, length 196
17:13:33.558847 IP 167.99.182.113.ssh > cpea84e3f5bc443-cma84e3f5bc440.cpe.net.fido.ca.49919: Flags [P.], seq 1125780:1125976, ack 613, win 615, length 196
17:13:33.558921 IP 167.99.182.113.ssh > cpea84e3f5bc443-cma84e3f5bc440.cpe.net.fido.ca.49919: Flags [P.], seq 1125976:1126172, ack 613, win 615, length 196
17:13:33.558989 IP 167.99.182.113.ssh > cpea84e3f5bc443-cma84e3f5bc440.cpe.net.fido.ca.49919: Flags [P.], seq 1126172:1126368, ack 613, win 615, length 196
17:13:33.559062 IP 167.99.182.113.ssh > cpea84e3f5bc443-cma84e3f5bc440.cpe.net.fido.ca.49919: Flags [P.], seq 1126368:1126564, ack 613, win 615, length 196
17:13:33.559128 IP 167.99.182.113.ssh > cpea84e3f5bc443-cma84e3f5bc440.cpe.net.fido.ca.49919: Flags [P.], seq 1126564:1126760, ack 613, win 615, length 196
17:13:33.559213 IP 167.99.182.113.ssh > cpea84e3f5bc443-cma84e3f5bc440.cpe.net.fido.ca.49919: Flags [P.], seq 1126760:1126956, ack 613, win 615, length 196
17:13:33.559288 IP 167.99.182.113.ssh > cpea84e3f5bc443-cma84e3f5bc440.cpe.net.fido.ca.49919: Flags [P.], seq 1126956:1127152, ack 613, win 615, length 196
17:13:33.559356 IP 167.99.182.113.ssh > cpea84e3f5bc443-cma84e3f5bc440.cpe.net.fido.ca.49919: Flags [P.], seq 1127152:1127348, ack 613, win 615, length 196
17:13:33.559429 IP 167.99.182.113.ssh > cpea84e3f5bc443-cma84e3f5bc440.cpe.net.fido.ca.49919: Flags [P.], seq 1127348:1127544, ack 613, win 615, length 196
17:13:33.559497 IP 167.99.182.113.ssh > cpea84e3f5bc443-cma84e3f5bc440.cpe.net.fido.ca.49919: Flags [P.], seq 1127544:1127740, ack 613, win 615, length 196
17:13:33.559568 IP 167.99.182.113.ssh > cpea84e3f5bc443-cma84e3f5bc440.cpe.net.fido.ca.49919: Flags [P.], seq 1127740:1127936, ack 613, win 615, length 196
17:13:33.559633 IP 167.99.182.113.ssh > cpea84e3f5bc443-cma84e3f5bc440.cpe.net.fido.ca.49919: Flags [P.], seq 1127936:1128132, ack 613, win 615, length 196
17:13:33.559702 IP 167.99.182.113.ssh > cpea84e3f5bc443-cma84e3f5bc440.cpe.net.fido.ca.49919: Flags [P.], seq 1128132:1128328, ack 613, win 615, length 196
17:13:33.559768 IP 167.99.182.113.ssh > cpea84e3f5bc443-cma84e3f5bc440.cpe.net.fido.ca.49919: Flags [P.], seq 1128328:1128524, ack 613, win 615, length 196
17:13:33.559840 IP 167.99.182.113.ssh > cpea84e3f5bc443-cma84e3f5bc440.cpe.net.fido.ca.49919: Flags [P.], seq 1128524:1128720, ack 613, win 615, length 196
17:13:33.559906 IP 167.99.182.113.ssh > cpea84e3f5bc443-cma84e3f5bc440.cpe.net.fido.ca.49919: Flags [P.], seq 1128720:1128916, ack 613, win 615, length 196
17:13:33.559977 IP 167.99.182.113.ssh > cpea84e3f5bc443-cma84e3f5bc440.cpe.net.fido.ca.49919: Flags [P.], seq 1128916:1129112, ack 613, win 615, length 196
17:13:33.560048 IP 167.99.182.113.ssh > cpea84e3f5bc443-cma84e3f5bc440.cpe.net.fido.ca.49919: Flags [P.], seq 1129112:1129308, ack 613, win 615, length 196
17:13:33.560117 IP 167.99.182.113.ssh > cpea84e3f5bc443-cma84e3f5bc440.cpe.net.fido.ca.49919: Flags [P.], seq 1129308:1129504, ack 613, win 615, length 196
17:13:33.560185 IP 167.99.182.113.ssh > cpea84e3f5bc443-cma84e3f5bc440.cpe.net.fido.ca.49919: Flags [P.], seq 1129504:1129700, ack 613, win 615, length 196
17:13:33.560257 IP 167.99.182.113.ssh > cpea84e3f5bc443-cma84e3f5bc440.cpe.net.fido.ca.49919: Flags [P.], seq 1129700:1129896, ack 613, win 615, length 196
17:13:33.560325 IP 167.99.182.113.ssh > cpea84e3f5bc443-cma84e3f5bc440.cpe.net.fido.ca.49919: Flags [P.], seq 1129896:1130092, ack 613, win 615, length 196
17:13:33.560398 IP 167.99.182.113.ssh > cpea84e3f5bc443-cma84e3f5bc440.cpe.net.fido.ca.49919: Flags [P.], seq 1130092:1130288, ack 613, win 615, length 196
17:13:33.560465 IP 167.99.182.113.ssh > cpea84e3f5bc443-cma84e3f5bc440.cpe.net.fido.ca.49919: Flags [P.], seq 1130288:1130484, ack 613, win 615, length 196
17:13:33.560534 IP 167.99.182.113.ssh > cpea84e3f5bc443-cma84e3f5bc440.cpe.net.fido.ca.49919: Flags [P.], seq 1130484:1130680, ack 613, win 615, length 196
17:13:33.560603 IP 167.99.182.113.ssh > cpea84e3f5bc443-cma84e3f5bc440.cpe.net.fido.ca.49919: Flags [P.], seq 1130680:1130876, ack 613, win 615, length 196
17:13:33.560672 IP 167.99.182.113.ssh > cpea84e3f5bc443-cma84e3f5bc440.cpe.net.fido.ca.49919: Flags [P.], seq 1130876:1131072, ack 613, win 615, length 196
17:13:33.560740 IP 167.99.182.113.ssh > cpea84e3f5bc443-cma84e3f5bc440.cpe.net.fido.ca.49919: Flags [P.], seq 1131072:1131268, ack 613, win 615, length 196
17:13:33.560812 IP 167.99.182.113.ssh > cpea84e3f5bc443-cma84e3f5bc440.cpe.net.fido.ca.49919: Flags [P.], seq 1131268:1131464, ack 613, win 615, length 196
17:13:33.560879 IP 167.99.182.113.ssh > cpea84e3f5bc443-cma84e3f5bc440.cpe.net.fido.ca.49919: Flags [P.], seq 1131464:1131660, ack 613, win 615, length 196
17:13:33.560952 IP 167.99.182.113.ssh > cpea84e3f5bc443-cma84e3f5bc440.cpe.net.fido.ca.49919: Flags [P.], seq 1131660:1131856, ack 613, win 615, length 196
17:13:33.561020 IP 167.99.182.113.ssh > cpea84e3f5bc443-cma84e3f5bc440.cpe.net.fido.ca.49919: Flags [P.], seq 1131856:1132052, ack 613, win 615, length 196
17:13:33.561100 IP 167.99.182.113.ssh > cpea84e3f5bc443-cma84e3f5bc440.cpe.net.fido.ca.49919: Flags [P.], seq 1132052:1132248, ack 613, win 615, length 196
17:13:33.561168 IP 167.99.182.113.ssh > cpea84e3f5bc443-cma84e3f5bc440.cpe.net.fido.ca.49919: Flags [P.], seq 1132248:1132444, ack 613, win 615, length 196
17:13:33.561235 IP 167.99.182.113.ssh > cpea84e3f5bc443-cma84e3f5bc440.cpe.net.fido.ca.49919: Flags [P.], seq 1132444:1132640, ack 613, win 615, length 196
17:13:33.561317 IP 167.99.182.113.ssh > cpea84e3f5bc443-cma84e3f5bc440.cpe.net.fido.ca.49919: Flags [P.], seq 1132640:1132836, ack 613, win 615, length 196
17:13:33.561387 IP 167.99.182.113.ssh > cpea84e3f5bc443-cma84e3f5bc440.cpe.net.fido.ca.49919: Flags [P.], seq 1132836:1133032, ack 613, win 615, length 196
17:13:33.561455 IP 167.99.182.113.ssh > cpea84e3f5bc443-cma84e3f5bc440.cpe.net.fido.ca.49919: Flags [P.], seq 1133032:1133228, ack 613, win 615, length 196
17:13:33.561527 IP 167.99.182.113.ssh > cpea84e3f5bc443-cma84e3f5bc440.cpe.net.fido.ca.49919: Flags [P.], seq 1133228:1133424, ack 613, win 615, length 196
17:13:33.561595 IP 167.99.182.113.ssh > cpea84e3f5bc443-cma84e3f5bc440.cpe.net.fido.ca.49919: Flags [P.], seq 1133424:1133620, ack 613, win 615, length 196
17:13:33.561668 IP 167.99.182.113.ssh > cpea84e3f5bc443-cma84e3f5bc440.cpe.net.fido.ca.49919: Flags [P.], seq 1133620:1133816, ack 613, win 615, length 196
17:13:33.561737 IP 167.99.182.113.ssh > cpea84e3f5bc443-cma84e3f5bc440.cpe.net.fido.ca.49919: Flags [P.], seq 1133816:1134012, ack 613, win 615, length 196
17:13:33.561807 IP 167.99.182.113.ssh > cpea84e3f5bc443-cma84e3f5bc440.cpe.net.fido.ca.49919: Flags [P.], seq 1134012:1134208, ack 613, win 615, length 196
17:13:33.561874 IP 167.99.182.113.ssh > cpea84e3f5bc443-cma84e3f5bc440.cpe.net.fido.ca.49919: Flags [P.], seq 1134208:1134404, ack 613, win 615, length 196
17:13:33.561944 IP 167.99.182.113.ssh > cpea84e3f5bc443-cma84e3f5bc440.cpe.net.fido.ca.49919: Flags [P.], seq 1134404:1134600, ack 613, win 615, length 196
17:13:33.562026 IP 167.99.182.113.ssh > cpea84e3f5bc443-cma84e3f5bc440.cpe.net.fido.ca.49919: Flags [P.], seq 1134600:1134796, ack 613, win 615, length 196
17:13:33.562132 IP 167.99.182.113.ssh > cpea84e3f5bc443-cma84e3f5bc440.cpe.net.fido.ca.49919: Flags [P.], seq 1134796:1134992, ack 613, win 615, length 196
17:13:33.562204 IP 167.99.182.113.ssh > cpea84e3f5bc443-cma84e3f5bc440.cpe.net.fido.ca.49919: Flags [P.], seq 1134992:1135188, ack 613, win 615, length 196
17:13:33.562271 IP 167.99.182.113.ssh > cpea84e3f5bc443-cma84e3f5bc440.cpe.net.fido.ca.49919: Flags [P.], seq 1135188:1135384, ack 613, win 615, length 196
17:13:33.562343 IP 167.99.182.113.ssh > cpea84e3f5bc443-cma84e3f5bc440.cpe.net.fido.ca.49919: Flags [P.], seq 1135384:1135580, ack 613, win 615, length 196
17:13:33.562402 IP 167.99.182.113.ssh > cpea84e3f5bc443-cma84e3f5bc440.cpe.net.fido.ca.49919: Flags [P.], seq 1135580:1135776, ack 613, win 615, length 196
17:13:33.562458 IP 167.99.182.113.ssh > cpea84e3f5bc443-cma84e3f5bc440.cpe.net.fido.ca.49919: Flags [P.], seq 1135776:1135972, ack 613, win 615, length 196
17:13:33.562520 IP 167.99.182.113.ssh > cpea84e3f5bc443-cma84e3f5bc440.cpe.net.fido.ca.49919: Flags [P.], seq 1135972:1136168, ack 613, win 615, length 196
17:13:33.562573 IP 167.99.182.113.ssh > cpea84e3f5bc443-cma84e3f5bc440.cpe.net.fido.ca.49919: Flags [P.], seq 1136168:1136364, ack 613, win 615, length 196
17:13:33.562634 IP 167.99.182.113.ssh > cpea84e3f5bc443-cma84e3f5bc440.cpe.net.fido.ca.49919: Flags [P.], seq 1136364:1136560, ack 613, win 615, length 196
17:13:33.562691 IP 167.99.182.113.ssh > cpea84e3f5bc443-cma84e3f5bc440.cpe.net.fido.ca.49919: Flags [P.], seq 1136560:1136756, ack 613, win 615, length 196
17:13:33.562745 IP 167.99.182.113.ssh > cpea84e3f5bc443-cma84e3f5bc440.cpe.net.fido.ca.49919: Flags [P.], seq 1136756:1136952, ack 613, win 615, length 196
17:13:33.562803 IP 167.99.182.113.ssh > cpea84e3f5bc443-cma84e3f5bc440.cpe.net.fido.ca.49919: Flags [P.], seq 1136952:1137148, ack 613, win 615, length 196
17:13:33.562858 IP 167.99.182.113.ssh > cpea84e3f5bc443-cma84e3f5bc440.cpe.net.fido.ca.49919: Flags [P.], seq 1137148:1137344, ack 613, win 615, length 196
17:13:33.562914 IP 167.99.182.113.ssh > cpea84e3f5bc443-cma84e3f5bc440.cpe.net.fido.ca.49919: Flags [P.], seq 1137344:1137540, ack 613, win 615, length 196
17:13:33.562968 IP 167.99.182.113.ssh > cpea84e3f5bc443-cma84e3f5bc440.cpe.net.fido.ca.49919: Flags [P.], seq 1137540:1137736, ack 613, win 615, length 196
17:13:33.563024 IP 167.99.182.113.ssh > cpea84e3f5bc443-cma84e3f5bc440.cpe.net.fido.ca.49919: Flags [P.], seq 1137736:1137932, ack 613, win 615, length 196
17:13:33.563081 IP 167.99.182.113.ssh > cpea84e3f5bc443-cma84e3f5bc440.cpe.net.fido.ca.49919: Flags [P.], seq 1137932:1138128, ack 613, win 615, length 196
17:13:33.563137 IP 167.99.182.113.ssh > cpea84e3f5bc443-cma84e3f5bc440.cpe.net.fido.ca.49919: Flags [P.], seq 1138128:1138324, ack 613, win 615, length 196
17:13:33.563207 IP 167.99.182.113.ssh > cpea84e3f5bc443-cma84e3f5bc440.cpe.net.fido.ca.49919: Flags [P.], seq 1138324:1138520, ack 613, win 615, length 196
17:13:33.563285 IP 167.99.182.113.ssh > cpea84e3f5bc443-cma84e3f5bc440.cpe.net.fido.ca.49919: Flags [P.], seq 1138520:1138716, ack 613, win 615, length 196
17:13:33.563396 IP 167.99.182.113.ssh > cpea84e3f5bc443-cma84e3f5bc440.cpe.net.fido.ca.49919: Flags [P.], seq 1138716:1138912, ack 613, win 615, length 196
17:13:33.563490 IP 167.99.182.113.ssh > cpea84e3f5bc443-cma84e3f5bc440.cpe.net.fido.ca.49919: Flags [P.], seq 1138912:1139108, ack 613, win 615, length 196
17:13:33.563577 IP 167.99.182.113.ssh > cpea84e3f5bc443-cma84e3f5bc440.cpe.net.fido.ca.49919: Flags [P.], seq 1139108:1139304, ack 613, win 615, length 196
17:13:33.563665 IP 167.99.182.113.ssh > cpea84e3f5bc443-cma84e3f5bc440.cpe.net.fido.ca.49919: Flags [P.], seq 1139304:1139500, ack 613, win 615, length 196
17:13:33.563757 IP 167.99.182.113.ssh > cpea84e3f5bc443-cma84e3f5bc440.cpe.net.fido.ca.49919: Flags [P.], seq 1139500:1139696, ack 613, win 615, length 196
17:13:33.563846 IP 167.99.182.113.ssh > cpea84e3f5bc443-cma84e3f5bc440.cpe.net.fido.ca.49919: Flags [P.], seq 1139696:1139892, ack 613, win 615, length 196
17:13:33.563933 IP 167.99.182.113.ssh > cpea84e3f5bc443-cma84e3f5bc440.cpe.net.fido.ca.49919: Flags [P.], seq 1139892:1140088, ack 613, win 615, length 196
17:13:33.564028 IP 167.99.182.113.ssh > cpea84e3f5bc443-cma84e3f5bc440.cpe.net.fido.ca.49919: Flags [P.], seq 1140088:1140284, ack 613, win 615, length 196
