16:48:48.216868 IP 167.99.182.113.ssh > cpea84e3f5bc443-cma84e3f5bc440.cpe.net.fido.ca.50847: Flags [P.], seq 19276432:19276628, ack 10981, win 501, length 196
16:48:48.216921 IP 167.99.182.113.ssh > cpea84e3f5bc443-cma84e3f5bc440.cpe.net.fido.ca.50847: Flags [P.], seq 19276628:19276824, ack 10981, win 501, length 196
16:48:48.216978 IP 167.99.182.113.ssh > cpea84e3f5bc443-cma84e3f5bc440.cpe.net.fido.ca.50847: Flags [P.], seq 19276824:19277020, ack 10981, win 501, length 196
16:48:48.217035 IP 167.99.182.113.ssh > cpea84e3f5bc443-cma84e3f5bc440.cpe.net.fido.ca.50847: Flags [P.], seq 19277020:19277216, ack 10981, win 501, length 196
16:48:48.217101 IP 167.99.182.113.ssh > cpea84e3f5bc443-cma84e3f5bc440.cpe.net.fido.ca.50847: Flags [P.], seq 19277216:19277412, ack 10981, win 501, length 196
16:48:48.217168 IP 167.99.182.113.ssh > cpea84e3f5bc443-cma84e3f5bc440.cpe.net.fido.ca.50847: Flags [P.], seq 19277412:19277608, ack 10981, win 501, length 196
16:48:48.217225 IP 167.99.182.113.ssh > cpea84e3f5bc443-cma84e3f5bc440.cpe.net.fido.ca.50847: Flags [P.], seq 19277608:19277804, ack 10981, win 501, length 196
16:48:48.217283 IP 167.99.182.113.ssh > cpea84e3f5bc443-cma84e3f5bc440.cpe.net.fido.ca.50847: Flags [P.], seq 19277804:19278000, ack 10981, win 501, length 196
16:48:48.217338 IP 167.99.182.113.ssh > cpea84e3f5bc443-cma84e3f5bc440.cpe.net.fido.ca.50847: Flags [P.], seq 19278000:19278196, ack 10981, win 501, length 196
16:48:48.217393 IP 167.99.182.113.ssh > cpea84e3f5bc443-cma84e3f5bc440.cpe.net.fido.ca.50847: Flags [P.], seq 19278196:19278392, ack 10981, win 501, length 196
16:48:48.217449 IP 167.99.182.113.ssh > cpea84e3f5bc443-cma84e3f5bc440.cpe.net.fido.ca.50847: Flags [P.], seq 19278392:19278588, ack 10981, win 501, length 196
16:48:48.217509 IP 167.99.182.113.ssh > cpea84e3f5bc443-cma84e3f5bc440.cpe.net.fido.ca.50847: Flags [P.], seq 19278588:19278784, ack 10981, win 501, length 196
16:48:48.217565 IP 167.99.182.113.ssh > cpea84e3f5bc443-cma84e3f5bc440.cpe.net.fido.ca.50847: Flags [P.], seq 19278784:19278980, ack 10981, win 501, length 196
16:48:48.217619 IP 167.99.182.113.ssh > cpea84e3f5bc443-cma84e3f5bc440.cpe.net.fido.ca.50847: Flags [P.], seq 19278980:19279176, ack 10981, win 501, length 196
16:48:48.217677 IP 167.99.182.113.ssh > cpea84e3f5bc443-cma84e3f5bc440.cpe.net.fido.ca.50847: Flags [P.], seq 19279176:19279372, ack 10981, win 501, length 196
16:48:48.217731 IP 167.99.182.113.ssh > cpea84e3f5bc443-cma84e3f5bc440.cpe.net.fido.ca.50847: Flags [P.], seq 19279372:19279568, ack 10981, win 501, length 196
16:48:48.217788 IP 167.99.182.113.ssh > cpea84e3f5bc443-cma84e3f5bc440.cpe.net.fido.ca.50847: Flags [P.], seq 19279568:19279764, ack 10981, win 501, length 196
16:48:48.217842 IP 167.99.182.113.ssh > cpea84e3f5bc443-cma84e3f5bc440.cpe.net.fido.ca.50847: Flags [P.], seq 19279764:19279960, ack 10981, win 501, length 196
16:48:48.217902 IP 167.99.182.113.ssh > cpea84e3f5bc443-cma84e3f5bc440.cpe.net.fido.ca.50847: Flags [P.], seq 19279960:19280156, ack 10981, win 501, length 196
16:48:48.217962 IP 167.99.182.113.ssh > cpea84e3f5bc443-cma84e3f5bc440.cpe.net.fido.ca.50847: Flags [P.], seq 19280156:19280352, ack 10981, win 501, length 196
16:48:48.218017 IP 167.99.182.113.ssh > cpea84e3f5bc443-cma84e3f5bc440.cpe.net.fido.ca.50847: Flags [P.], seq 19280352:19280548, ack 10981, win 501, length 196
16:48:48.218072 IP 167.99.182.113.ssh > cpea84e3f5bc443-cma84e3f5bc440.cpe.net.fido.ca.50847: Flags [P.], seq 19280548:19280744, ack 10981, win 501, length 196
16:48:48.218126 IP 167.99.182.113.ssh > cpea84e3f5bc443-cma84e3f5bc440.cpe.net.fido.ca.50847: Flags [P.], seq 19280744:19280940, ack 10981, win 501, length 196
16:48:48.218183 IP 167.99.182.113.ssh > cpea84e3f5bc443-cma84e3f5bc440.cpe.net.fido.ca.50847: Flags [P.], seq 19280940:19281136, ack 10981, win 501, length 196
16:48:48.218237 IP 167.99.182.113.ssh > cpea84e3f5bc443-cma84e3f5bc440.cpe.net.fido.ca.50847: Flags [P.], seq 19281136:19281332, ack 10981, win 501, length 196
16:48:48.218295 IP 167.99.182.113.ssh > cpea84e3f5bc443-cma84e3f5bc440.cpe.net.fido.ca.50847: Flags [P.], seq 19281332:19281528, ack 10981, win 501, length 196
16:48:48.218353 IP 167.99.182.113.ssh > cpea84e3f5bc443-cma84e3f5bc440.cpe.net.fido.ca.50847: Flags [P.], seq 19281528:19281724, ack 10981, win 501, length 196
16:48:48.218410 IP 167.99.182.113.ssh > cpea84e3f5bc443-cma84e3f5bc440.cpe.net.fido.ca.50847: Flags [P.], seq 19281724:19281920, ack 10981, win 501, length 196
16:48:48.218469 IP 167.99.182.113.ssh > cpea84e3f5bc443-cma84e3f5bc440.cpe.net.fido.ca.50847: Flags [P.], seq 19281920:19282116, ack 10981, win 501, length 196
16:48:48.218524 IP 167.99.182.113.ssh > cpea84e3f5bc443-cma84e3f5bc440.cpe.net.fido.ca.50847: Flags [P.], seq 19282116:19282312, ack 10981, win 501, length 196
16:48:48.218582 IP 167.99.182.113.ssh > cpea84e3f5bc443-cma84e3f5bc440.cpe.net.fido.ca.50847: Flags [P.], seq 19282312:19282508, ack 10981, win 501, length 196
16:48:48.218637 IP 167.99.182.113.ssh > cpea84e3f5bc443-cma84e3f5bc440.cpe.net.fido.ca.50847: Flags [P.], seq 19282508:19282704, ack 10981, win 501, length 196
16:48:48.218691 IP 167.99.182.113.ssh > cpea84e3f5bc443-cma84e3f5bc440.cpe.net.fido.ca.50847: Flags [P.], seq 19282704:19282900, ack 10981, win 501, length 196
16:48:48.218751 IP 167.99.182.113.ssh > cpea84e3f5bc443-cma84e3f5bc440.cpe.net.fido.ca.50847: Flags [P.], seq 19282900:19283096, ack 10981, win 501, length 196
16:48:48.218809 IP 167.99.182.113.ssh > cpea84e3f5bc443-cma84e3f5bc440.cpe.net.fido.ca.50847: Flags [P.], seq 19283096:19283292, ack 10981, win 501, length 196
16:48:48.218867 IP 167.99.182.113.ssh > cpea84e3f5bc443-cma84e3f5bc440.cpe.net.fido.ca.50847: Flags [P.], seq 19283292:19283488, ack 10981, win 501, length 196
16:48:48.218922 IP 167.99.182.113.ssh > cpea84e3f5bc443-cma84e3f5bc440.cpe.net.fido.ca.50847: Flags [P.], seq 19283488:19283684, ack 10981, win 501, length 196
16:48:48.218979 IP 167.99.182.113.ssh > cpea84e3f5bc443-cma84e3f5bc440.cpe.net.fido.ca.50847: Flags [P.], seq 19283684:19283880, ack 10981, win 501, length 196
16:48:48.219036 IP cpea84e3f5bc443-cma84e3f5bc440.cpe.net.fido.ca.50847 > 167.99.182.113.ssh: Flags [.], ack 19184428, win 4117, length 0
16:48:48.219036 IP cpea84e3f5bc443-cma84e3f5bc440.cpe.net.fido.ca.50847 > 167.99.182.113.ssh: Flags [.], ack 19211168, win 4115, length 0
16:48:48.219165 IP 167.99.182.113.ssh > cpea84e3f5bc443-cma84e3f5bc440.cpe.net.fido.ca.50847: Flags [P.], seq 19283880:19284076, ack 10981, win 501, length 196
16:48:48.219272 IP 167.99.182.113.ssh > cpea84e3f5bc443-cma84e3f5bc440.cpe.net.fido.ca.50847: Flags [P.], seq 19284076:19284552, ack 10981, win 501, length 476
16:48:48.219358 IP 167.99.182.113.ssh > cpea84e3f5bc443-cma84e3f5bc440.cpe.net.fido.ca.50847: Flags [P.], seq 19284552:19284748, ack 10981, win 501, length 196
16:48:48.219417 IP 167.99.182.113.ssh > cpea84e3f5bc443-cma84e3f5bc440.cpe.net.fido.ca.50847: Flags [P.], seq 19284748:19284944, ack 10981, win 501, length 196
16:48:48.219474 IP 167.99.182.113.ssh > cpea84e3f5bc443-cma84e3f5bc440.cpe.net.fido.ca.50847: Flags [P.], seq 19284944:19285140, ack 10981, win 501, length 196
16:48:48.219529 IP 167.99.182.113.ssh > cpea84e3f5bc443-cma84e3f5bc440.cpe.net.fido.ca.50847: Flags [P.], seq 19285140:19285336, ack 10981, win 501, length 196
16:48:48.219584 IP 167.99.182.113.ssh > cpea84e3f5bc443-cma84e3f5bc440.cpe.net.fido.ca.50847: Flags [P.], seq 19285336:19285532, ack 10981, win 501, length 196
16:48:48.219638 IP 167.99.182.113.ssh > cpea84e3f5bc443-cma84e3f5bc440.cpe.net.fido.ca.50847: Flags [P.], seq 19285532:19285728, ack 10981, win 501, length 196
16:48:48.219692 IP 167.99.182.113.ssh > cpea84e3f5bc443-cma84e3f5bc440.cpe.net.fido.ca.50847: Flags [P.], seq 19285728:19285924, ack 10981, win 501, length 196
16:48:48.219748 IP 167.99.182.113.ssh > cpea84e3f5bc443-cma84e3f5bc440.cpe.net.fido.ca.50847: Flags [P.], seq 19285924:19286120, ack 10981, win 501, length 196
16:48:48.219803 IP 167.99.182.113.ssh > cpea84e3f5bc443-cma84e3f5bc440.cpe.net.fido.ca.50847: Flags [P.], seq 19286120:19286316, ack 10981, win 501, length 196
16:48:48.219857 IP 167.99.182.113.ssh > cpea84e3f5bc443-cma84e3f5bc440.cpe.net.fido.ca.50847: Flags [P.], seq 19286316:19286512, ack 10981, win 501, length 196
16:48:48.219911 IP 167.99.182.113.ssh > cpea84e3f5bc443-cma84e3f5bc440.cpe.net.fido.ca.50847: Flags [P.], seq 19286512:19286708, ack 10981, win 501, length 196
16:48:48.219965 IP 167.99.182.113.ssh > cpea84e3f5bc443-cma84e3f5bc440.cpe.net.fido.ca.50847: Flags [P.], seq 19286708:19286904, ack 10981, win 501, length 196
16:48:48.220019 IP 167.99.182.113.ssh > cpea84e3f5bc443-cma84e3f5bc440.cpe.net.fido.ca.50847: Flags [P.], seq 19286904:19287100, ack 10981, win 501, length 196
16:48:48.220073 IP 167.99.182.113.ssh > cpea84e3f5bc443-cma84e3f5bc440.cpe.net.fido.ca.50847: Flags [P.], seq 19287100:19287296, ack 10981, win 501, length 196
16:48:48.220127 IP 167.99.182.113.ssh > cpea84e3f5bc443-cma84e3f5bc440.cpe.net.fido.ca.50847: Flags [P.], seq 19287296:19287492, ack 10981, win 501, length 196
16:48:48.220180 IP 167.99.182.113.ssh > cpea84e3f5bc443-cma84e3f5bc440.cpe.net.fido.ca.50847: Flags [P.], seq 19287492:19287688, ack 10981, win 501, length 196
16:48:48.220236 IP 167.99.182.113.ssh > cpea84e3f5bc443-cma84e3f5bc440.cpe.net.fido.ca.50847: Flags [P.], seq 19287688:19287884, ack 10981, win 501, length 196
16:48:48.220292 IP 167.99.182.113.ssh > cpea84e3f5bc443-cma84e3f5bc440.cpe.net.fido.ca.50847: Flags [P.], seq 19287884:19288080, ack 10981, win 501, length 196
16:48:48.220348 IP 167.99.182.113.ssh > cpea84e3f5bc443-cma84e3f5bc440.cpe.net.fido.ca.50847: Flags [P.], seq 19288080:19288276, ack 10981, win 501, length 196
16:48:48.220403 IP 167.99.182.113.ssh > cpea84e3f5bc443-cma84e3f5bc440.cpe.net.fido.ca.50847: Flags [P.], seq 19288276:19288472, ack 10981, win 501, length 196
16:48:48.220457 IP 167.99.182.113.ssh > cpea84e3f5bc443-cma84e3f5bc440.cpe.net.fido.ca.50847: Flags [P.], seq 19288472:19288668, ack 10981, win 501, length 196
16:48:48.220516 IP 167.99.182.113.ssh > cpea84e3f5bc443-cma84e3f5bc440.cpe.net.fido.ca.50847: Flags [P.], seq 19288668:19288864, ack 10981, win 501, length 196
16:48:48.220570 IP 167.99.182.113.ssh > cpea84e3f5bc443-cma84e3f5bc440.cpe.net.fido.ca.50847: Flags [P.], seq 19288864:19289060, ack 10981, win 501, length 196
16:48:48.220663 IP 167.99.182.113.ssh > cpea84e3f5bc443-cma84e3f5bc440.cpe.net.fido.ca.50847: Flags [P.], seq 19289060:19289256, ack 10981, win 501, length 196
16:48:48.220732 IP 167.99.182.113.ssh > cpea84e3f5bc443-cma84e3f5bc440.cpe.net.fido.ca.50847: Flags [P.], seq 19289256:19289452, ack 10981, win 501, length 196
16:48:48.220789 IP 167.99.182.113.ssh > cpea84e3f5bc443-cma84e3f5bc440.cpe.net.fido.ca.50847: Flags [P.], seq 19289452:19289648, ack 10981, win 501, length 196
16:48:48.220845 IP 167.99.182.113.ssh > cpea84e3f5bc443-cma84e3f5bc440.cpe.net.fido.ca.50847: Flags [P.], seq 19289648:19289844, ack 10981, win 501, length 196
16:48:48.220900 IP 167.99.182.113.ssh > cpea84e3f5bc443-cma84e3f5bc440.cpe.net.fido.ca.50847: Flags [P.], seq 19289844:19290040, ack 10981, win 501, length 196
16:48:48.220955 IP 167.99.182.113.ssh > cpea84e3f5bc443-cma84e3f5bc440.cpe.net.fido.ca.50847: Flags [P.], seq 19290040:19290236, ack 10981, win 501, length 196
16:48:48.221012 IP 167.99.182.113.ssh > cpea84e3f5bc443-cma84e3f5bc440.cpe.net.fido.ca.50847: Flags [P.], seq 19290236:19290432, ack 10981, win 501, length 196
16:48:48.221076 IP 167.99.182.113.ssh > cpea84e3f5bc443-cma84e3f5bc440.cpe.net.fido.ca.50847: Flags [P.], seq 19290432:19290628, ack 10981, win 501, length 196
16:48:48.221157 IP 167.99.182.113.ssh > cpea84e3f5bc443-cma84e3f5bc440.cpe.net.fido.ca.50847: Flags [P.], seq 19290628:19290824, ack 10981, win 501, length 196
16:48:48.221215 IP 167.99.182.113.ssh > cpea84e3f5bc443-cma84e3f5bc440.cpe.net.fido.ca.50847: Flags [P.], seq 19290824:19291020, ack 10981, win 501, length 196
16:48:48.221352 IP 167.99.182.113.ssh > cpea84e3f5bc443-cma84e3f5bc440.cpe.net.fido.ca.50847: Flags [P.], seq 19291020:19291216, ack 10981, win 501, length 196
16:48:48.221417 IP 167.99.182.113.ssh > cpea84e3f5bc443-cma84e3f5bc440.cpe.net.fido.ca.50847: Flags [P.], seq 19291216:19291412, ack 10981, win 501, length 196
16:48:48.221478 IP 167.99.182.113.ssh > cpea84e3f5bc443-cma84e3f5bc440.cpe.net.fido.ca.50847: Flags [P.], seq 19291412:19291608, ack 10981, win 501, length 196
16:48:48.221534 IP 167.99.182.113.ssh > cpea84e3f5bc443-cma84e3f5bc440.cpe.net.fido.ca.50847: Flags [P.], seq 19291608:19291804, ack 10981, win 501, length 196
16:48:48.221592 IP 167.99.182.113.ssh > cpea84e3f5bc443-cma84e3f5bc440.cpe.net.fido.ca.50847: Flags [P.], seq 19291804:19292000, ack 10981, win 501, length 196
16:48:48.221647 IP 167.99.182.113.ssh > cpea84e3f5bc443-cma84e3f5bc440.cpe.net.fido.ca.50847: Flags [P.], seq 19292000:19292196, ack 10981, win 501, length 196
16:48:48.221704 IP 167.99.182.113.ssh > cpea84e3f5bc443-cma84e3f5bc440.cpe.net.fido.ca.50847: Flags [P.], seq 19292196:19292392, ack 10981, win 501, length 196
16:48:48.221759 IP 167.99.182.113.ssh > cpea84e3f5bc443-cma84e3f5bc440.cpe.net.fido.ca.50847: Flags [P.], seq 19292392:19292588, ack 10981, win 501, length 196
16:48:48.221817 IP 167.99.182.113.ssh > cpea84e3f5bc443-cma84e3f5bc440.cpe.net.fido.ca.50847: Flags [P.], seq 19292588:19292784, ack 10981, win 501, length 196
16:48:48.221871 IP 167.99.182.113.ssh > cpea84e3f5bc443-cma84e3f5bc440.cpe.net.fido.ca.50847: Flags [P.], seq 19292784:19292980, ack 10981, win 501, length 196
16:48:48.221925 IP 167.99.182.113.ssh > cpea84e3f5bc443-cma84e3f5bc440.cpe.net.fido.ca.50847: Flags [P.], seq 19292980:19293176, ack 10981, win 501, length 196
16:48:48.221981 IP 167.99.182.113.ssh > cpea84e3f5bc443-cma84e3f5bc440.cpe.net.fido.ca.50847: Flags [P.], seq 19293176:19293372, ack 10981, win 501, length 196
16:48:48.222036 IP 167.99.182.113.ssh > cpea84e3f5bc443-cma84e3f5bc440.cpe.net.fido.ca.50847: Flags [P.], seq 19293372:19293568, ack 10981, win 501, length 196
16:48:48.222093 IP 167.99.182.113.ssh > cpea84e3f5bc443-cma84e3f5bc440.cpe.net.fido.ca.50847: Flags [P.], seq 19293568:19293764, ack 10981, win 501, length 196
16:48:48.222149 IP 167.99.182.113.ssh > cpea84e3f5bc443-cma84e3f5bc440.cpe.net.fido.ca.50847: Flags [P.], seq 19293764:19293960, ack 10981, win 501, length 196
16:48:48.222202 IP 167.99.182.113.ssh > cpea84e3f5bc443-cma84e3f5bc440.cpe.net.fido.ca.50847: Flags [P.], seq 19293960:19294156, ack 10981, win 501, length 196
16:48:48.222259 IP 167.99.182.113.ssh > cpea84e3f5bc443-cma84e3f5bc440.cpe.net.fido.ca.50847: Flags [P.], seq 19294156:19294352, ack 10981, win 501, length 196
16:48:48.222312 IP 167.99.182.113.ssh > cpea84e3f5bc443-cma84e3f5bc440.cpe.net.fido.ca.50847: Flags [P.], seq 19294352:19294548, ack 10981, win 501, length 196
16:48:48.222370 IP 167.99.182.113.ssh > cpea84e3f5bc443-cma84e3f5bc440.cpe.net.fido.ca.50847: Flags [P.], seq 19294548:19294744, ack 10981, win 501, length 196
16:48:48.222425 IP 167.99.182.113.ssh > cpea84e3f5bc443-cma84e3f5bc440.cpe.net.fido.ca.50847: Flags [P.], seq 19294744:19294940, ack 10981, win 501, length 196
16:48:48.222479 IP 167.99.182.113.ssh > cpea84e3f5bc443-cma84e3f5bc440.cpe.net.fido.ca.50847: Flags [P.], seq 19294940:19295136, ack 10981, win 501, length 196
16:48:48.222536 IP 167.99.182.113.ssh > cpea84e3f5bc443-cma84e3f5bc440.cpe.net.fido.ca.50847: Flags [P.], seq 19295136:19295332, ack 10981, win 501, length 196
16:48:48.222590 IP 167.99.182.113.ssh > cpea84e3f5bc443-cma84e3f5bc440.cpe.net.fido.ca.50847: Flags [P.], seq 19295332:19295528, ack 10981, win 501, length 196
16:48:48.222646 IP 167.99.182.113.ssh > cpea84e3f5bc443-cma84e3f5bc440.cpe.net.fido.ca.50847: Flags [P.], seq 19295528:19295724, ack 10981, win 501, length 196
16:48:48.222702 IP 167.99.182.113.ssh > cpea84e3f5bc443-cma84e3f5bc440.cpe.net.fido.ca.50847: Flags [P.], seq 19295724:19295920, ack 10981, win 501, length 196
16:48:48.222757 IP 167.99.182.113.ssh > cpea84e3f5bc443-cma84e3f5bc440.cpe.net.fido.ca.50847: Flags [P.], seq 19295920:19296116, ack 10981, win 501, length 196
16:48:48.222821 IP 167.99.182.113.ssh > cpea84e3f5bc443-cma84e3f5bc440.cpe.net.fido.ca.50847: Flags [P.], seq 19296116:19296312, ack 10981, win 501, length 196
16:48:48.222877 IP 167.99.182.113.ssh > cpea84e3f5bc443-cma84e3f5bc440.cpe.net.fido.ca.50847: Flags [P.], seq 19296312:19296508, ack 10981, win 501, length 196
16:48:48.222932 IP 167.99.182.113.ssh > cpea84e3f5bc443-cma84e3f5bc440.cpe.net.fido.ca.50847: Flags [P.], seq 19296508:19296704, ack 10981, win 501, length 196
16:48:48.222992 IP 167.99.182.113.ssh > cpea84e3f5bc443-cma84e3f5bc440.cpe.net.fido.ca.50847: Flags [P.], seq 19296704:19296900, ack 10981, win 501, length 196
16:48:48.223050 IP 167.99.182.113.ssh > cpea84e3f5bc443-cma84e3f5bc440.cpe.net.fido.ca.50847: Flags [P.], seq 19296900:19297096, ack 10981, win 501, length 196
16:48:48.223108 IP 167.99.182.113.ssh > cpea84e3f5bc443-cma84e3f5bc440.cpe.net.fido.ca.50847: Flags [P.], seq 19297096:19297292, ack 10981, win 501, length 196
16:48:48.223162 IP 167.99.182.113.ssh > cpea84e3f5bc443-cma84e3f5bc440.cpe.net.fido.ca.50847: Flags [P.], seq 19297292:19297488, ack 10981, win 501, length 196
16:48:48.223234 IP 167.99.182.113.ssh > cpea84e3f5bc443-cma84e3f5bc440.cpe.net.fido.ca.50847: Flags [P.], seq 19297488:19297684, ack 10981, win 501, length 196
16:48:48.223317 IP 167.99.182.113.ssh > cpea84e3f5bc443-cma84e3f5bc440.cpe.net.fido.ca.50847: Flags [P.], seq 19297684:19297880, ack 10981, win 501, length 196
16:48:48.223377 IP 167.99.182.113.ssh > cpea84e3f5bc443-cma84e3f5bc440.cpe.net.fido.ca.50847: Flags [P.], seq 19297880:19298076, ack 10981, win 501, length 196
16:48:48.223436 IP 167.99.182.113.ssh > cpea84e3f5bc443-cma84e3f5bc440.cpe.net.fido.ca.50847: Flags [P.], seq 19298076:19298272, ack 10981, win 501, length 196
16:48:48.223492 IP 167.99.182.113.ssh > cpea84e3f5bc443-cma84e3f5bc440.cpe.net.fido.ca.50847: Flags [P.], seq 19298272:19298468, ack 10981, win 501, length 196
16:48:48.223549 IP 167.99.182.113.ssh > cpea84e3f5bc443-cma84e3f5bc440.cpe.net.fido.ca.50847: Flags [P.], seq 19298468:19298664, ack 10981, win 501, length 196
16:48:48.223605 IP 167.99.182.113.ssh > cpea84e3f5bc443-cma84e3f5bc440.cpe.net.fido.ca.50847: Flags [P.], seq 19298664:19298860, ack 10981, win 501, length 196
16:48:48.223662 IP 167.99.182.113.ssh > cpea84e3f5bc443-cma84e3f5bc440.cpe.net.fido.ca.50847: Flags [P.], seq 19298860:19299056, ack 10981, win 501, length 196
16:48:48.223722 IP 167.99.182.113.ssh > cpea84e3f5bc443-cma84e3f5bc440.cpe.net.fido.ca.50847: Flags [P.], seq 19299056:19299252, ack 10981, win 501, length 196
16:48:48.223777 IP 167.99.182.113.ssh > cpea84e3f5bc443-cma84e3f5bc440.cpe.net.fido.ca.50847: Flags [P.], seq 19299252:19299448, ack 10981, win 501, length 196
16:48:48.223832 IP 167.99.182.113.ssh > cpea84e3f5bc443-cma84e3f5bc440.cpe.net.fido.ca.50847: Flags [P.], seq 19299448:19299644, ack 10981, win 501, length 196
16:48:48.223890 IP 167.99.182.113.ssh > cpea84e3f5bc443-cma84e3f5bc440.cpe.net.fido.ca.50847: Flags [P.], seq 19299644:19299840, ack 10981, win 501, length 196
16:48:48.223944 IP 167.99.182.113.ssh > cpea84e3f5bc443-cma84e3f5bc440.cpe.net.fido.ca.50847: Flags [P.], seq 19299840:19300036, ack 10981, win 501, length 196
16:48:48.224012 IP 167.99.182.113.ssh > cpea84e3f5bc443-cma84e3f5bc440.cpe.net.fido.ca.50847: Flags [P.], seq 19300036:19300232, ack 10981, win 501, length 196
16:48:48.224069 IP 167.99.182.113.ssh > cpea84e3f5bc443-cma84e3f5bc440.cpe.net.fido.ca.50847: Flags [P.], seq 19300232:19300428, ack 10981, win 501, length 196
16:48:48.224123 IP 167.99.182.113.ssh > cpea84e3f5bc443-cma84e3f5bc440.cpe.net.fido.ca.50847: Flags [P.], seq 19300428:19300624, ack 10981, win 501, length 196
16:48:48.224177 IP 167.99.182.113.ssh > cpea84e3f5bc443-cma84e3f5bc440.cpe.net.fido.ca.50847: Flags [P.], seq 19300624:19300820, ack 10981, win 501, length 196
16:48:48.224271 IP 167.99.182.113.ssh > cpea84e3f5bc443-cma84e3f5bc440.cpe.net.fido.ca.50847: Flags [P.], seq 19300820:19301016, ack 10981, win 501, length 196
16:48:48.224341 IP 167.99.182.113.ssh > cpea84e3f5bc443-cma84e3f5bc440.cpe.net.fido.ca.50847: Flags [P.], seq 19301016:19301212, ack 10981, win 501, length 196
16:48:48.224399 IP 167.99.182.113.ssh > cpea84e3f5bc443-cma84e3f5bc440.cpe.net.fido.ca.50847: Flags [P.], seq 19301212:19301408, ack 10981, win 501, length 196
16:48:48.224456 IP 167.99.182.113.ssh > cpea84e3f5bc443-cma84e3f5bc440.cpe.net.fido.ca.50847: Flags [P.], seq 19301408:19301604, ack 10981, win 501, length 196
16:48:48.224512 IP 167.99.182.113.ssh > cpea84e3f5bc443-cma84e3f5bc440.cpe.net.fido.ca.50847: Flags [P.], seq 19301604:19301800, ack 10981, win 501, length 196
16:48:48.224570 IP 167.99.182.113.ssh > cpea84e3f5bc443-cma84e3f5bc440.cpe.net.fido.ca.50847: Flags [P.], seq 19301800:19301996, ack 10981, win 501, length 196
16:48:48.224625 IP 167.99.182.113.ssh > cpea84e3f5bc443-cma84e3f5bc440.cpe.net.fido.ca.50847: Flags [P.], seq 19301996:19302192, ack 10981, win 501, length 196
16:48:48.224682 IP 167.99.182.113.ssh > cpea84e3f5bc443-cma84e3f5bc440.cpe.net.fido.ca.50847: Flags [P.], seq 19302192:19302388, ack 10981, win 501, length 196
16:48:48.224739 IP 167.99.182.113.ssh > cpea84e3f5bc443-cma84e3f5bc440.cpe.net.fido.ca.50847: Flags [P.], seq 19302388:19302584, ack 10981, win 501, length 196
16:48:48.224793 IP 167.99.182.113.ssh > cpea84e3f5bc443-cma84e3f5bc440.cpe.net.fido.ca.50847: Flags [P.], seq 19302584:19302780, ack 10981, win 501, length 196
16:48:48.224852 IP 167.99.182.113.ssh > cpea84e3f5bc443-cma84e3f5bc440.cpe.net.fido.ca.50847: Flags [P.], seq 19302780:19302976, ack 10981, win 501, length 196
16:48:48.224907 IP 167.99.182.113.ssh > cpea84e3f5bc443-cma84e3f5bc440.cpe.net.fido.ca.50847: Flags [P.], seq 19302976:19303172, ack 10981, win 501, length 196
16:48:48.224966 IP 167.99.182.113.ssh > cpea84e3f5bc443-cma84e3f5bc440.cpe.net.fido.ca.50847: Flags [P.], seq 19303172:19303368, ack 10981, win 501, length 196
16:48:48.225025 IP 167.99.182.113.ssh > cpea84e3f5bc443-cma84e3f5bc440.cpe.net.fido.ca.50847: Flags [P.], seq 19303368:19303564, ack 10981, win 501, length 196