17:12:47.996882 IP 167.99.182.113.22 > 72.141.83.5.49919: Flags [P.], seq 2122428:2122584, ack 1081, win 592, length 156
17:12:47.996943 IP 167.99.182.113.22 > 72.141.83.5.49919: Flags [P.], seq 2122584:2122740, ack 1081, win 592, length 156
17:12:47.997001 IP 167.99.182.113.22 > 72.141.83.5.49919: Flags [P.], seq 2122740:2122896, ack 1081, win 592, length 156
17:12:47.997057 IP 167.99.182.113.22 > 72.141.83.5.49919: Flags [P.], seq 2122896:2123052, ack 1081, win 592, length 156
17:12:47.997114 IP 167.99.182.113.22 > 72.141.83.5.49919: Flags [P.], seq 2123052:2123208, ack 1081, win 592, length 156
17:12:47.997178 IP 167.99.182.113.22 > 72.141.83.5.49919: Flags [P.], seq 2123208:2123364, ack 1081, win 592, length 156
17:12:47.997250 IP 167.99.182.113.22 > 72.141.83.5.49919: Flags [P.], seq 2123364:2123520, ack 1081, win 592, length 156
17:12:47.997340 IP 167.99.182.113.22 > 72.141.83.5.49919: Flags [P.], seq 2123520:2123676, ack 1081, win 592, length 156
17:12:47.997399 IP 167.99.182.113.22 > 72.141.83.5.49919: Flags [P.], seq 2123676:2123832, ack 1081, win 592, length 156
17:12:47.997457 IP 167.99.182.113.22 > 72.141.83.5.49919: Flags [P.], seq 2123832:2123988, ack 1081, win 592, length 156
17:12:47.997523 IP 167.99.182.113.22 > 72.141.83.5.49919: Flags [P.], seq 2123988:2124144, ack 1081, win 592, length 156
17:12:47.997581 IP 167.99.182.113.22 > 72.141.83.5.49919: Flags [P.], seq 2124144:2124300, ack 1081, win 592, length 156
17:12:47.997639 IP 167.99.182.113.22 > 72.141.83.5.49919: Flags [P.], seq 2124300:2124456, ack 1081, win 592, length 156
17:12:47.997704 IP 167.99.182.113.22 > 72.141.83.5.49919: Flags [P.], seq 2124456:2124612, ack 1081, win 592, length 156
17:12:47.997760 IP 167.99.182.113.22 > 72.141.83.5.49919: Flags [P.], seq 2124612:2124768, ack 1081, win 592, length 156
17:12:47.997820 IP 167.99.182.113.22 > 72.141.83.5.49919: Flags [P.], seq 2124768:2124924, ack 1081, win 592, length 156
17:12:47.997878 IP 167.99.182.113.22 > 72.141.83.5.49919: Flags [P.], seq 2124924:2125080, ack 1081, win 592, length 156
17:12:47.997932 IP 167.99.182.113.22 > 72.141.83.5.49919: Flags [P.], seq 2125080:2125236, ack 1081, win 592, length 156
17:12:47.998007 IP 167.99.182.113.22 > 72.141.83.5.49919: Flags [P.], seq 2125236:2125392, ack 1081, win 592, length 156
17:12:47.998067 IP 167.99.182.113.22 > 72.141.83.5.49919: Flags [P.], seq 2125392:2125548, ack 1081, win 592, length 156
17:12:47.998125 IP 167.99.182.113.22 > 72.141.83.5.49919: Flags [P.], seq 2125548:2125704, ack 1081, win 592, length 156
17:12:47.998242 IP 167.99.182.113.22 > 72.141.83.5.49919: Flags [P.], seq 2125704:2125860, ack 1081, win 592, length 156
17:12:47.998309 IP 167.99.182.113.22 > 72.141.83.5.49919: Flags [P.], seq 2125860:2126016, ack 1081, win 592, length 156
17:12:47.998388 IP 167.99.182.113.22 > 72.141.83.5.49919: Flags [P.], seq 2126016:2126172, ack 1081, win 592, length 156
17:12:47.998448 IP 167.99.182.113.22 > 72.141.83.5.49919: Flags [P.], seq 2126172:2126328, ack 1081, win 592, length 156
17:12:47.998513 IP 167.99.182.113.22 > 72.141.83.5.49919: Flags [P.], seq 2126328:2126484, ack 1081, win 592, length 156
17:12:47.998620 IP 167.99.182.113.22 > 72.141.83.5.49919: Flags [P.], seq 2126484:2126640, ack 1081, win 592, length 156
17:12:47.998686 IP 167.99.182.113.22 > 72.141.83.5.49919: Flags [P.], seq 2126640:2126796, ack 1081, win 592, length 156
17:12:47.998745 IP 167.99.182.113.22 > 72.141.83.5.49919: Flags [P.], seq 2126796:2126952, ack 1081, win 592, length 156
17:12:47.998803 IP 167.99.182.113.22 > 72.141.83.5.49919: Flags [P.], seq 2126952:2127108, ack 1081, win 592, length 156
17:12:47.998859 IP 167.99.182.113.22 > 72.141.83.5.49919: Flags [P.], seq 2127108:2127264, ack 1081, win 592, length 156
17:12:47.998917 IP 167.99.182.113.22 > 72.141.83.5.49919: Flags [P.], seq 2127264:2127420, ack 1081, win 592, length 156
17:12:47.998978 IP 167.99.182.113.22 > 72.141.83.5.49919: Flags [P.], seq 2127420:2127576, ack 1081, win 592, length 156
17:12:47.999036 IP 167.99.182.113.22 > 72.141.83.5.49919: Flags [P.], seq 2127576:2127732, ack 1081, win 592, length 156
17:12:47.999095 IP 167.99.182.113.22 > 72.141.83.5.49919: Flags [P.], seq 2127732:2127888, ack 1081, win 592, length 156
17:12:47.999151 IP 167.99.182.113.22 > 72.141.83.5.49919: Flags [P.], seq 2127888:2128044, ack 1081, win 592, length 156
17:12:47.999222 IP 167.99.182.113.22 > 72.141.83.5.49919: Flags [P.], seq 2128044:2128200, ack 1081, win 592, length 156
17:12:47.999283 IP 167.99.182.113.22 > 72.141.83.5.49919: Flags [P.], seq 2128200:2128356, ack 1081, win 592, length 156
17:12:47.999341 IP 167.99.182.113.22 > 72.141.83.5.49919: Flags [P.], seq 2128356:2128512, ack 1081, win 592, length 156
17:12:47.999398 IP 167.99.182.113.22 > 72.141.83.5.49919: Flags [P.], seq 2128512:2128668, ack 1081, win 592, length 156
17:12:47.999454 IP 167.99.182.113.22 > 72.141.83.5.49919: Flags [P.], seq 2128668:2128824, ack 1081, win 592, length 156
17:12:47.999509 IP 167.99.182.113.22 > 72.141.83.5.49919: Flags [P.], seq 2128824:2128980, ack 1081, win 592, length 156
17:12:47.999569 IP 167.99.182.113.22 > 72.141.83.5.49919: Flags [P.], seq 2128980:2129136, ack 1081, win 592, length 156
17:12:47.999625 IP 167.99.182.113.22 > 72.141.83.5.49919: Flags [P.], seq 2129136:2129292, ack 1081, win 592, length 156
17:12:47.999688 IP 167.99.182.113.22 > 72.141.83.5.49919: Flags [P.], seq 2129292:2129448, ack 1081, win 592, length 156
17:12:47.999756 IP 167.99.182.113.22 > 72.141.83.5.49919: Flags [P.], seq 2129448:2129604, ack 1081, win 592, length 156
17:12:47.999812 IP 167.99.182.113.22 > 72.141.83.5.49919: Flags [P.], seq 2129604:2129760, ack 1081, win 592, length 156
17:12:47.999877 IP 167.99.182.113.22 > 72.141.83.5.49919: Flags [P.], seq 2129760:2129916, ack 1081, win 592, length 156
17:12:47.999934 IP 167.99.182.113.22 > 72.141.83.5.49919: Flags [P.], seq 2129916:2130072, ack 1081, win 592, length 156
17:12:47.999994 IP 167.99.182.113.22 > 72.141.83.5.49919: Flags [P.], seq 2130072:2130228, ack 1081, win 592, length 156
17:12:48.000068 IP 167.99.182.113.22 > 72.141.83.5.49919: Flags [P.], seq 2130228:2130384, ack 1081, win 592, length 156
17:12:48.000140 IP 167.99.182.113.22 > 72.141.83.5.49919: Flags [P.], seq 2130384:2130540, ack 1081, win 592, length 156
17:12:48.000201 IP 167.99.182.113.22 > 72.141.83.5.49919: Flags [P.], seq 2130540:2130696, ack 1081, win 592, length 156
17:12:48.000264 IP 167.99.182.113.22 > 72.141.83.5.49919: Flags [P.], seq 2130696:2130852, ack 1081, win 592, length 156
17:12:48.000320 IP 167.99.182.113.22 > 72.141.83.5.49919: Flags [P.], seq 2130852:2131008, ack 1081, win 592, length 156
17:12:48.000437 IP 167.99.182.113.22 > 72.141.83.5.49919: Flags [P.], seq 2131008:2131164, ack 1081, win 592, length 156
17:12:48.000507 IP 167.99.182.113.22 > 72.141.83.5.49919: Flags [P.], seq 2131164:2131320, ack 1081, win 592, length 156
17:12:48.000565 IP 167.99.182.113.22 > 72.141.83.5.49919: Flags [P.], seq 2131320:2131476, ack 1081, win 592, length 156
17:12:48.000632 IP 167.99.182.113.22 > 72.141.83.5.49919: Flags [P.], seq 2131476:2131632, ack 1081, win 592, length 156
17:12:48.000696 IP 167.99.182.113.22 > 72.141.83.5.49919: Flags [P.], seq 2131632:2131788, ack 1081, win 592, length 156
17:12:48.000757 IP 167.99.182.113.22 > 72.141.83.5.49919: Flags [P.], seq 2131788:2131944, ack 1081, win 592, length 156
17:12:48.000823 IP 167.99.182.113.22 > 72.141.83.5.49919: Flags [P.], seq 2131944:2132100, ack 1081, win 592, length 156
17:12:48.000894 IP 167.99.182.113.22 > 72.141.83.5.49919: Flags [P.], seq 2132100:2132256, ack 1081, win 592, length 156
17:12:48.000958 IP 167.99.182.113.22 > 72.141.83.5.49919: Flags [P.], seq 2132256:2132412, ack 1081, win 592, length 156
17:12:48.001021 IP 167.99.182.113.22 > 72.141.83.5.49919: Flags [P.], seq 2132412:2132568, ack 1081, win 592, length 156
17:12:48.001077 IP 167.99.182.113.22 > 72.141.83.5.49919: Flags [P.], seq 2132568:2132724, ack 1081, win 592, length 156
17:12:48.001137 IP 167.99.182.113.22 > 72.141.83.5.49919: Flags [P.], seq 2132724:2132880, ack 1081, win 592, length 156
17:12:48.001205 IP 167.99.182.113.22 > 72.141.83.5.49919: Flags [P.], seq 2132880:2133036, ack 1081, win 592, length 156
17:12:48.001265 IP 167.99.182.113.22 > 72.141.83.5.49919: Flags [P.], seq 2133036:2133192, ack 1081, win 592, length 156
17:12:48.001348 IP 167.99.182.113.22 > 72.141.83.5.49919: Flags [P.], seq 2133192:2133348, ack 1081, win 592, length 156
17:12:48.001417 IP 167.99.182.113.22 > 72.141.83.5.49919: Flags [P.], seq 2133348:2133504, ack 1081, win 592, length 156
17:12:48.001484 IP 167.99.182.113.22 > 72.141.83.5.49919: Flags [P.], seq 2133504:2133660, ack 1081, win 592, length 156
17:12:48.001544 IP 167.99.182.113.22 > 72.141.83.5.49919: Flags [P.], seq 2133660:2133816, ack 1081, win 592, length 156
17:12:48.001610 IP 167.99.182.113.22 > 72.141.83.5.49919: Flags [P.], seq 2133816:2133972, ack 1081, win 592, length 156
17:12:48.001672 IP 167.99.182.113.22 > 72.141.83.5.49919: Flags [P.], seq 2133972:2134128, ack 1081, win 592, length 156
17:12:48.001733 IP 167.99.182.113.22 > 72.141.83.5.49919: Flags [P.], seq 2134128:2134284, ack 1081, win 592, length 156
17:12:48.001790 IP 167.99.182.113.22 > 72.141.83.5.49919: Flags [P.], seq 2134284:2134440, ack 1081, win 592, length 156
17:12:48.001846 IP 167.99.182.113.22 > 72.141.83.5.49919: Flags [P.], seq 2134440:2134596, ack 1081, win 592, length 156
17:12:48.001912 IP 167.99.182.113.22 > 72.141.83.5.49919: Flags [P.], seq 2134596:2134752, ack 1081, win 592, length 156
17:12:48.001971 IP 167.99.182.113.22 > 72.141.83.5.49919: Flags [P.], seq 2134752:2134908, ack 1081, win 592, length 156
17:12:48.002036 IP 167.99.182.113.22 > 72.141.83.5.49919: Flags [P.], seq 2134908:2135064, ack 1081, win 592, length 156
17:12:48.002102 IP 167.99.182.113.22 > 72.141.83.5.49919: Flags [P.], seq 2135064:2135220, ack 1081, win 592, length 156
17:12:48.002162 IP 167.99.182.113.22 > 72.141.83.5.49919: Flags [P.], seq 2135220:2135376, ack 1081, win 592, length 156
17:12:48.002219 IP 167.99.182.113.22 > 72.141.83.5.49919: Flags [P.], seq 2135376:2135532, ack 1081, win 592, length 156
17:12:48.002278 IP 167.99.182.113.22 > 72.141.83.5.49919: Flags [P.], seq 2135532:2135688, ack 1081, win 592, length 156
17:12:48.002335 IP 167.99.182.113.22 > 72.141.83.5.49919: Flags [P.], seq 2135688:2135844, ack 1081, win 592, length 156
17:12:48.002409 IP 167.99.182.113.22 > 72.141.83.5.49919: Flags [P.], seq 2135844:2136000, ack 1081, win 592, length 156
17:12:48.002473 IP 167.99.182.113.22 > 72.141.83.5.49919: Flags [P.], seq 2136000:2136156, ack 1081, win 592, length 156
17:12:48.002533 IP 167.99.182.113.22 > 72.141.83.5.49919: Flags [P.], seq 2136156:2136312, ack 1081, win 592, length 156
17:12:48.002595 IP 167.99.182.113.22 > 72.141.83.5.49919: Flags [P.], seq 2136312:2136468, ack 1081, win 592, length 156
17:12:48.002653 IP 167.99.182.113.22 > 72.141.83.5.49919: Flags [P.], seq 2136468:2136624, ack 1081, win 592, length 156
17:12:48.002713 IP 167.99.182.113.22 > 72.141.83.5.49919: Flags [P.], seq 2136624:2136780, ack 1081, win 592, length 156
17:12:48.002775 IP 167.99.182.113.22 > 72.141.83.5.49919: Flags [P.], seq 2136780:2136936, ack 1081, win 592, length 156
17:12:48.002844 IP 167.99.182.113.22 > 72.141.83.5.49919: Flags [P.], seq 2136936:2137092, ack 1081, win 592, length 156
17:12:48.002908 IP 167.99.182.113.22 > 72.141.83.5.49919: Flags [P.], seq 2137092:2137248, ack 1081, win 592, length 156
17:12:48.002967 IP 167.99.182.113.22 > 72.141.83.5.49919: Flags [P.], seq 2137248:2137404, ack 1081, win 592, length 156
17:12:48.003024 IP 167.99.182.113.22 > 72.141.83.5.49919: Flags [P.], seq 2137404:2137560, ack 1081, win 592, length 156
17:12:48.003083 IP 167.99.182.113.22 > 72.141.83.5.49919: Flags [P.], seq 2137560:2137716, ack 1081, win 592, length 156
17:12:48.003144 IP 167.99.182.113.22 > 72.141.83.5.49919: Flags [P.], seq 2137716:2137872, ack 1081, win 592, length 156
17:12:48.003217 IP 167.99.182.113.22 > 72.141.83.5.49919: Flags [P.], seq 2137872:2138028, ack 1081, win 592, length 156
17:12:48.003274 IP 167.99.182.113.22 > 72.141.83.5.49919: Flags [P.], seq 2138028:2138184, ack 1081, win 592, length 156
17:12:48.003342 IP 167.99.182.113.22 > 72.141.83.5.49919: Flags [P.], seq 2138184:2138340, ack 1081, win 592, length 156
17:12:48.003403 IP 167.99.182.113.22 > 72.141.83.5.49919: Flags [P.], seq 2138340:2138496, ack 1081, win 592, length 156
17:12:48.003459 IP 167.99.182.113.22 > 72.141.83.5.49919: Flags [P.], seq 2138496:2138652, ack 1081, win 592, length 156
17:12:48.003516 IP 167.99.182.113.22 > 72.141.83.5.49919: Flags [P.], seq 2138652:2138808, ack 1081, win 592, length 156
17:12:48.003589 IP 167.99.182.113.22 > 72.141.83.5.49919: Flags [P.], seq 2138808:2138964, ack 1081, win 592, length 156
17:12:48.003650 IP 167.99.182.113.22 > 72.141.83.5.49919: Flags [P.], seq 2138964:2139120, ack 1081, win 592, length 156
17:12:48.003706 IP 167.99.182.113.22 > 72.141.83.5.49919: Flags [P.], seq 2139120:2139276, ack 1081, win 592, length 156
17:12:48.003762 IP 167.99.182.113.22 > 72.141.83.5.49919: Flags [P.], seq 2139276:2139432, ack 1081, win 592, length 156
17:12:48.003822 IP 167.99.182.113.22 > 72.141.83.5.49919: Flags [P.], seq 2139432:2139588, ack 1081, win 592, length 156
17:12:48.003882 IP 167.99.182.113.22 > 72.141.83.5.49919: Flags [P.], seq 2139588:2139744, ack 1081, win 592, length 156
17:12:48.003938 IP 167.99.182.113.22 > 72.141.83.5.49919: Flags [P.], seq 2139744:2139900, ack 1081, win 592, length 156
17:12:48.003996 IP 167.99.182.113.22 > 72.141.83.5.49919: Flags [P.], seq 2139900:2140056, ack 1081, win 592, length 156
17:12:48.004055 IP 167.99.182.113.22 > 72.141.83.5.49919: Flags [P.], seq 2140056:2140212, ack 1081, win 592, length 156
17:12:48.004115 IP 167.99.182.113.22 > 72.141.83.5.49919: Flags [P.], seq 2140212:2140368, ack 1081, win 592, length 156
17:12:48.004180 IP 167.99.182.113.22 > 72.141.83.5.49919: Flags [P.], seq 2140368:2140524, ack 1081, win 592, length 156
17:12:48.004241 IP 167.99.182.113.22 > 72.141.83.5.49919: Flags [P.], seq 2140524:2140680, ack 1081, win 592, length 156
17:12:48.004299 IP 167.99.182.113.22 > 72.141.83.5.49919: Flags [P.], seq 2140680:2140836, ack 1081, win 592, length 156
17:12:48.004361 IP 167.99.182.113.22 > 72.141.83.5.49919: Flags [P.], seq 2140836:2140992, ack 1081, win 592, length 156
17:12:48.004457 IP 167.99.182.113.22 > 72.141.83.5.49919: Flags [P.], seq 2140992:2141148, ack 1081, win 592, length 156
17:12:48.004541 IP 167.99.182.113.22 > 72.141.83.5.49919: Flags [P.], seq 2141148:2141304, ack 1081, win 592, length 156
17:12:48.004608 IP 167.99.182.113.22 > 72.141.83.5.49919: Flags [P.], seq 2141304:2141460, ack 1081, win 592, length 156
17:12:48.004676 IP 167.99.182.113.22 > 72.141.83.5.49919: Flags [P.], seq 2141460:2141616, ack 1081, win 592, length 156
17:12:48.004731 IP 167.99.182.113.22 > 72.141.83.5.49919: Flags [P.], seq 2141616:2141772, ack 1081, win 592, length 156
17:12:48.004793 IP 167.99.182.113.22 > 72.141.83.5.49919: Flags [P.], seq 2141772:2141928, ack 1081, win 592, length 156
17:12:48.004859 IP 167.99.182.113.22 > 72.141.83.5.49919: Flags [P.], seq 2141928:2142084, ack 1081, win 592, length 156
17:12:48.004921 IP 167.99.182.113.22 > 72.141.83.5.49919: Flags [P.], seq 2142084:2142240, ack 1081, win 592, length 156
17:12:48.004985 IP 167.99.182.113.22 > 72.141.83.5.49919: Flags [P.], seq 2142240:2142396, ack 1081, win 592, length 156
17:12:48.005052 IP 167.99.182.113.22 > 72.141.83.5.49919: Flags [P.], seq 2142396:2142552, ack 1081, win 592, length 156
17:12:48.005111 IP 167.99.182.113.22 > 72.141.83.5.49919: Flags [P.], seq 2142552:2142708, ack 1081, win 592, length 156
17:12:48.005167 IP 167.99.182.113.22 > 72.141.83.5.49919: Flags [P.], seq 2142708:2142864, ack 1081, win 592, length 156
17:12:48.005224 IP 167.99.182.113.22 > 72.141.83.5.49919: Flags [P.], seq 2142864:2143020, ack 1081, win 592, length 156
17:12:48.005300 IP 167.99.182.113.22 > 72.141.83.5.49919: Flags [P.], seq 2143020:2143176, ack 1081, win 592, length 156
17:12:48.005384 IP 167.99.182.113.22 > 72.141.83.5.49919: Flags [P.], seq 2143176:2143332, ack 1081, win 592, length 156
17:12:48.005452 IP 167.99.182.113.22 > 72.141.83.5.49919: Flags [P.], seq 2143332:2143488, ack 1081, win 592, length 156
17:12:48.005508 IP 167.99.182.113.22 > 72.141.83.5.49919: Flags [P.], seq 2143488:2143644, ack 1081, win 592, length 156
17:12:48.005572 IP 167.99.182.113.22 > 72.141.83.5.49919: Flags [P.], seq 2143644:2143800, ack 1081, win 592, length 156
17:12:48.005638 IP 167.99.182.113.22 > 72.141.83.5.49919: Flags [P.], seq 2143800:2143956, ack 1081, win 592, length 156
17:12:48.005697 IP 167.99.182.113.22 > 72.141.83.5.49919: Flags [P.], seq 2143956:2144112, ack 1081, win 592, length 156
17:12:48.005759 IP 167.99.182.113.22 > 72.141.83.5.49919: Flags [P.], seq 2144112:2144268, ack 1081, win 592, length 156
17:12:48.005817 IP 167.99.182.113.22 > 72.141.83.5.49919: Flags [P.], seq 2144268:2144424, ack 1081, win 592, length 156
17:12:48.005887 IP 167.99.182.113.22 > 72.141.83.5.49919: Flags [P.], seq 2144424:2144580, ack 1081, win 592, length 156
17:12:48.005946 IP 167.99.182.113.22 > 72.141.83.5.49919: Flags [P.], seq 2144580:2144736, ack 1081, win 592, length 156
17:12:48.006002 IP 167.99.182.113.22 > 72.141.83.5.49919: Flags [P.], seq 2144736:2144892, ack 1081, win 592, length 156
17:12:48.006061 IP 167.99.182.113.22 > 72.141.83.5.49919: Flags [P.], seq 2144892:2145048, ack 1081, win 592, length 156
17:12:48.006118 IP 167.99.182.113.22 > 72.141.83.5.49919: Flags [P.], seq 2145048:2145204, ack 1081, win 592, length 156
17:12:48.006185 IP 167.99.182.113.22 > 72.141.83.5.49919: Flags [P.], seq 2145204:2145360, ack 1081, win 592, length 156
17:12:48.006252 IP 167.99.182.113.22 > 72.141.83.5.49919: Flags [P.], seq 2145360:2145516, ack 1081, win 592, length 156
17:12:48.006312 IP 167.99.182.113.22 > 72.141.83.5.49919: Flags [P.], seq 2145516:2145672, ack 1081, win 592, length 156
17:12:48.006372 IP 167.99.182.113.22 > 72.141.83.5.49919: Flags [P.], seq 2145672:2145828, ack 1081, win 592, length 156
17:12:48.006437 IP 167.99.182.113.22 > 72.141.83.5.49919: Flags [P.], seq 2145828:2145984, ack 1081, win 592, length 156
17:12:48.006506 IP 167.99.182.113.22 > 72.141.83.5.49919: Flags [P.], seq 2145984:2146140, ack 1081, win 592, length 156
17:12:48.006567 IP 167.99.182.113.22 > 72.141.83.5.49919: Flags [P.], seq 2146140:2146296, ack 1081, win 592, length 156
17:12:48.006631 IP 167.99.182.113.22 > 72.141.83.5.49919: Flags [P.], seq 2146296:2146452, ack 1081, win 592, length 156
17:12:48.006693 IP 167.99.182.113.22 > 72.141.83.5.49919: Flags [P.], seq 2146452:2146608, ack 1081, win 592, length 156
17:12:48.006764 IP 167.99.182.113.22 > 72.141.83.5.49919: Flags [P.], seq 2146608:2146764, ack 1081, win 592, length 156
17:12:48.006822 IP 167.99.182.113.22 > 72.141.83.5.49919: Flags [P.], seq 2146764:2146920, ack 1081, win 592, length 156
17:12:48.006882 IP 167.99.182.113.22 > 72.141.83.5.49919: Flags [P.], seq 2146920:2147076, ack 1081, win 592, length 156
17:12:48.006945 IP 167.99.182.113.22 > 72.141.83.5.49919: Flags [P.], seq 2147076:2147232, ack 1081, win 592, length 156
17:12:48.007007 IP 167.99.182.113.22 > 72.141.83.5.49919: Flags [P.], seq 2147232:2147388, ack 1081, win 592, length 156
17:12:48.007066 IP 167.99.182.113.22 > 72.141.83.5.49919: Flags [P.], seq 2147388:2147544, ack 1081, win 592, length 156
17:12:48.007128 IP 167.99.182.113.22 > 72.141.83.5.49919: Flags [P.], seq 2147544:2147700, ack 1081, win 592, length 156
17:12:48.007201 IP 167.99.182.113.22 > 72.141.83.5.49919: Flags [P.], seq 2147700:2147856, ack 1081, win 592, length 156
17:12:48.007259 IP 167.99.182.113.22 > 72.141.83.5.49919: Flags [P.], seq 2147856:2148012, ack 1081, win 592, length 156
17:12:48.007316 IP 167.99.182.113.22 > 72.141.83.5.49919: Flags [P.], seq 2148012:2148168, ack 1081, win 592, length 156
17:12:48.007391 IP 167.99.182.113.22 > 72.141.83.5.49919: Flags [P.], seq 2148168:2148324, ack 1081, win 592, length 156
17:12:48.007449 IP 167.99.182.113.22 > 72.141.83.5.49919: Flags [P.], seq 2148324:2148480, ack 1081, win 592, length 156
17:12:48.007509 IP 167.99.182.113.22 > 72.141.83.5.49919: Flags [P.], seq 2148480:2148636, ack 1081, win 592, length 156
17:12:48.007574 IP 167.99.182.113.22 > 72.141.83.5.49919: Flags [P.], seq 2148636:2148792, ack 1081, win 592, length 156
17:12:48.007631 IP 167.99.182.113.22 > 72.141.83.5.49919: Flags [P.], seq 2148792:2148948, ack 1081, win 592, length 156
17:12:48.007727 IP 167.99.182.113.22 > 72.141.83.5.49919: Flags [P.], seq 2148948:2149104, ack 1081, win 592, length 156
17:12:48.007805 IP 167.99.182.113.22 > 72.141.83.5.49919: Flags [P.], seq 2149104:2149260, ack 1081, win 592, length 156
17:12:48.007886 IP 167.99.182.113.22 > 72.141.83.5.49919: Flags [P.], seq 2149260:2149416, ack 1081, win 592, length 156
17:12:48.007951 IP 167.99.182.113.22 > 72.141.83.5.49919: Flags [P.], seq 2149416:2149572, ack 1081, win 592, length 156
17:12:48.008011 IP 167.99.182.113.22 > 72.141.83.5.49919: Flags [P.], seq 2149572:2149728, ack 1081, win 592, length 156
17:12:48.008075 IP 167.99.182.113.22 > 72.141.83.5.49919: Flags [P.], seq 2149728:2149884, ack 1081, win 592, length 156
17:12:48.008137 IP 167.99.182.113.22 > 72.141.83.5.49919: Flags [P.], seq 2149884:2150040, ack 1081, win 592, length 156
17:12:48.008196 IP 167.99.182.113.22 > 72.141.83.5.49919: Flags [P.], seq 2150040:2150196, ack 1081, win 592, length 156
17:12:48.008252 IP 167.99.182.113.22 > 72.141.83.5.49919: Flags [P.], seq 2150196:2150352, ack 1081, win 592, length 156
17:12:48.008308 IP 167.99.182.113.22 > 72.141.83.5.49919: Flags [P.], seq 2150352:2150508, ack 1081, win 592, length 156
17:12:48.008378 IP 167.99.182.113.22 > 72.141.83.5.49919: Flags [P.], seq 2150508:2150664, ack 1081, win 592, length 156
17:12:48.008459 IP 167.99.182.113.22 > 72.141.83.5.49919: Flags [P.], seq 2150664:2150820, ack 1081, win 592, length 156
17:12:48.008528 IP 167.99.182.113.22 > 72.141.83.5.49919: Flags [P.], seq 2150820:2150976, ack 1081, win 592, length 156
17:12:48.008592 IP 167.99.182.113.22 > 72.141.83.5.49919: Flags [P.], seq 2150976:2151132, ack 1081, win 592, length 156
17:12:48.008659 IP 167.99.182.113.22 > 72.141.83.5.49919: Flags [P.], seq 2151132:2151288, ack 1081, win 592, length 156
17:12:48.008726 IP 167.99.182.113.22 > 72.141.83.5.49919: Flags [P.], seq 2151288:2151444, ack 1081, win 592, length 156
17:12:48.008782 IP 167.99.182.113.22 > 72.141.83.5.49919: Flags [P.], seq 2151444:2151600, ack 1081, win 592, length 156
17:12:48.008838 IP 167.99.182.113.22 > 72.141.83.5.49919: Flags [P.], seq 2151600:2151756, ack 1081, win 592, length 156
17:12:48.008903 IP 167.99.182.113.22 > 72.141.83.5.49919: Flags [P.], seq 2151756:2151912, ack 1081, win 592, length 156
17:12:48.008965 IP 167.99.182.113.22 > 72.141.83.5.49919: Flags [P.], seq 2151912:2152068, ack 1081, win 592, length 156
17:12:48.009023 IP 167.99.182.113.22 > 72.141.83.5.49919: Flags [P.], seq 2152068:2152224, ack 1081, win 592, length 156
17:12:48.009089 IP 167.99.182.113.22 > 72.141.83.5.49919: Flags [P.], seq 2152224:2152380, ack 1081, win 592, length 156
17:12:48.009154 IP 167.99.182.113.22 > 72.141.83.5.49919: Flags [P.], seq 2152380:2152536, ack 1081, win 592, length 156
17:12:48.009214 IP 167.99.182.113.22 > 72.141.83.5.49919: Flags [P.], seq 2152536:2152692, ack 1081, win 592, length 156
17:12:48.009282 IP 167.99.182.113.22 > 72.141.83.5.49919: Flags [P.], seq 2152692:2152848, ack 1081, win 592, length 156
17:12:48.009356 IP 167.99.182.113.22 > 72.141.83.5.49919: Flags [P.], seq 2152848:2153004, ack 1081, win 592, length 156
17:12:48.009413 IP 167.99.182.113.22 > 72.141.83.5.49919: Flags [P.], seq 2153004:2153160, ack 1081, win 592, length 156
17:12:48.009479 IP 167.99.182.113.22 > 72.141.83.5.49919: Flags [P.], seq 2153160:2153316, ack 1081, win 592, length 156
17:12:48.009543 IP 167.99.182.113.22 > 72.141.83.5.49919: Flags [P.], seq 2153316:2153472, ack 1081, win 592, length 156
17:12:48.009598 IP 167.99.182.113.22 > 72.141.83.5.49919: Flags [P.], seq 2153472:2153628, ack 1081, win 592, length 156
17:12:48.009660 IP 167.99.182.113.22 > 72.141.83.5.49919: Flags [P.], seq 2153628:2153784, ack 1081, win 592, length 156
17:12:48.009721 IP 167.99.182.113.22 > 72.141.83.5.49919: Flags [P.], seq 2153784:2153940, ack 1081, win 592, length 156
17:12:48.009781 IP 167.99.182.113.22 > 72.141.83.5.49919: Flags [P.], seq 2153940:2154096, ack 1081, win 592, length 156
17:12:48.009843 IP 167.99.182.113.22 > 72.141.83.5.49919: Flags [P.], seq 2154096:2154252, ack 1081, win 592, length 156
17:12:48.009902 IP 167.99.182.113.22 > 72.141.83.5.49919: Flags [P.], seq 2154252:2154408, ack 1081, win 592, length 156
17:12:48.009963 IP 167.99.182.113.22 > 72.141.83.5.49919: Flags [P.], seq 2154408:2154564, ack 1081, win 592, length 156
17:12:48.010022 IP 167.99.182.113.22 > 72.141.83.5.49919: Flags [P.], seq 2154564:2154720, ack 1081, win 592, length 156
17:12:48.010079 IP 167.99.182.113.22 > 72.141.83.5.49919: Flags [P.], seq 2154720:2154876, ack 1081, win 592, length 156
17:12:48.010137 IP 167.99.182.113.22 > 72.141.83.5.49919: Flags [P.], seq 2154876:2155032, ack 1081, win 592, length 156
17:12:48.010199 IP 167.99.182.113.22 > 72.141.83.5.49919: Flags [P.], seq 2155032:2155188, ack 1081, win 592, length 156
17:12:48.010260 IP 167.99.182.113.22 > 72.141.83.5.49919: Flags [P.], seq 2155188:2155344, ack 1081, win 592, length 156
17:12:48.010316 IP 167.99.182.113.22 > 72.141.83.5.49919: Flags [P.], seq 2155344:2155500, ack 1081, win 592, length 156
17:12:48.010381 IP 167.99.182.113.22 > 72.141.83.5.49919: Flags [P.], seq 2155500:2155656, ack 1081, win 592, length 156
17:12:48.010447 IP 167.99.182.113.22 > 72.141.83.5.49919: Flags [P.], seq 2155656:2155812, ack 1081, win 592, length 156
17:12:48.010507 IP 167.99.182.113.22 > 72.141.83.5.49919: Flags [P.], seq 2155812:2155968, ack 1081, win 592, length 156
17:12:48.010563 IP 167.99.182.113.22 > 72.141.83.5.49919: Flags [P.], seq 2155968:2156124, ack 1081, win 592, length 156
17:12:48.010634 IP 167.99.182.113.22 > 72.141.83.5.49919: Flags [P.], seq 2156124:2156280, ack 1081, win 592, length 156
17:12:48.010692 IP 167.99.182.113.22 > 72.141.83.5.49919: Flags [P.], seq 2156280:2156436, ack 1081, win 592, length 156
17:12:48.010752 IP 167.99.182.113.22 > 72.141.83.5.49919: Flags [P.], seq 2156436:2156592, ack 1081, win 592, length 156
17:12:48.010809 IP 167.99.182.113.22 > 72.141.83.5.49919: Flags [P.], seq 2156592:2156748, ack 1081, win 592, length 156
17:12:48.010881 IP 167.99.182.113.22 > 72.141.83.5.49919: Flags [P.], seq 2156748:2156904, ack 1081, win 592, length 156
17:12:48.010943 IP 167.99.182.113.22 > 72.141.83.5.49919: Flags [P.], seq 2156904:2157060, ack 1081, win 592, length 156
17:12:48.011000 IP 167.99.182.113.22 > 72.141.83.5.49919: Flags [P.], seq 2157060:2157216, ack 1081, win 592, length 156
17:12:48.011080 IP 167.99.182.113.22 > 72.141.83.5.49919: Flags [P.], seq 2157216:2157372, ack 1081, win 592, length 156
17:12:48.011145 IP 167.99.182.113.22 > 72.141.83.5.49919: Flags [P.], seq 2157372:2157528, ack 1081, win 592, length 156
17:12:48.011223 IP 167.99.182.113.22 > 72.141.83.5.49919: Flags [P.], seq 2157528:2157684, ack 1081, win 592, length 156
17:12:48.011288 IP 167.99.182.113.22 > 72.141.83.5.49919: Flags [P.], seq 2157684:2157840, ack 1081, win 592, length 156
17:12:48.011347 IP 167.99.182.113.22 > 72.141.83.5.49919: Flags [P.], seq 2157840:2157996, ack 1081, win 592, length 156
17:12:48.011403 IP 167.99.182.113.22 > 72.141.83.5.49919: Flags [P.], seq 2157996:2158152, ack 1081, win 592, length 156
17:12:48.011469 IP 167.99.182.113.22 > 72.141.83.5.49919: Flags [P.], seq 2158152:2158308, ack 1081, win 592, length 156
17:12:48.011532 IP 167.99.182.113.22 > 72.141.83.5.49919: Flags [P.], seq 2158308:2158464, ack 1081, win 592, length 156
17:12:48.011594 IP 167.99.182.113.22 > 72.141.83.5.49919: Flags [P.], seq 2158464:2158620, ack 1081, win 592, length 156
17:12:48.011656 IP 167.99.182.113.22 > 72.141.83.5.49919: Flags [P.], seq 2158620:2158776, ack 1081, win 592, length 156
17:12:48.011719 IP 167.99.182.113.22 > 72.141.83.5.49919: Flags [P.], seq 2158776:2158932, ack 1081, win 592, length 156
17:12:48.011782 IP 167.99.182.113.22 > 72.141.83.5.49919: Flags [P.], seq 2158932:2159088, ack 1081, win 592, length 156
17:12:48.011840 IP 167.99.182.113.22 > 72.141.83.5.49919: Flags [P.], seq 2159088:2159244, ack 1081, win 592, length 156
17:12:48.011905 IP 167.99.182.113.22 > 72.141.83.5.49919: Flags [P.], seq 2159244:2159400, ack 1081, win 592, length 156
17:12:48.011974 IP 167.99.182.113.22 > 72.141.83.5.49919: Flags [P.], seq 2159400:2159556, ack 1081, win 592, length 156
17:12:48.012035 IP 167.99.182.113.22 > 72.141.83.5.49919: Flags [P.], seq 2159556:2159712, ack 1081, win 592, length 156
17:12:48.012096 IP 167.99.182.113.22 > 72.141.83.5.49919: Flags [P.], seq 2159712:2159868, ack 1081, win 592, length 156
17:12:48.012158 IP 167.99.182.113.22 > 72.141.83.5.49919: Flags [P.], seq 2159868:2160024, ack 1081, win 592, length 156
17:12:48.012215 IP 167.99.182.113.22 > 72.141.83.5.49919: Flags [P.], seq 2160024:2160180, ack 1081, win 592, length 156
17:12:48.012273 IP 167.99.182.113.22 > 72.141.83.5.49919: Flags [P.], seq 2160180:2160336, ack 1081, win 592, length 156
17:12:48.012327 IP 72.141.83.5.49919 > 167.99.182.113.22: Flags [.], ack 2031636, win 12376, length 0
17:12:48.012327 IP 72.141.83.5.49919 > 167.99.182.113.22: Flags [P.], seq 1081:1117, ack 2031636, win 12376, length 36
17:12:48.012327 IP 72.141.83.5.49919 > 167.99.182.113.22: Flags [.], ack 2126952, win 12267, length 0
17:12:48.012327 IP 72.141.83.5.49919 > 167.99.182.113.22: Flags [.], ack 2127732, win 12264, length 0
17:12:48.012671 IP 167.99.182.113.22 > 72.141.83.5.49919: Flags [P.], seq 2160336:2160492, ack 1117, win 592, length 156
17:12:48.012786 IP 167.99.182.113.22 > 72.141.83.5.49919: Flags [P.], seq 2160492:2161080, ack 1117, win 592, length 588
17:12:48.012846 IP 167.99.182.113.22 > 72.141.83.5.49919: Flags [P.], seq 2161080:2161236, ack 1117, win 592, length 156
17:12:48.012901 IP 167.99.182.113.22 > 72.141.83.5.49919: Flags [P.], seq 2161236:2161392, ack 1117, win 592, length 156
17:12:48.012958 IP 167.99.182.113.22 > 72.141.83.5.49919: Flags [P.], seq 2161392:2161548, ack 1117, win 592, length 156
17:12:48.013014 IP 167.99.182.113.22 > 72.141.83.5.49919: Flags [P.], seq 2161548:2161704, ack 1117, win 592, length 156
17:12:48.013069 IP 167.99.182.113.22 > 72.141.83.5.49919: Flags [P.], seq 2161704:2161860, ack 1117, win 592, length 156
17:12:48.013125 IP 167.99.182.113.22 > 72.141.83.5.49919: Flags [P.], seq 2161860:2162016, ack 1117, win 592, length 156
17:12:48.013181 IP 167.99.182.113.22 > 72.141.83.5.49919: Flags [P.], seq 2162016:2162172, ack 1117, win 592, length 156
17:12:48.013247 IP 167.99.182.113.22 > 72.141.83.5.49919: Flags [P.], seq 2162172:2162328, ack 1117, win 592, length 156
17:12:48.013306 IP 167.99.182.113.22 > 72.141.83.5.49919: Flags [P.], seq 2162328:2162484, ack 1117, win 592, length 156
17:12:48.013389 IP 167.99.182.113.22 > 72.141.83.5.49919: Flags [P.], seq 2162484:2162640, ack 1117, win 592, length 156
17:12:48.013450 IP 167.99.182.113.22 > 72.141.83.5.49919: Flags [P.], seq 2162640:2162796, ack 1117, win 592, length 156
17:12:48.013509 IP 167.99.182.113.22 > 72.141.83.5.49919: Flags [P.], seq 2162796:2162952, ack 1117, win 592, length 156
17:12:48.013565 IP 167.99.182.113.22 > 72.141.83.5.49919: Flags [P.], seq 2162952:2163108, ack 1117, win 592, length 156
17:12:48.013637 IP 167.99.182.113.22 > 72.141.83.5.49919: Flags [P.], seq 2163108:2163264, ack 1117, win 592, length 156
17:12:48.013698 IP 167.99.182.113.22 > 72.141.83.5.49919: Flags [P.], seq 2163264:2163420, ack 1117, win 592, length 156
17:12:48.013756 IP 167.99.182.113.22 > 72.141.83.5.49919: Flags [P.], seq 2163420:2163576, ack 1117, win 592, length 156
17:12:48.013819 IP 167.99.182.113.22 > 72.141.83.5.49919: Flags [P.], seq 2163576:2163732, ack 1117, win 592, length 156
17:12:48.013875 IP 167.99.182.113.22 > 72.141.83.5.49919: Flags [P.], seq 2163732:2163888, ack 1117, win 592, length 156
17:12:48.013930 IP 167.99.182.113.22 > 72.141.83.5.49919: Flags [P.], seq 2163888:2164044, ack 1117, win 592, length 156
17:12:48.013985 IP 167.99.182.113.22 > 72.141.83.5.49919: Flags [P.], seq 2164044:2164200, ack 1117, win 592, length 156
17:12:48.014040 IP 167.99.182.113.22 > 72.141.83.5.49919: Flags [P.], seq 2164200:2164356, ack 1117, win 592, length 156
17:12:48.014096 IP 167.99.182.113.22 > 72.141.83.5.49919: Flags [P.], seq 2164356:2164512, ack 1117, win 592, length 156
17:12:48.014159 IP 167.99.182.113.22 > 72.141.83.5.49919: Flags [P.], seq 2164512:2164668, ack 1117, win 592, length 156
17:12:48.014216 IP 167.99.182.113.22 > 72.141.83.5.49919: Flags [P.], seq 2164668:2164824, ack 1117, win 592, length 156
17:12:48.014272 IP 167.99.182.113.22 > 72.141.83.5.49919: Flags [P.], seq 2164824:2164980, ack 1117, win 592, length 156
17:12:48.014333 IP 167.99.182.113.22 > 72.141.83.5.49919: Flags [P.], seq 2164980:2165136, ack 1117, win 592, length 156
17:12:48.014393 IP 167.99.182.113.22 > 72.141.83.5.49919: Flags [P.], seq 2165136:2165292, ack 1117, win 592, length 156
17:12:48.014472 IP 167.99.182.113.22 > 72.141.83.5.49919: Flags [P.], seq 2165292:2165448, ack 1117, win 592, length 156
17:12:48.014533 IP 167.99.182.113.22 > 72.141.83.5.49919: Flags [P.], seq 2165448:2165604, ack 1117, win 592, length 156
17:12:48.014589 IP 167.99.182.113.22 > 72.141.83.5.49919: Flags [P.], seq 2165604:2165760, ack 1117, win 592, length 156
17:12:48.014669 IP 167.99.182.113.22 > 72.141.83.5.49919: Flags [P.], seq 2165760:2165916, ack 1117, win 592, length 156
17:12:48.014740 IP 167.99.182.113.22 > 72.141.83.5.49919: Flags [P.], seq 2165916:2166072, ack 1117, win 592, length 156
17:12:48.014796 IP 167.99.182.113.22 > 72.141.83.5.49919: Flags [P.], seq 2166072:2166228, ack 1117, win 592, length 156
17:12:48.014852 IP 167.99.182.113.22 > 72.141.83.5.49919: Flags [P.], seq 2166228:2166384, ack 1117, win 592, length 156
17:12:48.014907 IP 167.99.182.113.22 > 72.141.83.5.49919: Flags [P.], seq 2166384:2166540, ack 1117, win 592, length 156
17:12:48.014962 IP 167.99.182.113.22 > 72.141.83.5.49919: Flags [P.], seq 2166540:2166696, ack 1117, win 592, length 156
17:12:48.015018 IP 167.99.182.113.22 > 72.141.83.5.49919: Flags [P.], seq 2166696:2166852, ack 1117, win 592, length 156
17:12:48.015086 IP 167.99.182.113.22 > 72.141.83.5.49919: Flags [P.], seq 2166852:2167008, ack 1117, win 592, length 156
17:12:48.015148 IP 167.99.182.113.22 > 72.141.83.5.49919: Flags [P.], seq 2167008:2167164, ack 1117, win 592, length 156
17:12:48.015224 IP 167.99.182.113.22 > 72.141.83.5.49919: Flags [P.], seq 2167164:2167320, ack 1117, win 592, length 156
17:12:48.015285 IP 167.99.182.113.22 > 72.141.83.5.49919: Flags [P.], seq 2167320:2167476, ack 1117, win 592, length 156
17:12:48.015343 IP 167.99.182.113.22 > 72.141.83.5.49919: Flags [P.], seq 2167476:2167632, ack 1117, win 592, length 156
17:12:48.015407 IP 167.99.182.113.22 > 72.141.83.5.49919: Flags [P.], seq 2167632:2167788, ack 1117, win 592, length 156
17:12:48.015500 IP 167.99.182.113.22 > 72.141.83.5.49919: Flags [P.], seq 2167788:2167944, ack 1117, win 592, length 156
17:12:48.015568 IP 167.99.182.113.22 > 72.141.83.5.49919: Flags [P.], seq 2167944:2168100, ack 1117, win 592, length 156
17:12:48.015626 IP 167.99.182.113.22 > 72.141.83.5.49919: Flags [P.], seq 2168100:2168256, ack 1117, win 592, length 156
17:12:48.015684 IP 167.99.182.113.22 > 72.141.83.5.49919: Flags [P.], seq 2168256:2168412, ack 1117, win 592, length 156
17:12:48.015740 IP 167.99.182.113.22 > 72.141.83.5.49919: Flags [P.], seq 2168412:2168568, ack 1117, win 592, length 156
17:12:48.015794 IP 167.99.182.113.22 > 72.141.83.5.49919: Flags [P.], seq 2168568:2168724, ack 1117, win 592, length 156
17:12:48.015863 IP 167.99.182.113.22 > 72.141.83.5.49919: Flags [P.], seq 2168724:2168880, ack 1117, win 592, length 156
17:12:48.015933 IP 167.99.182.113.22 > 72.141.83.5.49919: Flags [P.], seq 2168880:2169036, ack 1117, win 592, length 156
17:12:48.015999 IP 167.99.182.113.22 > 72.141.83.5.49919: Flags [P.], seq 2169036:2169192, ack 1117, win 592, length 156
17:12:48.016058 IP 167.99.182.113.22 > 72.141.83.5.49919: Flags [P.], seq 2169192:2169348, ack 1117, win 592, length 156
17:12:48.016117 IP 167.99.182.113.22 > 72.141.83.5.49919: Flags [P.], seq 2169348:2169504, ack 1117, win 592, length 156
17:12:48.016180 IP 167.99.182.113.22 > 72.141.83.5.49919: Flags [P.], seq 2169504:2169660, ack 1117, win 592, length 156
17:12:48.016240 IP 167.99.182.113.22 > 72.141.83.5.49919: Flags [P.], seq 2169660:2169816, ack 1117, win 592, length 156
17:12:48.016321 IP 167.99.182.113.22 > 72.141.83.5.49919: Flags [P.], seq 2169816:2169972, ack 1117, win 592, length 156
17:12:48.016391 IP 167.99.182.113.22 > 72.141.83.5.49919: Flags [P.], seq 2169972:2170128, ack 1117, win 592, length 156
17:12:48.016454 IP 167.99.182.113.22 > 72.141.83.5.49919: Flags [P.], seq 2170128:2170284, ack 1117, win 592, length 156
17:12:48.016516 IP 167.99.182.113.22 > 72.141.83.5.49919: Flags [P.], seq 2170284:2170440, ack 1117, win 592, length 156
17:12:48.016574 IP 167.99.182.113.22 > 72.141.83.5.49919: Flags [P.], seq 2170440:2170596, ack 1117, win 592, length 156
17:12:48.016636 IP 167.99.182.113.22 > 72.141.83.5.49919: Flags [P.], seq 2170596:2170752, ack 1117, win 592, length 156
17:12:48.016698 IP 167.99.182.113.22 > 72.141.83.5.49919: Flags [P.], seq 2170752:2170908, ack 1117, win 592, length 156
17:12:48.016759 IP 167.99.182.113.22 > 72.141.83.5.49919: Flags [P.], seq 2170908:2171064, ack 1117, win 592, length 156
17:12:48.016816 IP 167.99.182.113.22 > 72.141.83.5.49919: Flags [P.], seq 2171064:2171220, ack 1117, win 592, length 156
17:12:48.016877 IP 167.99.182.113.22 > 72.141.83.5.49919: Flags [P.], seq 2171220:2171376, ack 1117, win 592, length 156
17:12:48.016944 IP 167.99.182.113.22 > 72.141.83.5.49919: Flags [P.], seq 2171376:2171532, ack 1117, win 592, length 156
17:12:48.017004 IP 167.99.182.113.22 > 72.141.83.5.49919: Flags [P.], seq 2171532:2171688, ack 1117, win 592, length 156
17:12:48.017068 IP 167.99.182.113.22 > 72.141.83.5.49919: Flags [P.], seq 2171688:2171844, ack 1117, win 592, length 156
17:12:48.017133 IP 167.99.182.113.22 > 72.141.83.5.49919: Flags [P.], seq 2171844:2172000, ack 1117, win 592, length 156
17:12:48.017198 IP 167.99.182.113.22 > 72.141.83.5.49919: Flags [P.], seq 2172000:2172156, ack 1117, win 592, length 156
17:12:48.017262 IP 167.99.182.113.22 > 72.141.83.5.49919: Flags [P.], seq 2172156:2172312, ack 1117, win 592, length 156
17:12:48.017336 IP 167.99.182.113.22 > 72.141.83.5.49919: Flags [P.], seq 2172312:2172468, ack 1117, win 592, length 156
17:12:48.017403 IP 167.99.182.113.22 > 72.141.83.5.49919: Flags [P.], seq 2172468:2172624, ack 1117, win 592, length 156
17:12:48.017464 IP 167.99.182.113.22 > 72.141.83.5.49919: Flags [P.], seq 2172624:2172780, ack 1117, win 592, length 156
17:12:48.017526 IP 167.99.182.113.22 > 72.141.83.5.49919: Flags [P.], seq 2172780:2172936, ack 1117, win 592, length 156
17:12:48.017596 IP 167.99.182.113.22 > 72.141.83.5.49919: Flags [P.], seq 2172936:2173092, ack 1117, win 592, length 156
17:12:48.017655 IP 167.99.182.113.22 > 72.141.83.5.49919: Flags [P.], seq 2173092:2173248, ack 1117, win 592, length 156
17:12:48.017713 IP 167.99.182.113.22 > 72.141.83.5.49919: Flags [P.], seq 2173248:2173404, ack 1117, win 592, length 156
17:12:48.017769 IP 167.99.182.113.22 > 72.141.83.5.49919: Flags [P.], seq 2173404:2173560, ack 1117, win 592, length 156
17:12:48.017834 IP 167.99.182.113.22 > 72.141.83.5.49919: Flags [P.], seq 2173560:2173716, ack 1117, win 592, length 156
17:12:48.017894 IP 167.99.182.113.22 > 72.141.83.5.49919: Flags [P.], seq 2173716:2173872, ack 1117, win 592, length 156
17:12:48.017956 IP 167.99.182.113.22 > 72.141.83.5.49919: Flags [P.], seq 2173872:2174028, ack 1117, win 592, length 156
17:12:48.018016 IP 167.99.182.113.22 > 72.141.83.5.49919: Flags [P.], seq 2174028:2174184, ack 1117, win 592, length 156
17:12:48.018074 IP 167.99.182.113.22 > 72.141.83.5.49919: Flags [P.], seq 2174184:2174340, ack 1117, win 592, length 156
17:12:48.018139 IP 167.99.182.113.22 > 72.141.83.5.49919: Flags [P.], seq 2174340:2174496, ack 1117, win 592, length 156
17:12:48.018199 IP 167.99.182.113.22 > 72.141.83.5.49919: Flags [P.], seq 2174496:2174652, ack 1117, win 592, length 156
17:12:48.018257 IP 167.99.182.113.22 > 72.141.83.5.49919: Flags [P.], seq 2174652:2174808, ack 1117, win 592, length 156
17:12:48.018314 IP 167.99.182.113.22 > 72.141.83.5.49919: Flags [P.], seq 2174808:2174964, ack 1117, win 592, length 156
17:12:48.018371 IP 167.99.182.113.22 > 72.141.83.5.49919: Flags [P.], seq 2174964:2175120, ack 1117, win 592, length 156
17:12:48.018429 IP 167.99.182.113.22 > 72.141.83.5.49919: Flags [P.], seq 2175120:2175276, ack 1117, win 592, length 156
17:12:48.018489 IP 167.99.182.113.22 > 72.141.83.5.49919: Flags [P.], seq 2175276:2175432, ack 1117, win 592, length 156
17:12:48.018544 IP 167.99.182.113.22 > 72.141.83.5.49919: Flags [P.], seq 2175432:2175588, ack 1117, win 592, length 156
17:12:48.018614 IP 167.99.182.113.22 > 72.141.83.5.49919: Flags [P.], seq 2175588:2175744, ack 1117, win 592, length 156
17:12:48.018677 IP 167.99.182.113.22 > 72.141.83.5.49919: Flags [P.], seq 2175744:2175900, ack 1117, win 592, length 156
17:12:48.018732 IP 167.99.182.113.22 > 72.141.83.5.49919: Flags [P.], seq 2175900:2176056, ack 1117, win 592, length 156
17:12:48.018799 IP 167.99.182.113.22 > 72.141.83.5.49919: Flags [P.], seq 2176056:2176212, ack 1117, win 592, length 156
17:12:48.018856 IP 167.99.182.113.22 > 72.141.83.5.49919: Flags [P.], seq 2176212:2176368, ack 1117, win 592, length 156
17:12:48.018912 IP 167.99.182.113.22 > 72.141.83.5.49919: Flags [P.], seq 2176368:2176524, ack 1117, win 592, length 156
17:12:48.018954 IP 72.141.83.5.49919 > 167.99.182.113.22: Flags [P.], seq 1117:1153, ack 2127732, win 12264, length 36
17:12:48.018954 IP 72.141.83.5.49919 > 167.99.182.113.22: Flags [.], ack 2127732, win 12381, length 0